Sheet: DimDates
A1: dateKey | B1: fullDate | C1: day | D1: week | E1: year | F1: quarter
A2: 1 | B2: of:=DATE(2020;1;1) -> 2020-01-01 | C2: of:=DAY([.B2]) -> 1 | D2: of:=WEEKNUM([.B2];1) -> 1 | E2: of:=YEAR([.B2]) -> 2020 | F2: of:=ROUNDUP(MONTH([.B2])/3;0) -> 1
A3: of:=[.A2]+1 -> 2 | B3: of:=[.B2]+1 -> 2020-01-02 | C3: of:=DAY([.B3]) -> 2 | D3: of:=WEEKNUM([.B3];1) -> 1 | E3: of:=YEAR([.B3]) -> 2020 | F3: of:=ROUNDUP(MONTH([.B3])/3;0) -> 1
A4: of:=[.A3]+1 -> 3 | B4: of:=[.B3]+1 -> 2020-01-03 | C4: of:=DAY([.B4]) -> 3 | D4: of:=WEEKNUM([.B4];1) -> 1 | E4: of:=YEAR([.B4]) -> 2020 | F4: of:=ROUNDUP(MONTH([.B4])/3;0) -> 1
A5: of:=[.A4]+1 -> 4 | B5: of:=[.B4]+1 -> 2020-01-04 | C5: of:=DAY([.B5]) -> 4 | D5: of:=WEEKNUM([.B5];1) -> 1 | E5: of:=YEAR([.B5]) -> 2020 | F5: of:=ROUNDUP(MONTH([.B5])/3;0) -> 1
A6: of:=[.A5]+1 -> 5 | B6: of:=[.B5]+1 -> 2020-01-05 | C6: of:=DAY([.B6]) -> 5 | D6: of:=WEEKNUM([.B6];1) -> 2 | E6: of:=YEAR([.B6]) -> 2020 | F6: of:=ROUNDUP(MONTH([.B6])/3;0) -> 1
A7: of:=[.A6]+1 -> 6 | B7: of:=[.B6]+1 -> 2020-01-06 | C7: of:=DAY([.B7]) -> 6 | D7: of:=WEEKNUM([.B7];1) -> 2 | E7: of:=YEAR([.B7]) -> 2020 | F7: of:=ROUNDUP(MONTH([.B7])/3;0) -> 1
A8: of:=[.A7]+1 -> 7 | B8: of:=[.B7]+1 -> 2020-01-07 | C8: of:=DAY([.B8]) -> 7 | D8: of:=WEEKNUM([.B8];1) -> 2 | E8: of:=YEAR([.B8]) -> 2020 | F8: of:=ROUNDUP(MONTH([.B8])/3;0) -> 1
A9: of:=[.A8]+1 -> 8 | B9: of:=[.B8]+1 -> 2020-01-08 | C9: of:=DAY([.B9]) -> 8 | D9: of:=WEEKNUM([.B9];1) -> 2 | E9: of:=YEAR([.B9]) -> 2020 | F9: of:=ROUNDUP(MONTH([.B9])/3;0) -> 1
A10: of:=[.A9]+1 -> 9 | B10: of:=[.B9]+1 -> 2020-01-09 | C10: of:=DAY([.B10]) -> 9 | D10: of:=WEEKNUM([.B10];1) -> 2 | E10: of:=YEAR([.B10]) -> 2020 | F10: of:=ROUNDUP(MONTH([.B10])/3;0) -> 1
A11: of:=[.A10]+1 -> 10 | B11: of:=[.B10]+1 -> 2020-01-10 | C11: of:=DAY([.B11]) -> 10 | D11: of:=WEEKNUM([.B11];1) -> 2 | E11: of:=YEAR([.B11]) -> 2020 | F11: of:=ROUNDUP(MONTH([.B11])/3;0) -> 1
A12: of:=[.A11]+1 -> 11 | B12: of:=[.B11]+1 -> 2020-01-11 | C12: of:=DAY([.B12]) -> 11 | D12: of:=WEEKNUM([.B12];1) -> 2 | E12: of:=YEAR([.B12]) -> 2020 | F12: of:=ROUNDUP(MONTH([.B12])/3;0) -> 1
A13: of:=[.A12]+1 -> 12 | B13: of:=[.B12]+1 -> 2020-01-12 | C13: of:=DAY([.B13]) -> 12 | D13: of:=WEEKNUM([.B13];1) -> 3 | E13: of:=YEAR([.B13]) -> 2020 | F13: of:=ROUNDUP(MONTH([.B13])/3;0) -> 1
A14: of:=[.A13]+1 -> 13 | B14: of:=[.B13]+1 -> 2020-01-13 | C14: of:=DAY([.B14]) -> 13 | D14: of:=WEEKNUM([.B14];1) -> 3 | E14: of:=YEAR([.B14]) -> 2020 | F14: of:=ROUNDUP(MONTH([.B14])/3;0) -> 1
A15: of:=[.A14]+1 -> 14 | B15: of:=[.B14]+1 -> 2020-01-14 | C15: of:=DAY([.B15]) -> 14 | D15: of:=WEEKNUM([.B15];1) -> 3 | E15: of:=YEAR([.B15]) -> 2020 | F15: of:=ROUNDUP(MONTH([.B15])/3;0) -> 1
A16: of:=[.A15]+1 -> 15 | B16: of:=[.B15]+1 -> 2020-01-15 | C16: of:=DAY([.B16]) -> 15 | D16: of:=WEEKNUM([.B16];1) -> 3 | E16: of:=YEAR([.B16]) -> 2020 | F16: of:=ROUNDUP(MONTH([.B16])/3;0) -> 1
A17: of:=[.A16]+1 -> 16 | B17: of:=[.B16]+1 -> 2020-01-16 | C17: of:=DAY([.B17]) -> 16 | D17: of:=WEEKNUM([.B17];1) -> 3 | E17: of:=YEAR([.B17]) -> 2020 | F17: of:=ROUNDUP(MONTH([.B17])/3;0) -> 1
A18: of:=[.A17]+1 -> 17 | B18: of:=[.B17]+1 -> 2020-01-17 | C18: of:=DAY([.B18]) -> 17 | D18: of:=WEEKNUM([.B18];1) -> 3 | E18: of:=YEAR([.B18]) -> 2020 | F18: of:=ROUNDUP(MONTH([.B18])/3;0) -> 1
A19: of:=[.A18]+1 -> 18 | B19: of:=[.B18]+1 -> 2020-01-18 | C19: of:=DAY([.B19]) -> 18 | D19: of:=WEEKNUM([.B19];1) -> 3 | E19: of:=YEAR([.B19]) -> 2020 | F19: of:=ROUNDUP(MONTH([.B19])/3;0) -> 1
A20: of:=[.A19]+1 -> 19 | B20: of:=[.B19]+1 -> 2020-01-19 | C20: of:=DAY([.B20]) -> 19 | D20: of:=WEEKNUM([.B20];1) -> 4 | E20: of:=YEAR([.B20]) -> 2020 | F20: of:=ROUNDUP(MONTH([.B20])/3;0) -> 1
A21: of:=[.A20]+1 -> 20 | B21: of:=[.B20]+1 -> 2020-01-20 | C21: of:=DAY([.B21]) -> 20 | D21: of:=WEEKNUM([.B21];1) -> 4 | E21: of:=YEAR([.B21]) -> 2020 | F21: of:=ROUNDUP(MONTH([.B21])/3;0) -> 1
A22: of:=[.A21]+1 -> 21 | B22: of:=[.B21]+1 -> 2020-01-21 | C22: of:=DAY([.B22]) -> 21 | D22: of:=WEEKNUM([.B22];1) -> 4 | E22: of:=YEAR([.B22]) -> 2020 | F22: of:=ROUNDUP(MONTH([.B22])/3;0) -> 1
A23: of:=[.A22]+1 -> 22 | B23: of:=[.B22]+1 -> 2020-01-22 | C23: of:=DAY([.B23]) -> 22 | D23: of:=WEEKNUM([.B23];1) -> 4 | E23: of:=YEAR([.B23]) -> 2020 | F23: of:=ROUNDUP(MONTH([.B23])/3;0) -> 1
A24: of:=[.A23]+1 -> 23 | B24: of:=[.B23]+1 -> 2020-01-23 | C24: of:=DAY([.B24]) -> 23 | D24: of:=WEEKNUM([.B24];1) -> 4 | E24: of:=YEAR([.B24]) -> 2020 | F24: of:=ROUNDUP(MONTH([.B24])/3;0) -> 1
A25: of:=[.A24]+1 -> 24 | B25: of:=[.B24]+1 -> 2020-01-24 | C25: of:=DAY([.B25]) -> 24 | D25: of:=WEEKNUM([.B25];1) -> 4 | E25: of:=YEAR([.B25]) -> 2020 | F25: of:=ROUNDUP(MONTH([.B25])/3;0) -> 1
A26: of:=[.A25]+1 -> 25 | B26: of:=[.B25]+1 -> 2020-01-25 | C26: of:=DAY([.B26]) -> 25 | D26: of:=WEEKNUM([.B26];1) -> 4 | E26: of:=YEAR([.B26]) -> 2020 | F26: of:=ROUNDUP(MONTH([.B26])/3;0) -> 1
A27: of:=[.A26]+1 -> 26 | B27: of:=[.B26]+1 -> 2020-01-26 | C27: of:=DAY([.B27]) -> 26 | D27: of:=WEEKNUM([.B27];1) -> 5 | E27: of:=YEAR([.B27]) -> 2020 | F27: of:=ROUNDUP(MONTH([.B27])/3;0) -> 1
A28: of:=[.A27]+1 -> 27 | B28: of:=[.B27]+1 -> 2020-01-27 | C28: of:=DAY([.B28]) -> 27 | D28: of:=WEEKNUM([.B28];1) -> 5 | E28: of:=YEAR([.B28]) -> 2020 | F28: of:=ROUNDUP(MONTH([.B28])/3;0) -> 1
A29: of:=[.A28]+1 -> 28 | B29: of:=[.B28]+1 -> 2020-01-28 | C29: of:=DAY([.B29]) -> 28 | D29: of:=WEEKNUM([.B29];1) -> 5 | E29: of:=YEAR([.B29]) -> 2020 | F29: of:=ROUNDUP(MONTH([.B29])/3;0) -> 1
A30: of:=[.A29]+1 -> 29 | B30: of:=[.B29]+1 -> 2020-01-29 | C30: of:=DAY([.B30]) -> 29 | D30: of:=WEEKNUM([.B30];1) -> 5 | E30: of:=YEAR([.B30]) -> 2020 | F30: of:=ROUNDUP(MONTH([.B30])/3;0) -> 1
A31: of:=[.A30]+1 -> 30 | B31: of:=[.B30]+1 -> 2020-01-30 | C31: of:=DAY([.B31]) -> 30 | D31: of:=WEEKNUM([.B31];1) -> 5 | E31: of:=YEAR([.B31]) -> 2020 | F31: of:=ROUNDUP(MONTH([.B31])/3;0) -> 1
A32: of:=[.A31]+1 -> 31 | B32: of:=[.B31]+1 -> 2020-01-31 | C32: of:=DAY([.B32]) -> 31 | D32: of:=WEEKNUM([.B32];1) -> 5 | E32: of:=YEAR([.B32]) -> 2020 | F32: of:=ROUNDUP(MONTH([.B32])/3;0) -> 1
A33: of:=[.A32]+1 -> 32 | B33: of:=[.B32]+1 -> 2020-02-01 | C33: of:=DAY([.B33]) -> 1 | D33: of:=WEEKNUM([.B33];1) -> 5 | E33: of:=YEAR([.B33]) -> 2020 | F33: of:=ROUNDUP(MONTH([.B33])/3;0) -> 1
A34: of:=[.A33]+1 -> 33 | B34: of:=[.B33]+1 -> 2020-02-02 | C34: of:=DAY([.B34]) -> 2 | D34: of:=WEEKNUM([.B34];1) -> 6 | E34: of:=YEAR([.B34]) -> 2020 | F34: of:=ROUNDUP(MONTH([.B34])/3;0) -> 1
A35: of:=[.A34]+1 -> 34 | B35: of:=[.B34]+1 -> 2020-02-03 | C35: of:=DAY([.B35]) -> 3 | D35: of:=WEEKNUM([.B35];1) -> 6 | E35: of:=YEAR([.B35]) -> 2020 | F35: of:=ROUNDUP(MONTH([.B35])/3;0) -> 1
A36: of:=[.A35]+1 -> 35 | B36: of:=[.B35]+1 -> 2020-02-04 | C36: of:=DAY([.B36]) -> 4 | D36: of:=WEEKNUM([.B36];1) -> 6 | E36: of:=YEAR([.B36]) -> 2020 | F36: of:=ROUNDUP(MONTH([.B36])/3;0) -> 1
A37: of:=[.A36]+1 -> 36 | B37: of:=[.B36]+1 -> 2020-02-05 | C37: of:=DAY([.B37]) -> 5 | D37: of:=WEEKNUM([.B37];1) -> 6 | E37: of:=YEAR([.B37]) -> 2020 | F37: of:=ROUNDUP(MONTH([.B37])/3;0) -> 1
A38: of:=[.A37]+1 -> 37 | B38: of:=[.B37]+1 -> 2020-02-06 | C38: of:=DAY([.B38]) -> 6 | D38: of:=WEEKNUM([.B38];1) -> 6 | E38: of:=YEAR([.B38]) -> 2020 | F38: of:=ROUNDUP(MONTH([.B38])/3;0) -> 1
A39: of:=[.A38]+1 -> 38 | B39: of:=[.B38]+1 -> 2020-02-07 | C39: of:=DAY([.B39]) -> 7 | D39: of:=WEEKNUM([.B39];1) -> 6 | E39: of:=YEAR([.B39]) -> 2020 | F39: of:=ROUNDUP(MONTH([.B39])/3;0) -> 1
A40: of:=[.A39]+1 -> 39 | B40: of:=[.B39]+1 -> 2020-02-08 | C40: of:=DAY([.B40]) -> 8 | D40: of:=WEEKNUM([.B40];1) -> 6 | E40: of:=YEAR([.B40]) -> 2020 | F40: of:=ROUNDUP(MONTH([.B40])/3;0) -> 1
A41: of:=[.A40]+1 -> 40 | B41: of:=[.B40]+1 -> 2020-02-09 | C41: of:=DAY([.B41]) -> 9 | D41: of:=WEEKNUM([.B41];1) -> 7 | E41: of:=YEAR([.B41]) -> 2020 | F41: of:=ROUNDUP(MONTH([.B41])/3;0) -> 1
A42: of:=[.A41]+1 -> 41 | B42: of:=[.B41]+1 -> 2020-02-10 | C42: of:=DAY([.B42]) -> 10 | D42: of:=WEEKNUM([.B42];1) -> 7 | E42: of:=YEAR([.B42]) -> 2020 | F42: of:=ROUNDUP(MONTH([.B42])/3;0) -> 1
A43: of:=[.A42]+1 -> 42 | B43: of:=[.B42]+1 -> 2020-02-11 | C43: of:=DAY([.B43]) -> 11 | D43: of:=WEEKNUM([.B43];1) -> 7 | E43: of:=YEAR([.B43]) -> 2020 | F43: of:=ROUNDUP(MONTH([.B43])/3;0) -> 1
A44: of:=[.A43]+1 -> 43 | B44: of:=[.B43]+1 -> 2020-02-12 | C44: of:=DAY([.B44]) -> 12 | D44: of:=WEEKNUM([.B44];1) -> 7 | E44: of:=YEAR([.B44]) -> 2020 | F44: of:=ROUNDUP(MONTH([.B44])/3;0) -> 1
A45: of:=[.A44]+1 -> 44 | B45: of:=[.B44]+1 -> 2020-02-13 | C45: of:=DAY([.B45]) -> 13 | D45: of:=WEEKNUM([.B45];1) -> 7 | E45: of:=YEAR([.B45]) -> 2020 | F45: of:=ROUNDUP(MONTH([.B45])/3;0) -> 1
A46: of:=[.A45]+1 -> 45 | B46: of:=[.B45]+1 -> 2020-02-14 | C46: of:=DAY([.B46]) -> 14 | D46: of:=WEEKNUM([.B46];1) -> 7 | E46: of:=YEAR([.B46]) -> 2020 | F46: of:=ROUNDUP(MONTH([.B46])/3;0) -> 1
A47: of:=[.A46]+1 -> 46 | B47: of:=[.B46]+1 -> 2020-02-15 | C47: of:=DAY([.B47]) -> 15 | D47: of:=WEEKNUM([.B47];1) -> 7 | E47: of:=YEAR([.B47]) -> 2020 | F47: of:=ROUNDUP(MONTH([.B47])/3;0) -> 1
A48: of:=[.A47]+1 -> 47 | B48: of:=[.B47]+1 -> 2020-02-16 | C48: of:=DAY([.B48]) -> 16 | D48: of:=WEEKNUM([.B48];1) -> 8 | E48: of:=YEAR([.B48]) -> 2020 | F48: of:=ROUNDUP(MONTH([.B48])/3;0) -> 1
A49: of:=[.A48]+1 -> 48 | B49: of:=[.B48]+1 -> 2020-02-17 | C49: of:=DAY([.B49]) -> 17 | D49: of:=WEEKNUM([.B49];1) -> 8 | E49: of:=YEAR([.B49]) -> 2020 | F49: of:=ROUNDUP(MONTH([.B49])/3;0) -> 1
A50: of:=[.A49]+1 -> 49 | B50: of:=[.B49]+1 -> 2020-02-18 | C50: of:=DAY([.B50]) -> 18 | D50: of:=WEEKNUM([.B50];1) -> 8 | E50: of:=YEAR([.B50]) -> 2020 | F50: of:=ROUNDUP(MONTH([.B50])/3;0) -> 1
A51: of:=[.A50]+1 -> 50 | B51: of:=[.B50]+1 -> 2020-02-19 | C51: of:=DAY([.B51]) -> 19 | D51: of:=WEEKNUM([.B51];1) -> 8 | E51: of:=YEAR([.B51]) -> 2020 | F51: of:=ROUNDUP(MONTH([.B51])/3;0) -> 1
A52: of:=[.A51]+1 -> 51 | B52: of:=[.B51]+1 -> 2020-02-20 | C52: of:=DAY([.B52]) -> 20 | D52: of:=WEEKNUM([.B52];1) -> 8 | E52: of:=YEAR([.B52]) -> 2020 | F52: of:=ROUNDUP(MONTH([.B52])/3;0) -> 1
A53: of:=[.A52]+1 -> 52 | B53: of:=[.B52]+1 -> 2020-02-21 | C53: of:=DAY([.B53]) -> 21 | D53: of:=WEEKNUM([.B53];1) -> 8 | E53: of:=YEAR([.B53]) -> 2020 | F53: of:=ROUNDUP(MONTH([.B53])/3;0) -> 1
A54: of:=[.A53]+1 -> 53 | B54: of:=[.B53]+1 -> 2020-02-22 | C54: of:=DAY([.B54]) -> 22 | D54: of:=WEEKNUM([.B54];1) -> 8 | E54: of:=YEAR([.B54]) -> 2020 | F54: of:=ROUNDUP(MONTH([.B54])/3;0) -> 1
A55: of:=[.A54]+1 -> 54 | B55: of:=[.B54]+1 -> 2020-02-23 | C55: of:=DAY([.B55]) -> 23 | D55: of:=WEEKNUM([.B55];1) -> 9 | E55: of:=YEAR([.B55]) -> 2020 | F55: of:=ROUNDUP(MONTH([.B55])/3;0) -> 1
A56: of:=[.A55]+1 -> 55 | B56: of:=[.B55]+1 -> 2020-02-24 | C56: of:=DAY([.B56]) -> 24 | D56: of:=WEEKNUM([.B56];1) -> 9 | E56: of:=YEAR([.B56]) -> 2020 | F56: of:=ROUNDUP(MONTH([.B56])/3;0) -> 1
A57: of:=[.A56]+1 -> 56 | B57: of:=[.B56]+1 -> 2020-02-25 | C57: of:=DAY([.B57]) -> 25 | D57: of:=WEEKNUM([.B57];1) -> 9 | E57: of:=YEAR([.B57]) -> 2020 | F57: of:=ROUNDUP(MONTH([.B57])/3;0) -> 1
A58: of:=[.A57]+1 -> 57 | B58: of:=[.B57]+1 -> 2020-02-26 | C58: of:=DAY([.B58]) -> 26 | D58: of:=WEEKNUM([.B58];1) -> 9 | E58: of:=YEAR([.B58]) -> 2020 | F58: of:=ROUNDUP(MONTH([.B58])/3;0) -> 1
A59: of:=[.A58]+1 -> 58 | B59: of:=[.B58]+1 -> 2020-02-27 | C59: of:=DAY([.B59]) -> 27 | D59: of:=WEEKNUM([.B59];1) -> 9 | E59: of:=YEAR([.B59]) -> 2020 | F59: of:=ROUNDUP(MONTH([.B59])/3;0) -> 1
A60: of:=[.A59]+1 -> 59 | B60: of:=[.B59]+1 -> 2020-02-28 | C60: of:=DAY([.B60]) -> 28 | D60: of:=WEEKNUM([.B60];1) -> 9 | E60: of:=YEAR([.B60]) -> 2020 | F60: of:=ROUNDUP(MONTH([.B60])/3;0) -> 1
A61: of:=[.A60]+1 -> 60 | B61: of:=[.B60]+1 -> 2020-02-29 | C61: of:=DAY([.B61]) -> 29 | D61: of:=WEEKNUM([.B61];1) -> 9 | E61: of:=YEAR([.B61]) -> 2020 | F61: of:=ROUNDUP(MONTH([.B61])/3;0) -> 1
A62: of:=[.A61]+1 -> 61 | B62: of:=[.B61]+1 -> 2020-03-01 | C62: of:=DAY([.B62]) -> 1 | D62: of:=WEEKNUM([.B62];1) -> 10 | E62: of:=YEAR([.B62]) -> 2020 | F62: of:=ROUNDUP(MONTH([.B62])/3;0) -> 1
A63: of:=[.A62]+1 -> 62 | B63: of:=[.B62]+1 -> 2020-03-02 | C63: of:=DAY([.B63]) -> 2 | D63: of:=WEEKNUM([.B63];1) -> 10 | E63: of:=YEAR([.B63]) -> 2020 | F63: of:=ROUNDUP(MONTH([.B63])/3;0) -> 1
A64: of:=[.A63]+1 -> 63 | B64: of:=[.B63]+1 -> 2020-03-03 | C64: of:=DAY([.B64]) -> 3 | D64: of:=WEEKNUM([.B64];1) -> 10 | E64: of:=YEAR([.B64]) -> 2020 | F64: of:=ROUNDUP(MONTH([.B64])/3;0) -> 1
A65: of:=[.A64]+1 -> 64 | B65: of:=[.B64]+1 -> 2020-03-04 | C65: of:=DAY([.B65]) -> 4 | D65: of:=WEEKNUM([.B65];1) -> 10 | E65: of:=YEAR([.B65]) -> 2020 | F65: of:=ROUNDUP(MONTH([.B65])/3;0) -> 1
A66: of:=[.A65]+1 -> 65 | B66: of:=[.B65]+1 -> 2020-03-05 | C66: of:=DAY([.B66]) -> 5 | D66: of:=WEEKNUM([.B66];1) -> 10 | E66: of:=YEAR([.B66]) -> 2020 | F66: of:=ROUNDUP(MONTH([.B66])/3;0) -> 1
A67: of:=[.A66]+1 -> 66 | B67: of:=[.B66]+1 -> 2020-03-06 | C67: of:=DAY([.B67]) -> 6 | D67: of:=WEEKNUM([.B67];1) -> 10 | E67: of:=YEAR([.B67]) -> 2020 | F67: of:=ROUNDUP(MONTH([.B67])/3;0) -> 1
A68: of:=[.A67]+1 -> 67 | B68: of:=[.B67]+1 -> 2020-03-07 | C68: of:=DAY([.B68]) -> 7 | D68: of:=WEEKNUM([.B68];1) -> 10 | E68: of:=YEAR([.B68]) -> 2020 | F68: of:=ROUNDUP(MONTH([.B68])/3;0) -> 1
A69: of:=[.A68]+1 -> 68 | B69: of:=[.B68]+1 -> 2020-03-08 | C69: of:=DAY([.B69]) -> 8 | D69: of:=WEEKNUM([.B69];1) -> 11 | E69: of:=YEAR([.B69]) -> 2020 | F69: of:=ROUNDUP(MONTH([.B69])/3;0) -> 1
A70: of:=[.A69]+1 -> 69 | B70: of:=[.B69]+1 -> 2020-03-09 | C70: of:=DAY([.B70]) -> 9 | D70: of:=WEEKNUM([.B70];1) -> 11 | E70: of:=YEAR([.B70]) -> 2020 | F70: of:=ROUNDUP(MONTH([.B70])/3;0) -> 1
A71: of:=[.A70]+1 -> 70 | B71: of:=[.B70]+1 -> 2020-03-10 | C71: of:=DAY([.B71]) -> 10 | D71: of:=WEEKNUM([.B71];1) -> 11 | E71: of:=YEAR([.B71]) -> 2020 | F71: of:=ROUNDUP(MONTH([.B71])/3;0) -> 1
A72: of:=[.A71]+1 -> 71 | B72: of:=[.B71]+1 -> 2020-03-11 | C72: of:=DAY([.B72]) -> 11 | D72: of:=WEEKNUM([.B72];1) -> 11 | E72: of:=YEAR([.B72]) -> 2020 | F72: of:=ROUNDUP(MONTH([.B72])/3;0) -> 1
A73: of:=[.A72]+1 -> 72 | B73: of:=[.B72]+1 -> 2020-03-12 | C73: of:=DAY([.B73]) -> 12 | D73: of:=WEEKNUM([.B73];1) -> 11 | E73: of:=YEAR([.B73]) -> 2020 | F73: of:=ROUNDUP(MONTH([.B73])/3;0) -> 1
A74: of:=[.A73]+1 -> 73 | B74: of:=[.B73]+1 -> 2020-03-13 | C74: of:=DAY([.B74]) -> 13 | D74: of:=WEEKNUM([.B74];1) -> 11 | E74: of:=YEAR([.B74]) -> 2020 | F74: of:=ROUNDUP(MONTH([.B74])/3;0) -> 1
A75: of:=[.A74]+1 -> 74 | B75: of:=[.B74]+1 -> 2020-03-14 | C75: of:=DAY([.B75]) -> 14 | D75: of:=WEEKNUM([.B75];1) -> 11 | E75: of:=YEAR([.B75]) -> 2020 | F75: of:=ROUNDUP(MONTH([.B75])/3;0) -> 1
A76: of:=[.A75]+1 -> 75 | B76: of:=[.B75]+1 -> 2020-03-15 | C76: of:=DAY([.B76]) -> 15 | D76: of:=WEEKNUM([.B76];1) -> 12 | E76: of:=YEAR([.B76]) -> 2020 | F76: of:=ROUNDUP(MONTH([.B76])/3;0) -> 1
A77: of:=[.A76]+1 -> 76 | B77: of:=[.B76]+1 -> 2020-03-16 | C77: of:=DAY([.B77]) -> 16 | D77: of:=WEEKNUM([.B77];1) -> 12 | E77: of:=YEAR([.B77]) -> 2020 | F77: of:=ROUNDUP(MONTH([.B77])/3;0) -> 1
A78: of:=[.A77]+1 -> 77 | B78: of:=[.B77]+1 -> 2020-03-17 | C78: of:=DAY([.B78]) -> 17 | D78: of:=WEEKNUM([.B78];1) -> 12 | E78: of:=YEAR([.B78]) -> 2020 | F78: of:=ROUNDUP(MONTH([.B78])/3;0) -> 1
A79: of:=[.A78]+1 -> 78 | B79: of:=[.B78]+1 -> 2020-03-18 | C79: of:=DAY([.B79]) -> 18 | D79: of:=WEEKNUM([.B79];1) -> 12 | E79: of:=YEAR([.B79]) -> 2020 | F79: of:=ROUNDUP(MONTH([.B79])/3;0) -> 1
A80: of:=[.A79]+1 -> 79 | B80: of:=[.B79]+1 -> 2020-03-19 | C80: of:=DAY([.B80]) -> 19 | D80: of:=WEEKNUM([.B80];1) -> 12 | E80: of:=YEAR([.B80]) -> 2020 | F80: of:=ROUNDUP(MONTH([.B80])/3;0) -> 1
A81: of:=[.A80]+1 -> 80 | B81: of:=[.B80]+1 -> 2020-03-20 | C81: of:=DAY([.B81]) -> 20 | D81: of:=WEEKNUM([.B81];1) -> 12 | E81: of:=YEAR([.B81]) -> 2020 | F81: of:=ROUNDUP(MONTH([.B81])/3;0) -> 1
A82: of:=[.A81]+1 -> 81 | B82: of:=[.B81]+1 -> 2020-03-21 | C82: of:=DAY([.B82]) -> 21 | D82: of:=WEEKNUM([.B82];1) -> 12 | E82: of:=YEAR([.B82]) -> 2020 | F82: of:=ROUNDUP(MONTH([.B82])/3;0) -> 1
A83: of:=[.A82]+1 -> 82 | B83: of:=[.B82]+1 -> 2020-03-22 | C83: of:=DAY([.B83]) -> 22 | D83: of:=WEEKNUM([.B83];1) -> 13 | E83: of:=YEAR([.B83]) -> 2020 | F83: of:=ROUNDUP(MONTH([.B83])/3;0) -> 1
A84: of:=[.A83]+1 -> 83 | B84: of:=[.B83]+1 -> 2020-03-23 | C84: of:=DAY([.B84]) -> 23 | D84: of:=WEEKNUM([.B84];1) -> 13 | E84: of:=YEAR([.B84]) -> 2020 | F84: of:=ROUNDUP(MONTH([.B84])/3;0) -> 1
A85: of:=[.A84]+1 -> 84 | B85: of:=[.B84]+1 -> 2020-03-24 | C85: of:=DAY([.B85]) -> 24 | D85: of:=WEEKNUM([.B85];1) -> 13 | E85: of:=YEAR([.B85]) -> 2020 | F85: of:=ROUNDUP(MONTH([.B85])/3;0) -> 1
A86: of:=[.A85]+1 -> 85 | B86: of:=[.B85]+1 -> 2020-03-25 | C86: of:=DAY([.B86]) -> 25 | D86: of:=WEEKNUM([.B86];1) -> 13 | E86: of:=YEAR([.B86]) -> 2020 | F86: of:=ROUNDUP(MONTH([.B86])/3;0) -> 1
A87: of:=[.A86]+1 -> 86 | B87: of:=[.B86]+1 -> 2020-03-26 | C87: of:=DAY([.B87]) -> 26 | D87: of:=WEEKNUM([.B87];1) -> 13 | E87: of:=YEAR([.B87]) -> 2020 | F87: of:=ROUNDUP(MONTH([.B87])/3;0) -> 1
A88: of:=[.A87]+1 -> 87 | B88: of:=[.B87]+1 -> 2020-03-27 | C88: of:=DAY([.B88]) -> 27 | D88: of:=WEEKNUM([.B88];1) -> 13 | E88: of:=YEAR([.B88]) -> 2020 | F88: of:=ROUNDUP(MONTH([.B88])/3;0) -> 1
A89: of:=[.A88]+1 -> 88 | B89: of:=[.B88]+1 -> 2020-03-28 | C89: of:=DAY([.B89]) -> 28 | D89: of:=WEEKNUM([.B89];1) -> 13 | E89: of:=YEAR([.B89]) -> 2020 | F89: of:=ROUNDUP(MONTH([.B89])/3;0) -> 1
A90: of:=[.A89]+1 -> 89 | B90: of:=[.B89]+1 -> 2020-03-29 | C90: of:=DAY([.B90]) -> 29 | D90: of:=WEEKNUM([.B90];1) -> 14 | E90: of:=YEAR([.B90]) -> 2020 | F90: of:=ROUNDUP(MONTH([.B90])/3;0) -> 1
A91: of:=[.A90]+1 -> 90 | B91: of:=[.B90]+1 -> 2020-03-30 | C91: of:=DAY([.B91]) -> 30 | D91: of:=WEEKNUM([.B91];1) -> 14 | E91: of:=YEAR([.B91]) -> 2020 | F91: of:=ROUNDUP(MONTH([.B91])/3;0) -> 1
A92: of:=[.A91]+1 -> 91 | B92: of:=[.B91]+1 -> 2020-03-31 | C92: of:=DAY([.B92]) -> 31 | D92: of:=WEEKNUM([.B92];1) -> 14 | E92: of:=YEAR([.B92]) -> 2020 | F92: of:=ROUNDUP(MONTH([.B92])/3;0) -> 1
A93: of:=[.A92]+1 -> 92 | B93: of:=[.B92]+1 -> 2020-04-01 | C93: of:=DAY([.B93]) -> 1 | D93: of:=WEEKNUM([.B93];1) -> 14 | E93: of:=YEAR([.B93]) -> 2020 | F93: of:=ROUNDUP(MONTH([.B93])/3;0) -> 2
A94: of:=[.A93]+1 -> 93 | B94: of:=[.B93]+1 -> 2020-04-02 | C94: of:=DAY([.B94]) -> 2 | D94: of:=WEEKNUM([.B94];1) -> 14 | E94: of:=YEAR([.B94]) -> 2020 | F94: of:=ROUNDUP(MONTH([.B94])/3;0) -> 2
A95: of:=[.A94]+1 -> 94 | B95: of:=[.B94]+1 -> 2020-04-03 | C95: of:=DAY([.B95]) -> 3 | D95: of:=WEEKNUM([.B95];1) -> 14 | E95: of:=YEAR([.B95]) -> 2020 | F95: of:=ROUNDUP(MONTH([.B95])/3;0) -> 2
A96: of:=[.A95]+1 -> 95 | B96: of:=[.B95]+1 -> 2020-04-04 | C96: of:=DAY([.B96]) -> 4 | D96: of:=WEEKNUM([.B96];1) -> 14 | E96: of:=YEAR([.B96]) -> 2020 | F96: of:=ROUNDUP(MONTH([.B96])/3;0) -> 2
A97: of:=[.A96]+1 -> 96 | B97: of:=[.B96]+1 -> 2020-04-05 | C97: of:=DAY([.B97]) -> 5 | D97: of:=WEEKNUM([.B97];1) -> 15 | E97: of:=YEAR([.B97]) -> 2020 | F97: of:=ROUNDUP(MONTH([.B97])/3;0) -> 2
A98: of:=[.A97]+1 -> 97 | B98: of:=[.B97]+1 -> 2020-04-06 | C98: of:=DAY([.B98]) -> 6 | D98: of:=WEEKNUM([.B98];1) -> 15 | E98: of:=YEAR([.B98]) -> 2020 | F98: of:=ROUNDUP(MONTH([.B98])/3;0) -> 2
A99: of:=[.A98]+1 -> 98 | B99: of:=[.B98]+1 -> 2020-04-07 | C99: of:=DAY([.B99]) -> 7 | D99: of:=WEEKNUM([.B99];1) -> 15 | E99: of:=YEAR([.B99]) -> 2020 | F99: of:=ROUNDUP(MONTH([.B99])/3;0) -> 2
A100: of:=[.A99]+1 -> 99 | B100: of:=[.B99]+1 -> 2020-04-08 | C100: of:=DAY([.B100]) -> 8 | D100: of:=WEEKNUM([.B100];1) -> 15 | E100: of:=YEAR([.B100]) -> 2020 | F100: of:=ROUNDUP(MONTH([.B100])/3;0) -> 2
A101: of:=[.A100]+1 -> 100 | B101: of:=[.B100]+1 -> 2020-04-09 | C101: of:=DAY([.B101]) -> 9 | D101: of:=WEEKNUM([.B101];1) -> 15 | E101: of:=YEAR([.B101]) -> 2020 | F101: of:=ROUNDUP(MONTH([.B101])/3;0) -> 2
A102: of:=[.A101]+1 -> 101 | B102: of:=[.B101]+1 -> 2020-04-10 | C102: of:=DAY([.B102]) -> 10 | D102: of:=WEEKNUM([.B102];1) -> 15 | E102: of:=YEAR([.B102]) -> 2020 | F102: of:=ROUNDUP(MONTH([.B102])/3;0) -> 2
A103: of:=[.A102]+1 -> 102 | B103: of:=[.B102]+1 -> 2020-04-11 | C103: of:=DAY([.B103]) -> 11 | D103: of:=WEEKNUM([.B103];1) -> 15 | E103: of:=YEAR([.B103]) -> 2020 | F103: of:=ROUNDUP(MONTH([.B103])/3;0) -> 2
A104: of:=[.A103]+1 -> 103 | B104: of:=[.B103]+1 -> 2020-04-12 | C104: of:=DAY([.B104]) -> 12 | D104: of:=WEEKNUM([.B104];1) -> 16 | E104: of:=YEAR([.B104]) -> 2020 | F104: of:=ROUNDUP(MONTH([.B104])/3;0) -> 2
A105: of:=[.A104]+1 -> 104 | B105: of:=[.B104]+1 -> 2020-04-13 | C105: of:=DAY([.B105]) -> 13 | D105: of:=WEEKNUM([.B105];1) -> 16 | E105: of:=YEAR([.B105]) -> 2020 | F105: of:=ROUNDUP(MONTH([.B105])/3;0) -> 2
A106: of:=[.A105]+1 -> 105 | B106: of:=[.B105]+1 -> 2020-04-14 | C106: of:=DAY([.B106]) -> 14 | D106: of:=WEEKNUM([.B106];1) -> 16 | E106: of:=YEAR([.B106]) -> 2020 | F106: of:=ROUNDUP(MONTH([.B106])/3;0) -> 2
A107: of:=[.A106]+1 -> 106 | B107: of:=[.B106]+1 -> 2020-04-15 | C107: of:=DAY([.B107]) -> 15 | D107: of:=WEEKNUM([.B107];1) -> 16 | E107: of:=YEAR([.B107]) -> 2020 | F107: of:=ROUNDUP(MONTH([.B107])/3;0) -> 2
A108: of:=[.A107]+1 -> 107 | B108: of:=[.B107]+1 -> 2020-04-16 | C108: of:=DAY([.B108]) -> 16 | D108: of:=WEEKNUM([.B108];1) -> 16 | E108: of:=YEAR([.B108]) -> 2020 | F108: of:=ROUNDUP(MONTH([.B108])/3;0) -> 2
A109: of:=[.A108]+1 -> 108 | B109: of:=[.B108]+1 -> 2020-04-17 | C109: of:=DAY([.B109]) -> 17 | D109: of:=WEEKNUM([.B109];1) -> 16 | E109: of:=YEAR([.B109]) -> 2020 | F109: of:=ROUNDUP(MONTH([.B109])/3;0) -> 2
A110: of:=[.A109]+1 -> 109 | B110: of:=[.B109]+1 -> 2020-04-18 | C110: of:=DAY([.B110]) -> 18 | D110: of:=WEEKNUM([.B110];1) -> 16 | E110: of:=YEAR([.B110]) -> 2020 | F110: of:=ROUNDUP(MONTH([.B110])/3;0) -> 2
A111: of:=[.A110]+1 -> 110 | B111: of:=[.B110]+1 -> 2020-04-19 | C111: of:=DAY([.B111]) -> 19 | D111: of:=WEEKNUM([.B111];1) -> 17 | E111: of:=YEAR([.B111]) -> 2020 | F111: of:=ROUNDUP(MONTH([.B111])/3;0) -> 2
A112: of:=[.A111]+1 -> 111 | B112: of:=[.B111]+1 -> 2020-04-20 | C112: of:=DAY([.B112]) -> 20 | D112: of:=WEEKNUM([.B112];1) -> 17 | E112: of:=YEAR([.B112]) -> 2020 | F112: of:=ROUNDUP(MONTH([.B112])/3;0) -> 2
A113: of:=[.A112]+1 -> 112 | B113: of:=[.B112]+1 -> 2020-04-21 | C113: of:=DAY([.B113]) -> 21 | D113: of:=WEEKNUM([.B113];1) -> 17 | E113: of:=YEAR([.B113]) -> 2020 | F113: of:=ROUNDUP(MONTH([.B113])/3;0) -> 2
A114: of:=[.A113]+1 -> 113 | B114: of:=[.B113]+1 -> 2020-04-22 | C114: of:=DAY([.B114]) -> 22 | D114: of:=WEEKNUM([.B114];1) -> 17 | E114: of:=YEAR([.B114]) -> 2020 | F114: of:=ROUNDUP(MONTH([.B114])/3;0) -> 2
A115: of:=[.A114]+1 -> 114 | B115: of:=[.B114]+1 -> 2020-04-23 | C115: of:=DAY([.B115]) -> 23 | D115: of:=WEEKNUM([.B115];1) -> 17 | E115: of:=YEAR([.B115]) -> 2020 | F115: of:=ROUNDUP(MONTH([.B115])/3;0) -> 2
A116: of:=[.A115]+1 -> 115 | B116: of:=[.B115]+1 -> 2020-04-24 | C116: of:=DAY([.B116]) -> 24 | D116: of:=WEEKNUM([.B116];1) -> 17 | E116: of:=YEAR([.B116]) -> 2020 | F116: of:=ROUNDUP(MONTH([.B116])/3;0) -> 2
A117: of:=[.A116]+1 -> 116 | B117: of:=[.B116]+1 -> 2020-04-25 | C117: of:=DAY([.B117]) -> 25 | D117: of:=WEEKNUM([.B117];1) -> 17 | E117: of:=YEAR([.B117]) -> 2020 | F117: of:=ROUNDUP(MONTH([.B117])/3;0) -> 2
A118: of:=[.A117]+1 -> 117 | B118: of:=[.B117]+1 -> 2020-04-26 | C118: of:=DAY([.B118]) -> 26 | D118: of:=WEEKNUM([.B118];1) -> 18 | E118: of:=YEAR([.B118]) -> 2020 | F118: of:=ROUNDUP(MONTH([.B118])/3;0) -> 2
A119: of:=[.A118]+1 -> 118 | B119: of:=[.B118]+1 -> 2020-04-27 | C119: of:=DAY([.B119]) -> 27 | D119: of:=WEEKNUM([.B119];1) -> 18 | E119: of:=YEAR([.B119]) -> 2020 | F119: of:=ROUNDUP(MONTH([.B119])/3;0) -> 2
A120: of:=[.A119]+1 -> 119 | B120: of:=[.B119]+1 -> 2020-04-28 | C120: of:=DAY([.B120]) -> 28 | D120: of:=WEEKNUM([.B120];1) -> 18 | E120: of:=YEAR([.B120]) -> 2020 | F120: of:=ROUNDUP(MONTH([.B120])/3;0) -> 2
A121: of:=[.A120]+1 -> 120 | B121: of:=[.B120]+1 -> 2020-04-29 | C121: of:=DAY([.B121]) -> 29 | D121: of:=WEEKNUM([.B121];1) -> 18 | E121: of:=YEAR([.B121]) -> 2020 | F121: of:=ROUNDUP(MONTH([.B121])/3;0) -> 2
A122: of:=[.A121]+1 -> 121 | B122: of:=[.B121]+1 -> 2020-04-30 | C122: of:=DAY([.B122]) -> 30 | D122: of:=WEEKNUM([.B122];1) -> 18 | E122: of:=YEAR([.B122]) -> 2020 | F122: of:=ROUNDUP(MONTH([.B122])/3;0) -> 2
A123: of:=[.A122]+1 -> 122 | B123: of:=[.B122]+1 -> 2020-05-01 | C123: of:=DAY([.B123]) -> 1 | D123: of:=WEEKNUM([.B123];1) -> 18 | E123: of:=YEAR([.B123]) -> 2020 | F123: of:=ROUNDUP(MONTH([.B123])/3;0) -> 2
A124: of:=[.A123]+1 -> 123 | B124: of:=[.B123]+1 -> 2020-05-02 | C124: of:=DAY([.B124]) -> 2 | D124: of:=WEEKNUM([.B124];1) -> 18 | E124: of:=YEAR([.B124]) -> 2020 | F124: of:=ROUNDUP(MONTH([.B124])/3;0) -> 2
A125: of:=[.A124]+1 -> 124 | B125: of:=[.B124]+1 -> 2020-05-03 | C125: of:=DAY([.B125]) -> 3 | D125: of:=WEEKNUM([.B125];1) -> 19 | E125: of:=YEAR([.B125]) -> 2020 | F125: of:=ROUNDUP(MONTH([.B125])/3;0) -> 2
A126: of:=[.A125]+1 -> 125 | B126: of:=[.B125]+1 -> 2020-05-04 | C126: of:=DAY([.B126]) -> 4 | D126: of:=WEEKNUM([.B126];1) -> 19 | E126: of:=YEAR([.B126]) -> 2020 | F126: of:=ROUNDUP(MONTH([.B126])/3;0) -> 2
A127: of:=[.A126]+1 -> 126 | B127: of:=[.B126]+1 -> 2020-05-05 | C127: of:=DAY([.B127]) -> 5 | D127: of:=WEEKNUM([.B127];1) -> 19 | E127: of:=YEAR([.B127]) -> 2020 | F127: of:=ROUNDUP(MONTH([.B127])/3;0) -> 2
A128: of:=[.A127]+1 -> 127 | B128: of:=[.B127]+1 -> 2020-05-06 | C128: of:=DAY([.B128]) -> 6 | D128: of:=WEEKNUM([.B128];1) -> 19 | E128: of:=YEAR([.B128]) -> 2020 | F128: of:=ROUNDUP(MONTH([.B128])/3;0) -> 2
A129: of:=[.A128]+1 -> 128 | B129: of:=[.B128]+1 -> 2020-05-07 | C129: of:=DAY([.B129]) -> 7 | D129: of:=WEEKNUM([.B129];1) -> 19 | E129: of:=YEAR([.B129]) -> 2020 | F129: of:=ROUNDUP(MONTH([.B129])/3;0) -> 2
A130: of:=[.A129]+1 -> 129 | B130: of:=[.B129]+1 -> 2020-05-08 | C130: of:=DAY([.B130]) -> 8 | D130: of:=WEEKNUM([.B130];1) -> 19 | E130: of:=YEAR([.B130]) -> 2020 | F130: of:=ROUNDUP(MONTH([.B130])/3;0) -> 2
A131: of:=[.A130]+1 -> 130 | B131: of:=[.B130]+1 -> 2020-05-09 | C131: of:=DAY([.B131]) -> 9 | D131: of:=WEEKNUM([.B131];1) -> 19 | E131: of:=YEAR([.B131]) -> 2020 | F131: of:=ROUNDUP(MONTH([.B131])/3;0) -> 2
A132: of:=[.A131]+1 -> 131 | B132: of:=[.B131]+1 -> 2020-05-10 | C132: of:=DAY([.B132]) -> 10 | D132: of:=WEEKNUM([.B132];1) -> 20 | E132: of:=YEAR([.B132]) -> 2020 | F132: of:=ROUNDUP(MONTH([.B132])/3;0) -> 2
A133: of:=[.A132]+1 -> 132 | B133: of:=[.B132]+1 -> 2020-05-11 | C133: of:=DAY([.B133]) -> 11 | D133: of:=WEEKNUM([.B133];1) -> 20 | E133: of:=YEAR([.B133]) -> 2020 | F133: of:=ROUNDUP(MONTH([.B133])/3;0) -> 2
A134: of:=[.A133]+1 -> 133 | B134: of:=[.B133]+1 -> 2020-05-12 | C134: of:=DAY([.B134]) -> 12 | D134: of:=WEEKNUM([.B134];1) -> 20 | E134: of:=YEAR([.B134]) -> 2020 | F134: of:=ROUNDUP(MONTH([.B134])/3;0) -> 2
A135: of:=[.A134]+1 -> 134 | B135: of:=[.B134]+1 -> 2020-05-13 | C135: of:=DAY([.B135]) -> 13 | D135: of:=WEEKNUM([.B135];1) -> 20 | E135: of:=YEAR([.B135]) -> 2020 | F135: of:=ROUNDUP(MONTH([.B135])/3;0) -> 2
A136: of:=[.A135]+1 -> 135 | B136: of:=[.B135]+1 -> 2020-05-14 | C136: of:=DAY([.B136]) -> 14 | D136: of:=WEEKNUM([.B136];1) -> 20 | E136: of:=YEAR([.B136]) -> 2020 | F136: of:=ROUNDUP(MONTH([.B136])/3;0) -> 2
A137: of:=[.A136]+1 -> 136 | B137: of:=[.B136]+1 -> 2020-05-15 | C137: of:=DAY([.B137]) -> 15 | D137: of:=WEEKNUM([.B137];1) -> 20 | E137: of:=YEAR([.B137]) -> 2020 | F137: of:=ROUNDUP(MONTH([.B137])/3;0) -> 2
A138: of:=[.A137]+1 -> 137 | B138: of:=[.B137]+1 -> 2020-05-16 | C138: of:=DAY([.B138]) -> 16 | D138: of:=WEEKNUM([.B138];1) -> 20 | E138: of:=YEAR([.B138]) -> 2020 | F138: of:=ROUNDUP(MONTH([.B138])/3;0) -> 2
A139: of:=[.A138]+1 -> 138 | B139: of:=[.B138]+1 -> 2020-05-17 | C139: of:=DAY([.B139]) -> 17 | D139: of:=WEEKNUM([.B139];1) -> 21 | E139: of:=YEAR([.B139]) -> 2020 | F139: of:=ROUNDUP(MONTH([.B139])/3;0) -> 2
A140: of:=[.A139]+1 -> 139 | B140: of:=[.B139]+1 -> 2020-05-18 | C140: of:=DAY([.B140]) -> 18 | D140: of:=WEEKNUM([.B140];1) -> 21 | E140: of:=YEAR([.B140]) -> 2020 | F140: of:=ROUNDUP(MONTH([.B140])/3;0) -> 2
A141: of:=[.A140]+1 -> 140 | B141: of:=[.B140]+1 -> 2020-05-19 | C141: of:=DAY([.B141]) -> 19 | D141: of:=WEEKNUM([.B141];1) -> 21 | E141: of:=YEAR([.B141]) -> 2020 | F141: of:=ROUNDUP(MONTH([.B141])/3;0) -> 2
A142: of:=[.A141]+1 -> 141 | B142: of:=[.B141]+1 -> 2020-05-20 | C142: of:=DAY([.B142]) -> 20 | D142: of:=WEEKNUM([.B142];1) -> 21 | E142: of:=YEAR([.B142]) -> 2020 | F142: of:=ROUNDUP(MONTH([.B142])/3;0) -> 2
A143: of:=[.A142]+1 -> 142 | B143: of:=[.B142]+1 -> 2020-05-21 | C143: of:=DAY([.B143]) -> 21 | D143: of:=WEEKNUM([.B143];1) -> 21 | E143: of:=YEAR([.B143]) -> 2020 | F143: of:=ROUNDUP(MONTH([.B143])/3;0) -> 2
A144: of:=[.A143]+1 -> 143 | B144: of:=[.B143]+1 -> 2020-05-22 | C144: of:=DAY([.B144]) -> 22 | D144: of:=WEEKNUM([.B144];1) -> 21 | E144: of:=YEAR([.B144]) -> 2020 | F144: of:=ROUNDUP(MONTH([.B144])/3;0) -> 2
A145: of:=[.A144]+1 -> 144 | B145: of:=[.B144]+1 -> 2020-05-23 | C145: of:=DAY([.B145]) -> 23 | D145: of:=WEEKNUM([.B145];1) -> 21 | E145: of:=YEAR([.B145]) -> 2020 | F145: of:=ROUNDUP(MONTH([.B145])/3;0) -> 2
A146: of:=[.A145]+1 -> 145 | B146: of:=[.B145]+1 -> 2020-05-24 | C146: of:=DAY([.B146]) -> 24 | D146: of:=WEEKNUM([.B146];1) -> 22 | E146: of:=YEAR([.B146]) -> 2020 | F146: of:=ROUNDUP(MONTH([.B146])/3;0) -> 2
A147: of:=[.A146]+1 -> 146 | B147: of:=[.B146]+1 -> 2020-05-25 | C147: of:=DAY([.B147]) -> 25 | D147: of:=WEEKNUM([.B147];1) -> 22 | E147: of:=YEAR([.B147]) -> 2020 | F147: of:=ROUNDUP(MONTH([.B147])/3;0) -> 2
A148: of:=[.A147]+1 -> 147 | B148: of:=[.B147]+1 -> 2020-05-26 | C148: of:=DAY([.B148]) -> 26 | D148: of:=WEEKNUM([.B148];1) -> 22 | E148: of:=YEAR([.B148]) -> 2020 | F148: of:=ROUNDUP(MONTH([.B148])/3;0) -> 2
A149: of:=[.A148]+1 -> 148 | B149: of:=[.B148]+1 -> 2020-05-27 | C149: of:=DAY([.B149]) -> 27 | D149: of:=WEEKNUM([.B149];1) -> 22 | E149: of:=YEAR([.B149]) -> 2020 | F149: of:=ROUNDUP(MONTH([.B149])/3;0) -> 2
A150: of:=[.A149]+1 -> 149 | B150: of:=[.B149]+1 -> 2020-05-28 | C150: of:=DAY([.B150]) -> 28 | D150: of:=WEEKNUM([.B150];1) -> 22 | E150: of:=YEAR([.B150]) -> 2020 | F150: of:=ROUNDUP(MONTH([.B150])/3;0) -> 2
A151: of:=[.A150]+1 -> 150 | B151: of:=[.B150]+1 -> 2020-05-29 | C151: of:=DAY([.B151]) -> 29 | D151: of:=WEEKNUM([.B151];1) -> 22 | E151: of:=YEAR([.B151]) -> 2020 | F151: of:=ROUNDUP(MONTH([.B151])/3;0) -> 2
A152: of:=[.A151]+1 -> 151 | B152: of:=[.B151]+1 -> 2020-05-30 | C152: of:=DAY([.B152]) -> 30 | D152: of:=WEEKNUM([.B152];1) -> 22 | E152: of:=YEAR([.B152]) -> 2020 | F152: of:=ROUNDUP(MONTH([.B152])/3;0) -> 2
A153: of:=[.A152]+1 -> 152 | B153: of:=[.B152]+1 -> 2020-05-31 | C153: of:=DAY([.B153]) -> 31 | D153: of:=WEEKNUM([.B153];1) -> 23 | E153: of:=YEAR([.B153]) -> 2020 | F153: of:=ROUNDUP(MONTH([.B153])/3;0) -> 2
A154: of:=[.A153]+1 -> 153 | B154: of:=[.B153]+1 -> 2020-06-01 | C154: of:=DAY([.B154]) -> 1 | D154: of:=WEEKNUM([.B154];1) -> 23 | E154: of:=YEAR([.B154]) -> 2020 | F154: of:=ROUNDUP(MONTH([.B154])/3;0) -> 2
A155: of:=[.A154]+1 -> 154 | B155: of:=[.B154]+1 -> 2020-06-02 | C155: of:=DAY([.B155]) -> 2 | D155: of:=WEEKNUM([.B155];1) -> 23 | E155: of:=YEAR([.B155]) -> 2020 | F155: of:=ROUNDUP(MONTH([.B155])/3;0) -> 2
A156: of:=[.A155]+1 -> 155 | B156: of:=[.B155]+1 -> 2020-06-03 | C156: of:=DAY([.B156]) -> 3 | D156: of:=WEEKNUM([.B156];1) -> 23 | E156: of:=YEAR([.B156]) -> 2020 | F156: of:=ROUNDUP(MONTH([.B156])/3;0) -> 2
A157: of:=[.A156]+1 -> 156 | B157: of:=[.B156]+1 -> 2020-06-04 | C157: of:=DAY([.B157]) -> 4 | D157: of:=WEEKNUM([.B157];1) -> 23 | E157: of:=YEAR([.B157]) -> 2020 | F157: of:=ROUNDUP(MONTH([.B157])/3;0) -> 2
A158: of:=[.A157]+1 -> 157 | B158: of:=[.B157]+1 -> 2020-06-05 | C158: of:=DAY([.B158]) -> 5 | D158: of:=WEEKNUM([.B158];1) -> 23 | E158: of:=YEAR([.B158]) -> 2020 | F158: of:=ROUNDUP(MONTH([.B158])/3;0) -> 2
A159: of:=[.A158]+1 -> 158 | B159: of:=[.B158]+1 -> 2020-06-06 | C159: of:=DAY([.B159]) -> 6 | D159: of:=WEEKNUM([.B159];1) -> 23 | E159: of:=YEAR([.B159]) -> 2020 | F159: of:=ROUNDUP(MONTH([.B159])/3;0) -> 2
A160: of:=[.A159]+1 -> 159 | B160: of:=[.B159]+1 -> 2020-06-07 | C160: of:=DAY([.B160]) -> 7 | D160: of:=WEEKNUM([.B160];1) -> 24 | E160: of:=YEAR([.B160]) -> 2020 | F160: of:=ROUNDUP(MONTH([.B160])/3;0) -> 2
A161: of:=[.A160]+1 -> 160 | B161: of:=[.B160]+1 -> 2020-06-08 | C161: of:=DAY([.B161]) -> 8 | D161: of:=WEEKNUM([.B161];1) -> 24 | E161: of:=YEAR([.B161]) -> 2020 | F161: of:=ROUNDUP(MONTH([.B161])/3;0) -> 2
A162: of:=[.A161]+1 -> 161 | B162: of:=[.B161]+1 -> 2020-06-09 | C162: of:=DAY([.B162]) -> 9 | D162: of:=WEEKNUM([.B162];1) -> 24 | E162: of:=YEAR([.B162]) -> 2020 | F162: of:=ROUNDUP(MONTH([.B162])/3;0) -> 2
A163: of:=[.A162]+1 -> 162 | B163: of:=[.B162]+1 -> 2020-06-10 | C163: of:=DAY([.B163]) -> 10 | D163: of:=WEEKNUM([.B163];1) -> 24 | E163: of:=YEAR([.B163]) -> 2020 | F163: of:=ROUNDUP(MONTH([.B163])/3;0) -> 2
A164: of:=[.A163]+1 -> 163 | B164: of:=[.B163]+1 -> 2020-06-11 | C164: of:=DAY([.B164]) -> 11 | D164: of:=WEEKNUM([.B164];1) -> 24 | E164: of:=YEAR([.B164]) -> 2020 | F164: of:=ROUNDUP(MONTH([.B164])/3;0) -> 2
A165: of:=[.A164]+1 -> 164 | B165: of:=[.B164]+1 -> 2020-06-12 | C165: of:=DAY([.B165]) -> 12 | D165: of:=WEEKNUM([.B165];1) -> 24 | E165: of:=YEAR([.B165]) -> 2020 | F165: of:=ROUNDUP(MONTH([.B165])/3;0) -> 2
A166: of:=[.A165]+1 -> 165 | B166: of:=[.B165]+1 -> 2020-06-13 | C166: of:=DAY([.B166]) -> 13 | D166: of:=WEEKNUM([.B166];1) -> 24 | E166: of:=YEAR([.B166]) -> 2020 | F166: of:=ROUNDUP(MONTH([.B166])/3;0) -> 2
A167: of:=[.A166]+1 -> 166 | B167: of:=[.B166]+1 -> 2020-06-14 | C167: of:=DAY([.B167]) -> 14 | D167: of:=WEEKNUM([.B167];1) -> 25 | E167: of:=YEAR([.B167]) -> 2020 | F167: of:=ROUNDUP(MONTH([.B167])/3;0) -> 2
A168: of:=[.A167]+1 -> 167 | B168: of:=[.B167]+1 -> 2020-06-15 | C168: of:=DAY([.B168]) -> 15 | D168: of:=WEEKNUM([.B168];1) -> 25 | E168: of:=YEAR([.B168]) -> 2020 | F168: of:=ROUNDUP(MONTH([.B168])/3;0) -> 2
A169: of:=[.A168]+1 -> 168 | B169: of:=[.B168]+1 -> 2020-06-16 | C169: of:=DAY([.B169]) -> 16 | D169: of:=WEEKNUM([.B169];1) -> 25 | E169: of:=YEAR([.B169]) -> 2020 | F169: of:=ROUNDUP(MONTH([.B169])/3;0) -> 2
A170: of:=[.A169]+1 -> 169 | B170: of:=[.B169]+1 -> 2020-06-17 | C170: of:=DAY([.B170]) -> 17 | D170: of:=WEEKNUM([.B170];1) -> 25 | E170: of:=YEAR([.B170]) -> 2020 | F170: of:=ROUNDUP(MONTH([.B170])/3;0) -> 2
A171: of:=[.A170]+1 -> 170 | B171: of:=[.B170]+1 -> 2020-06-18 | C171: of:=DAY([.B171]) -> 18 | D171: of:=WEEKNUM([.B171];1) -> 25 | E171: of:=YEAR([.B171]) -> 2020 | F171: of:=ROUNDUP(MONTH([.B171])/3;0) -> 2
A172: of:=[.A171]+1 -> 171 | B172: of:=[.B171]+1 -> 2020-06-19 | C172: of:=DAY([.B172]) -> 19 | D172: of:=WEEKNUM([.B172];1) -> 25 | E172: of:=YEAR([.B172]) -> 2020 | F172: of:=ROUNDUP(MONTH([.B172])/3;0) -> 2
A173: of:=[.A172]+1 -> 172 | B173: of:=[.B172]+1 -> 2020-06-20 | C173: of:=DAY([.B173]) -> 20 | D173: of:=WEEKNUM([.B173];1) -> 25 | E173: of:=YEAR([.B173]) -> 2020 | F173: of:=ROUNDUP(MONTH([.B173])/3;0) -> 2
A174: of:=[.A173]+1 -> 173 | B174: of:=[.B173]+1 -> 2020-06-21 | C174: of:=DAY([.B174]) -> 21 | D174: of:=WEEKNUM([.B174];1) -> 26 | E174: of:=YEAR([.B174]) -> 2020 | F174: of:=ROUNDUP(MONTH([.B174])/3;0) -> 2
A175: of:=[.A174]+1 -> 174 | B175: of:=[.B174]+1 -> 2020-06-22 | C175: of:=DAY([.B175]) -> 22 | D175: of:=WEEKNUM([.B175];1) -> 26 | E175: of:=YEAR([.B175]) -> 2020 | F175: of:=ROUNDUP(MONTH([.B175])/3;0) -> 2
A176: of:=[.A175]+1 -> 175 | B176: of:=[.B175]+1 -> 2020-06-23 | C176: of:=DAY([.B176]) -> 23 | D176: of:=WEEKNUM([.B176];1) -> 26 | E176: of:=YEAR([.B176]) -> 2020 | F176: of:=ROUNDUP(MONTH([.B176])/3;0) -> 2
A177: of:=[.A176]+1 -> 176 | B177: of:=[.B176]+1 -> 2020-06-24 | C177: of:=DAY([.B177]) -> 24 | D177: of:=WEEKNUM([.B177];1) -> 26 | E177: of:=YEAR([.B177]) -> 2020 | F177: of:=ROUNDUP(MONTH([.B177])/3;0) -> 2
A178: of:=[.A177]+1 -> 177 | B178: of:=[.B177]+1 -> 2020-06-25 | C178: of:=DAY([.B178]) -> 25 | D178: of:=WEEKNUM([.B178];1) -> 26 | E178: of:=YEAR([.B178]) -> 2020 | F178: of:=ROUNDUP(MONTH([.B178])/3;0) -> 2
A179: of:=[.A178]+1 -> 178 | B179: of:=[.B178]+1 -> 2020-06-26 | C179: of:=DAY([.B179]) -> 26 | D179: of:=WEEKNUM([.B179];1) -> 26 | E179: of:=YEAR([.B179]) -> 2020 | F179: of:=ROUNDUP(MONTH([.B179])/3;0) -> 2
A180: of:=[.A179]+1 -> 179 | B180: of:=[.B179]+1 -> 2020-06-27 | C180: of:=DAY([.B180]) -> 27 | D180: of:=WEEKNUM([.B180];1) -> 26 | E180: of:=YEAR([.B180]) -> 2020 | F180: of:=ROUNDUP(MONTH([.B180])/3;0) -> 2
A181: of:=[.A180]+1 -> 180 | B181: of:=[.B180]+1 -> 2020-06-28 | C181: of:=DAY([.B181]) -> 28 | D181: of:=WEEKNUM([.B181];1) -> 27 | E181: of:=YEAR([.B181]) -> 2020 | F181: of:=ROUNDUP(MONTH([.B181])/3;0) -> 2
A182: of:=[.A181]+1 -> 181 | B182: of:=[.B181]+1 -> 2020-06-29 | C182: of:=DAY([.B182]) -> 29 | D182: of:=WEEKNUM([.B182];1) -> 27 | E182: of:=YEAR([.B182]) -> 2020 | F182: of:=ROUNDUP(MONTH([.B182])/3;0) -> 2
A183: of:=[.A182]+1 -> 182 | B183: of:=[.B182]+1 -> 2020-06-30 | C183: of:=DAY([.B183]) -> 30 | D183: of:=WEEKNUM([.B183];1) -> 27 | E183: of:=YEAR([.B183]) -> 2020 | F183: of:=ROUNDUP(MONTH([.B183])/3;0) -> 2
A184: of:=[.A183]+1 -> 183 | B184: of:=[.B183]+1 -> 2020-07-01 | C184: of:=DAY([.B184]) -> 1 | D184: of:=WEEKNUM([.B184];1) -> 27 | E184: of:=YEAR([.B184]) -> 2020 | F184: of:=ROUNDUP(MONTH([.B184])/3;0) -> 3
A185: of:=[.A184]+1 -> 184 | B185: of:=[.B184]+1 -> 2020-07-02 | C185: of:=DAY([.B185]) -> 2 | D185: of:=WEEKNUM([.B185];1) -> 27 | E185: of:=YEAR([.B185]) -> 2020 | F185: of:=ROUNDUP(MONTH([.B185])/3;0) -> 3
A186: of:=[.A185]+1 -> 185 | B186: of:=[.B185]+1 -> 2020-07-03 | C186: of:=DAY([.B186]) -> 3 | D186: of:=WEEKNUM([.B186];1) -> 27 | E186: of:=YEAR([.B186]) -> 2020 | F186: of:=ROUNDUP(MONTH([.B186])/3;0) -> 3
A187: of:=[.A186]+1 -> 186 | B187: of:=[.B186]+1 -> 2020-07-04 | C187: of:=DAY([.B187]) -> 4 | D187: of:=WEEKNUM([.B187];1) -> 27 | E187: of:=YEAR([.B187]) -> 2020 | F187: of:=ROUNDUP(MONTH([.B187])/3;0) -> 3
A188: of:=[.A187]+1 -> 187 | B188: of:=[.B187]+1 -> 2020-07-05 | C188: of:=DAY([.B188]) -> 5 | D188: of:=WEEKNUM([.B188];1) -> 28 | E188: of:=YEAR([.B188]) -> 2020 | F188: of:=ROUNDUP(MONTH([.B188])/3;0) -> 3
A189: of:=[.A188]+1 -> 188 | B189: of:=[.B188]+1 -> 2020-07-06 | C189: of:=DAY([.B189]) -> 6 | D189: of:=WEEKNUM([.B189];1) -> 28 | E189: of:=YEAR([.B189]) -> 2020 | F189: of:=ROUNDUP(MONTH([.B189])/3;0) -> 3
A190: of:=[.A189]+1 -> 189 | B190: of:=[.B189]+1 -> 2020-07-07 | C190: of:=DAY([.B190]) -> 7 | D190: of:=WEEKNUM([.B190];1) -> 28 | E190: of:=YEAR([.B190]) -> 2020 | F190: of:=ROUNDUP(MONTH([.B190])/3;0) -> 3
A191: of:=[.A190]+1 -> 190 | B191: of:=[.B190]+1 -> 2020-07-08 | C191: of:=DAY([.B191]) -> 8 | D191: of:=WEEKNUM([.B191];1) -> 28 | E191: of:=YEAR([.B191]) -> 2020 | F191: of:=ROUNDUP(MONTH([.B191])/3;0) -> 3
A192: of:=[.A191]+1 -> 191 | B192: of:=[.B191]+1 -> 2020-07-09 | C192: of:=DAY([.B192]) -> 9 | D192: of:=WEEKNUM([.B192];1) -> 28 | E192: of:=YEAR([.B192]) -> 2020 | F192: of:=ROUNDUP(MONTH([.B192])/3;0) -> 3
A193: of:=[.A192]+1 -> 192 | B193: of:=[.B192]+1 -> 2020-07-10 | C193: of:=DAY([.B193]) -> 10 | D193: of:=WEEKNUM([.B193];1) -> 28 | E193: of:=YEAR([.B193]) -> 2020 | F193: of:=ROUNDUP(MONTH([.B193])/3;0) -> 3
A194: of:=[.A193]+1 -> 193 | B194: of:=[.B193]+1 -> 2020-07-11 | C194: of:=DAY([.B194]) -> 11 | D194: of:=WEEKNUM([.B194];1) -> 28 | E194: of:=YEAR([.B194]) -> 2020 | F194: of:=ROUNDUP(MONTH([.B194])/3;0) -> 3
A195: of:=[.A194]+1 -> 194 | B195: of:=[.B194]+1 -> 2020-07-12 | C195: of:=DAY([.B195]) -> 12 | D195: of:=WEEKNUM([.B195];1) -> 29 | E195: of:=YEAR([.B195]) -> 2020 | F195: of:=ROUNDUP(MONTH([.B195])/3;0) -> 3
A196: of:=[.A195]+1 -> 195 | B196: of:=[.B195]+1 -> 2020-07-13 | C196: of:=DAY([.B196]) -> 13 | D196: of:=WEEKNUM([.B196];1) -> 29 | E196: of:=YEAR([.B196]) -> 2020 | F196: of:=ROUNDUP(MONTH([.B196])/3;0) -> 3
A197: of:=[.A196]+1 -> 196 | B197: of:=[.B196]+1 -> 2020-07-14 | C197: of:=DAY([.B197]) -> 14 | D197: of:=WEEKNUM([.B197];1) -> 29 | E197: of:=YEAR([.B197]) -> 2020 | F197: of:=ROUNDUP(MONTH([.B197])/3;0) -> 3
A198: of:=[.A197]+1 -> 197 | B198: of:=[.B197]+1 -> 2020-07-15 | C198: of:=DAY([.B198]) -> 15 | D198: of:=WEEKNUM([.B198];1) -> 29 | E198: of:=YEAR([.B198]) -> 2020 | F198: of:=ROUNDUP(MONTH([.B198])/3;0) -> 3
A199: of:=[.A198]+1 -> 198 | B199: of:=[.B198]+1 -> 2020-07-16 | C199: of:=DAY([.B199]) -> 16 | D199: of:=WEEKNUM([.B199];1) -> 29 | E199: of:=YEAR([.B199]) -> 2020 | F199: of:=ROUNDUP(MONTH([.B199])/3;0) -> 3
A200: of:=[.A199]+1 -> 199 | B200: of:=[.B199]+1 -> 2020-07-17 | C200: of:=DAY([.B200]) -> 17 | D200: of:=WEEKNUM([.B200];1) -> 29 | E200: of:=YEAR([.B200]) -> 2020 | F200: of:=ROUNDUP(MONTH([.B200])/3;0) -> 3
A201: of:=[.A200]+1 -> 200 | B201: of:=[.B200]+1 -> 2020-07-18 | C201: of:=DAY([.B201]) -> 18 | D201: of:=WEEKNUM([.B201];1) -> 29 | E201: of:=YEAR([.B201]) -> 2020 | F201: of:=ROUNDUP(MONTH([.B201])/3;0) -> 3
A202: of:=[.A201]+1 -> 201 | B202: of:=[.B201]+1 -> 2020-07-19 | C202: of:=DAY([.B202]) -> 19 | D202: of:=WEEKNUM([.B202];1) -> 30 | E202: of:=YEAR([.B202]) -> 2020 | F202: of:=ROUNDUP(MONTH([.B202])/3;0) -> 3
A203: of:=[.A202]+1 -> 202 | B203: of:=[.B202]+1 -> 2020-07-20 | C203: of:=DAY([.B203]) -> 20 | D203: of:=WEEKNUM([.B203];1) -> 30 | E203: of:=YEAR([.B203]) -> 2020 | F203: of:=ROUNDUP(MONTH([.B203])/3;0) -> 3
A204: of:=[.A203]+1 -> 203 | B204: of:=[.B203]+1 -> 2020-07-21 | C204: of:=DAY([.B204]) -> 21 | D204: of:=WEEKNUM([.B204];1) -> 30 | E204: of:=YEAR([.B204]) -> 2020 | F204: of:=ROUNDUP(MONTH([.B204])/3;0) -> 3
A205: of:=[.A204]+1 -> 204 | B205: of:=[.B204]+1 -> 2020-07-22 | C205: of:=DAY([.B205]) -> 22 | D205: of:=WEEKNUM([.B205];1) -> 30 | E205: of:=YEAR([.B205]) -> 2020 | F205: of:=ROUNDUP(MONTH([.B205])/3;0) -> 3
A206: of:=[.A205]+1 -> 205 | B206: of:=[.B205]+1 -> 2020-07-23 | C206: of:=DAY([.B206]) -> 23 | D206: of:=WEEKNUM([.B206];1) -> 30 | E206: of:=YEAR([.B206]) -> 2020 | F206: of:=ROUNDUP(MONTH([.B206])/3;0) -> 3
A207: of:=[.A206]+1 -> 206 | B207: of:=[.B206]+1 -> 2020-07-24 | C207: of:=DAY([.B207]) -> 24 | D207: of:=WEEKNUM([.B207];1) -> 30 | E207: of:=YEAR([.B207]) -> 2020 | F207: of:=ROUNDUP(MONTH([.B207])/3;0) -> 3
A208: of:=[.A207]+1 -> 207 | B208: of:=[.B207]+1 -> 2020-07-25 | C208: of:=DAY([.B208]) -> 25 | D208: of:=WEEKNUM([.B208];1) -> 30 | E208: of:=YEAR([.B208]) -> 2020 | F208: of:=ROUNDUP(MONTH([.B208])/3;0) -> 3
A209: of:=[.A208]+1 -> 208 | B209: of:=[.B208]+1 -> 2020-07-26 | C209: of:=DAY([.B209]) -> 26 | D209: of:=WEEKNUM([.B209];1) -> 31 | E209: of:=YEAR([.B209]) -> 2020 | F209: of:=ROUNDUP(MONTH([.B209])/3;0) -> 3
A210: of:=[.A209]+1 -> 209 | B210: of:=[.B209]+1 -> 2020-07-27 | C210: of:=DAY([.B210]) -> 27 | D210: of:=WEEKNUM([.B210];1) -> 31 | E210: of:=YEAR([.B210]) -> 2020 | F210: of:=ROUNDUP(MONTH([.B210])/3;0) -> 3
A211: of:=[.A210]+1 -> 210 | B211: of:=[.B210]+1 -> 2020-07-28 | C211: of:=DAY([.B211]) -> 28 | D211: of:=WEEKNUM([.B211];1) -> 31 | E211: of:=YEAR([.B211]) -> 2020 | F211: of:=ROUNDUP(MONTH([.B211])/3;0) -> 3
A212: of:=[.A211]+1 -> 211 | B212: of:=[.B211]+1 -> 2020-07-29 | C212: of:=DAY([.B212]) -> 29 | D212: of:=WEEKNUM([.B212];1) -> 31 | E212: of:=YEAR([.B212]) -> 2020 | F212: of:=ROUNDUP(MONTH([.B212])/3;0) -> 3
A213: of:=[.A212]+1 -> 212 | B213: of:=[.B212]+1 -> 2020-07-30 | C213: of:=DAY([.B213]) -> 30 | D213: of:=WEEKNUM([.B213];1) -> 31 | E213: of:=YEAR([.B213]) -> 2020 | F213: of:=ROUNDUP(MONTH([.B213])/3;0) -> 3
A214: of:=[.A213]+1 -> 213 | B214: of:=[.B213]+1 -> 2020-07-31 | C214: of:=DAY([.B214]) -> 31 | D214: of:=WEEKNUM([.B214];1) -> 31 | E214: of:=YEAR([.B214]) -> 2020 | F214: of:=ROUNDUP(MONTH([.B214])/3;0) -> 3
A215: of:=[.A214]+1 -> 214 | B215: of:=[.B214]+1 -> 2020-08-01 | C215: of:=DAY([.B215]) -> 1 | D215: of:=WEEKNUM([.B215];1) -> 31 | E215: of:=YEAR([.B215]) -> 2020 | F215: of:=ROUNDUP(MONTH([.B215])/3;0) -> 3
A216: of:=[.A215]+1 -> 215 | B216: of:=[.B215]+1 -> 2020-08-02 | C216: of:=DAY([.B216]) -> 2 | D216: of:=WEEKNUM([.B216];1) -> 32 | E216: of:=YEAR([.B216]) -> 2020 | F216: of:=ROUNDUP(MONTH([.B216])/3;0) -> 3
A217: of:=[.A216]+1 -> 216 | B217: of:=[.B216]+1 -> 2020-08-03 | C217: of:=DAY([.B217]) -> 3 | D217: of:=WEEKNUM([.B217];1) -> 32 | E217: of:=YEAR([.B217]) -> 2020 | F217: of:=ROUNDUP(MONTH([.B217])/3;0) -> 3
A218: of:=[.A217]+1 -> 217 | B218: of:=[.B217]+1 -> 2020-08-04 | C218: of:=DAY([.B218]) -> 4 | D218: of:=WEEKNUM([.B218];1) -> 32 | E218: of:=YEAR([.B218]) -> 2020 | F218: of:=ROUNDUP(MONTH([.B218])/3;0) -> 3
A219: of:=[.A218]+1 -> 218 | B219: of:=[.B218]+1 -> 2020-08-05 | C219: of:=DAY([.B219]) -> 5 | D219: of:=WEEKNUM([.B219];1) -> 32 | E219: of:=YEAR([.B219]) -> 2020 | F219: of:=ROUNDUP(MONTH([.B219])/3;0) -> 3
A220: of:=[.A219]+1 -> 219 | B220: of:=[.B219]+1 -> 2020-08-06 | C220: of:=DAY([.B220]) -> 6 | D220: of:=WEEKNUM([.B220];1) -> 32 | E220: of:=YEAR([.B220]) -> 2020 | F220: of:=ROUNDUP(MONTH([.B220])/3;0) -> 3
A221: of:=[.A220]+1 -> 220 | B221: of:=[.B220]+1 -> 2020-08-07 | C221: of:=DAY([.B221]) -> 7 | D221: of:=WEEKNUM([.B221];1) -> 32 | E221: of:=YEAR([.B221]) -> 2020 | F221: of:=ROUNDUP(MONTH([.B221])/3;0) -> 3
A222: of:=[.A221]+1 -> 221 | B222: of:=[.B221]+1 -> 2020-08-08 | C222: of:=DAY([.B222]) -> 8 | D222: of:=WEEKNUM([.B222];1) -> 32 | E222: of:=YEAR([.B222]) -> 2020 | F222: of:=ROUNDUP(MONTH([.B222])/3;0) -> 3
A223: of:=[.A222]+1 -> 222 | B223: of:=[.B222]+1 -> 2020-08-09 | C223: of:=DAY([.B223]) -> 9 | D223: of:=WEEKNUM([.B223];1) -> 33 | E223: of:=YEAR([.B223]) -> 2020 | F223: of:=ROUNDUP(MONTH([.B223])/3;0) -> 3
A224: of:=[.A223]+1 -> 223 | B224: of:=[.B223]+1 -> 2020-08-10 | C224: of:=DAY([.B224]) -> 10 | D224: of:=WEEKNUM([.B224];1) -> 33 | E224: of:=YEAR([.B224]) -> 2020 | F224: of:=ROUNDUP(MONTH([.B224])/3;0) -> 3
A225: of:=[.A224]+1 -> 224 | B225: of:=[.B224]+1 -> 2020-08-11 | C225: of:=DAY([.B225]) -> 11 | D225: of:=WEEKNUM([.B225];1) -> 33 | E225: of:=YEAR([.B225]) -> 2020 | F225: of:=ROUNDUP(MONTH([.B225])/3;0) -> 3
A226: of:=[.A225]+1 -> 225 | B226: of:=[.B225]+1 -> 2020-08-12 | C226: of:=DAY([.B226]) -> 12 | D226: of:=WEEKNUM([.B226];1) -> 33 | E226: of:=YEAR([.B226]) -> 2020 | F226: of:=ROUNDUP(MONTH([.B226])/3;0) -> 3
A227: of:=[.A226]+1 -> 226 | B227: of:=[.B226]+1 -> 2020-08-13 | C227: of:=DAY([.B227]) -> 13 | D227: of:=WEEKNUM([.B227];1) -> 33 | E227: of:=YEAR([.B227]) -> 2020 | F227: of:=ROUNDUP(MONTH([.B227])/3;0) -> 3
A228: of:=[.A227]+1 -> 227 | B228: of:=[.B227]+1 -> 2020-08-14 | C228: of:=DAY([.B228]) -> 14 | D228: of:=WEEKNUM([.B228];1) -> 33 | E228: of:=YEAR([.B228]) -> 2020 | F228: of:=ROUNDUP(MONTH([.B228])/3;0) -> 3
A229: of:=[.A228]+1 -> 228 | B229: of:=[.B228]+1 -> 2020-08-15 | C229: of:=DAY([.B229]) -> 15 | D229: of:=WEEKNUM([.B229];1) -> 33 | E229: of:=YEAR([.B229]) -> 2020 | F229: of:=ROUNDUP(MONTH([.B229])/3;0) -> 3
A230: of:=[.A229]+1 -> 229 | B230: of:=[.B229]+1 -> 2020-08-16 | C230: of:=DAY([.B230]) -> 16 | D230: of:=WEEKNUM([.B230];1) -> 34 | E230: of:=YEAR([.B230]) -> 2020 | F230: of:=ROUNDUP(MONTH([.B230])/3;0) -> 3
A231: of:=[.A230]+1 -> 230 | B231: of:=[.B230]+1 -> 2020-08-17 | C231: of:=DAY([.B231]) -> 17 | D231: of:=WEEKNUM([.B231];1) -> 34 | E231: of:=YEAR([.B231]) -> 2020 | F231: of:=ROUNDUP(MONTH([.B231])/3;0) -> 3
A232: of:=[.A231]+1 -> 231 | B232: of:=[.B231]+1 -> 2020-08-18 | C232: of:=DAY([.B232]) -> 18 | D232: of:=WEEKNUM([.B232];1) -> 34 | E232: of:=YEAR([.B232]) -> 2020 | F232: of:=ROUNDUP(MONTH([.B232])/3;0) -> 3
A233: of:=[.A232]+1 -> 232 | B233: of:=[.B232]+1 -> 2020-08-19 | C233: of:=DAY([.B233]) -> 19 | D233: of:=WEEKNUM([.B233];1) -> 34 | E233: of:=YEAR([.B233]) -> 2020 | F233: of:=ROUNDUP(MONTH([.B233])/3;0) -> 3
A234: of:=[.A233]+1 -> 233 | B234: of:=[.B233]+1 -> 2020-08-20 | C234: of:=DAY([.B234]) -> 20 | D234: of:=WEEKNUM([.B234];1) -> 34 | E234: of:=YEAR([.B234]) -> 2020 | F234: of:=ROUNDUP(MONTH([.B234])/3;0) -> 3
A235: of:=[.A234]+1 -> 234 | B235: of:=[.B234]+1 -> 2020-08-21 | C235: of:=DAY([.B235]) -> 21 | D235: of:=WEEKNUM([.B235];1) -> 34 | E235: of:=YEAR([.B235]) -> 2020 | F235: of:=ROUNDUP(MONTH([.B235])/3;0) -> 3
A236: of:=[.A235]+1 -> 235 | B236: of:=[.B235]+1 -> 2020-08-22 | C236: of:=DAY([.B236]) -> 22 | D236: of:=WEEKNUM([.B236];1) -> 34 | E236: of:=YEAR([.B236]) -> 2020 | F236: of:=ROUNDUP(MONTH([.B236])/3;0) -> 3
A237: of:=[.A236]+1 -> 236 | B237: of:=[.B236]+1 -> 2020-08-23 | C237: of:=DAY([.B237]) -> 23 | D237: of:=WEEKNUM([.B237];1) -> 35 | E237: of:=YEAR([.B237]) -> 2020 | F237: of:=ROUNDUP(MONTH([.B237])/3;0) -> 3
A238: of:=[.A237]+1 -> 237 | B238: of:=[.B237]+1 -> 2020-08-24 | C238: of:=DAY([.B238]) -> 24 | D238: of:=WEEKNUM([.B238];1) -> 35 | E238: of:=YEAR([.B238]) -> 2020 | F238: of:=ROUNDUP(MONTH([.B238])/3;0) -> 3
A239: of:=[.A238]+1 -> 238 | B239: of:=[.B238]+1 -> 2020-08-25 | C239: of:=DAY([.B239]) -> 25 | D239: of:=WEEKNUM([.B239];1) -> 35 | E239: of:=YEAR([.B239]) -> 2020 | F239: of:=ROUNDUP(MONTH([.B239])/3;0) -> 3
A240: of:=[.A239]+1 -> 239 | B240: of:=[.B239]+1 -> 2020-08-26 | C240: of:=DAY([.B240]) -> 26 | D240: of:=WEEKNUM([.B240];1) -> 35 | E240: of:=YEAR([.B240]) -> 2020 | F240: of:=ROUNDUP(MONTH([.B240])/3;0) -> 3
A241: of:=[.A240]+1 -> 240 | B241: of:=[.B240]+1 -> 2020-08-27 | C241: of:=DAY([.B241]) -> 27 | D241: of:=WEEKNUM([.B241];1) -> 35 | E241: of:=YEAR([.B241]) -> 2020 | F241: of:=ROUNDUP(MONTH([.B241])/3;0) -> 3
A242: of:=[.A241]+1 -> 241 | B242: of:=[.B241]+1 -> 2020-08-28 | C242: of:=DAY([.B242]) -> 28 | D242: of:=WEEKNUM([.B242];1) -> 35 | E242: of:=YEAR([.B242]) -> 2020 | F242: of:=ROUNDUP(MONTH([.B242])/3;0) -> 3
A243: of:=[.A242]+1 -> 242 | B243: of:=[.B242]+1 -> 2020-08-29 | C243: of:=DAY([.B243]) -> 29 | D243: of:=WEEKNUM([.B243];1) -> 35 | E243: of:=YEAR([.B243]) -> 2020 | F243: of:=ROUNDUP(MONTH([.B243])/3;0) -> 3
A244: of:=[.A243]+1 -> 243 | B244: of:=[.B243]+1 -> 2020-08-30 | C244: of:=DAY([.B244]) -> 30 | D244: of:=WEEKNUM([.B244];1) -> 36 | E244: of:=YEAR([.B244]) -> 2020 | F244: of:=ROUNDUP(MONTH([.B244])/3;0) -> 3
A245: of:=[.A244]+1 -> 244 | B245: of:=[.B244]+1 -> 2020-08-31 | C245: of:=DAY([.B245]) -> 31 | D245: of:=WEEKNUM([.B245];1) -> 36 | E245: of:=YEAR([.B245]) -> 2020 | F245: of:=ROUNDUP(MONTH([.B245])/3;0) -> 3
A246: of:=[.A245]+1 -> 245 | B246: of:=[.B245]+1 -> 2020-09-01 | C246: of:=DAY([.B246]) -> 1 | D246: of:=WEEKNUM([.B246];1) -> 36 | E246: of:=YEAR([.B246]) -> 2020 | F246: of:=ROUNDUP(MONTH([.B246])/3;0) -> 3
A247: of:=[.A246]+1 -> 246 | B247: of:=[.B246]+1 -> 2020-09-02 | C247: of:=DAY([.B247]) -> 2 | D247: of:=WEEKNUM([.B247];1) -> 36 | E247: of:=YEAR([.B247]) -> 2020 | F247: of:=ROUNDUP(MONTH([.B247])/3;0) -> 3
A248: of:=[.A247]+1 -> 247 | B248: of:=[.B247]+1 -> 2020-09-03 | C248: of:=DAY([.B248]) -> 3 | D248: of:=WEEKNUM([.B248];1) -> 36 | E248: of:=YEAR([.B248]) -> 2020 | F248: of:=ROUNDUP(MONTH([.B248])/3;0) -> 3
A249: of:=[.A248]+1 -> 248 | B249: of:=[.B248]+1 -> 2020-09-04 | C249: of:=DAY([.B249]) -> 4 | D249: of:=WEEKNUM([.B249];1) -> 36 | E249: of:=YEAR([.B249]) -> 2020 | F249: of:=ROUNDUP(MONTH([.B249])/3;0) -> 3
A250: of:=[.A249]+1 -> 249 | B250: of:=[.B249]+1 -> 2020-09-05 | C250: of:=DAY([.B250]) -> 5 | D250: of:=WEEKNUM([.B250];1) -> 36 | E250: of:=YEAR([.B250]) -> 2020 | F250: of:=ROUNDUP(MONTH([.B250])/3;0) -> 3
A251: of:=[.A250]+1 -> 250 | B251: of:=[.B250]+1 -> 2020-09-06 | C251: of:=DAY([.B251]) -> 6 | D251: of:=WEEKNUM([.B251];1) -> 37 | E251: of:=YEAR([.B251]) -> 2020 | F251: of:=ROUNDUP(MONTH([.B251])/3;0) -> 3
A252: of:=[.A251]+1 -> 251 | B252: of:=[.B251]+1 -> 2020-09-07 | C252: of:=DAY([.B252]) -> 7 | D252: of:=WEEKNUM([.B252];1) -> 37 | E252: of:=YEAR([.B252]) -> 2020 | F252: of:=ROUNDUP(MONTH([.B252])/3;0) -> 3
A253: of:=[.A252]+1 -> 252 | B253: of:=[.B252]+1 -> 2020-09-08 | C253: of:=DAY([.B253]) -> 8 | D253: of:=WEEKNUM([.B253];1) -> 37 | E253: of:=YEAR([.B253]) -> 2020 | F253: of:=ROUNDUP(MONTH([.B253])/3;0) -> 3
A254: of:=[.A253]+1 -> 253 | B254: of:=[.B253]+1 -> 2020-09-09 | C254: of:=DAY([.B254]) -> 9 | D254: of:=WEEKNUM([.B254];1) -> 37 | E254: of:=YEAR([.B254]) -> 2020 | F254: of:=ROUNDUP(MONTH([.B254])/3;0) -> 3
A255: of:=[.A254]+1 -> 254 | B255: of:=[.B254]+1 -> 2020-09-10 | C255: of:=DAY([.B255]) -> 10 | D255: of:=WEEKNUM([.B255];1) -> 37 | E255: of:=YEAR([.B255]) -> 2020 | F255: of:=ROUNDUP(MONTH([.B255])/3;0) -> 3
A256: of:=[.A255]+1 -> 255 | B256: of:=[.B255]+1 -> 2020-09-11 | C256: of:=DAY([.B256]) -> 11 | D256: of:=WEEKNUM([.B256];1) -> 37 | E256: of:=YEAR([.B256]) -> 2020 | F256: of:=ROUNDUP(MONTH([.B256])/3;0) -> 3
A257: of:=[.A256]+1 -> 256 | B257: of:=[.B256]+1 -> 2020-09-12 | C257: of:=DAY([.B257]) -> 12 | D257: of:=WEEKNUM([.B257];1) -> 37 | E257: of:=YEAR([.B257]) -> 2020 | F257: of:=ROUNDUP(MONTH([.B257])/3;0) -> 3
A258: of:=[.A257]+1 -> 257 | B258: of:=[.B257]+1 -> 2020-09-13 | C258: of:=DAY([.B258]) -> 13 | D258: of:=WEEKNUM([.B258];1) -> 38 | E258: of:=YEAR([.B258]) -> 2020 | F258: of:=ROUNDUP(MONTH([.B258])/3;0) -> 3
A259: of:=[.A258]+1 -> 258 | B259: of:=[.B258]+1 -> 2020-09-14 | C259: of:=DAY([.B259]) -> 14 | D259: of:=WEEKNUM([.B259];1) -> 38 | E259: of:=YEAR([.B259]) -> 2020 | F259: of:=ROUNDUP(MONTH([.B259])/3;0) -> 3
A260: of:=[.A259]+1 -> 259 | B260: of:=[.B259]+1 -> 2020-09-15 | C260: of:=DAY([.B260]) -> 15 | D260: of:=WEEKNUM([.B260];1) -> 38 | E260: of:=YEAR([.B260]) -> 2020 | F260: of:=ROUNDUP(MONTH([.B260])/3;0) -> 3
A261: of:=[.A260]+1 -> 260 | B261: of:=[.B260]+1 -> 2020-09-16 | C261: of:=DAY([.B261]) -> 16 | D261: of:=WEEKNUM([.B261];1) -> 38 | E261: of:=YEAR([.B261]) -> 2020 | F261: of:=ROUNDUP(MONTH([.B261])/3;0) -> 3
A262: of:=[.A261]+1 -> 261 | B262: of:=[.B261]+1 -> 2020-09-17 | C262: of:=DAY([.B262]) -> 17 | D262: of:=WEEKNUM([.B262];1) -> 38 | E262: of:=YEAR([.B262]) -> 2020 | F262: of:=ROUNDUP(MONTH([.B262])/3;0) -> 3
A263: of:=[.A262]+1 -> 262 | B263: of:=[.B262]+1 -> 2020-09-18 | C263: of:=DAY([.B263]) -> 18 | D263: of:=WEEKNUM([.B263];1) -> 38 | E263: of:=YEAR([.B263]) -> 2020 | F263: of:=ROUNDUP(MONTH([.B263])/3;0) -> 3
A264: of:=[.A263]+1 -> 263 | B264: of:=[.B263]+1 -> 2020-09-19 | C264: of:=DAY([.B264]) -> 19 | D264: of:=WEEKNUM([.B264];1) -> 38 | E264: of:=YEAR([.B264]) -> 2020 | F264: of:=ROUNDUP(MONTH([.B264])/3;0) -> 3
A265: of:=[.A264]+1 -> 264 | B265: of:=[.B264]+1 -> 2020-09-20 | C265: of:=DAY([.B265]) -> 20 | D265: of:=WEEKNUM([.B265];1) -> 39 | E265: of:=YEAR([.B265]) -> 2020 | F265: of:=ROUNDUP(MONTH([.B265])/3;0) -> 3
A266: of:=[.A265]+1 -> 265 | B266: of:=[.B265]+1 -> 2020-09-21 | C266: of:=DAY([.B266]) -> 21 | D266: of:=WEEKNUM([.B266];1) -> 39 | E266: of:=YEAR([.B266]) -> 2020 | F266: of:=ROUNDUP(MONTH([.B266])/3;0) -> 3
A267: of:=[.A266]+1 -> 266 | B267: of:=[.B266]+1 -> 2020-09-22 | C267: of:=DAY([.B267]) -> 22 | D267: of:=WEEKNUM([.B267];1) -> 39 | E267: of:=YEAR([.B267]) -> 2020 | F267: of:=ROUNDUP(MONTH([.B267])/3;0) -> 3
A268: of:=[.A267]+1 -> 267 | B268: of:=[.B267]+1 -> 2020-09-23 | C268: of:=DAY([.B268]) -> 23 | D268: of:=WEEKNUM([.B268];1) -> 39 | E268: of:=YEAR([.B268]) -> 2020 | F268: of:=ROUNDUP(MONTH([.B268])/3;0) -> 3
A269: of:=[.A268]+1 -> 268 | B269: of:=[.B268]+1 -> 2020-09-24 | C269: of:=DAY([.B269]) -> 24 | D269: of:=WEEKNUM([.B269];1) -> 39 | E269: of:=YEAR([.B269]) -> 2020 | F269: of:=ROUNDUP(MONTH([.B269])/3;0) -> 3
A270: of:=[.A269]+1 -> 269 | B270: of:=[.B269]+1 -> 2020-09-25 | C270: of:=DAY([.B270]) -> 25 | D270: of:=WEEKNUM([.B270];1) -> 39 | E270: of:=YEAR([.B270]) -> 2020 | F270: of:=ROUNDUP(MONTH([.B270])/3;0) -> 3
A271: of:=[.A270]+1 -> 270 | B271: of:=[.B270]+1 -> 2020-09-26 | C271: of:=DAY([.B271]) -> 26 | D271: of:=WEEKNUM([.B271];1) -> 39 | E271: of:=YEAR([.B271]) -> 2020 | F271: of:=ROUNDUP(MONTH([.B271])/3;0) -> 3
A272: of:=[.A271]+1 -> 271 | B272: of:=[.B271]+1 -> 2020-09-27 | C272: of:=DAY([.B272]) -> 27 | D272: of:=WEEKNUM([.B272];1) -> 40 | E272: of:=YEAR([.B272]) -> 2020 | F272: of:=ROUNDUP(MONTH([.B272])/3;0) -> 3
A273: of:=[.A272]+1 -> 272 | B273: of:=[.B272]+1 -> 2020-09-28 | C273: of:=DAY([.B273]) -> 28 | D273: of:=WEEKNUM([.B273];1) -> 40 | E273: of:=YEAR([.B273]) -> 2020 | F273: of:=ROUNDUP(MONTH([.B273])/3;0) -> 3
A274: of:=[.A273]+1 -> 273 | B274: of:=[.B273]+1 -> 2020-09-29 | C274: of:=DAY([.B274]) -> 29 | D274: of:=WEEKNUM([.B274];1) -> 40 | E274: of:=YEAR([.B274]) -> 2020 | F274: of:=ROUNDUP(MONTH([.B274])/3;0) -> 3
A275: of:=[.A274]+1 -> 274 | B275: of:=[.B274]+1 -> 2020-09-30 | C275: of:=DAY([.B275]) -> 30 | D275: of:=WEEKNUM([.B275];1) -> 40 | E275: of:=YEAR([.B275]) -> 2020 | F275: of:=ROUNDUP(MONTH([.B275])/3;0) -> 3
A276: of:=[.A275]+1 -> 275 | B276: of:=[.B275]+1 -> 2020-10-01 | C276: of:=DAY([.B276]) -> 1 | D276: of:=WEEKNUM([.B276];1) -> 40 | E276: of:=YEAR([.B276]) -> 2020 | F276: of:=ROUNDUP(MONTH([.B276])/3;0) -> 4
A277: of:=[.A276]+1 -> 276 | B277: of:=[.B276]+1 -> 2020-10-02 | C277: of:=DAY([.B277]) -> 2 | D277: of:=WEEKNUM([.B277];1) -> 40 | E277: of:=YEAR([.B277]) -> 2020 | F277: of:=ROUNDUP(MONTH([.B277])/3;0) -> 4
A278: of:=[.A277]+1 -> 277 | B278: of:=[.B277]+1 -> 2020-10-03 | C278: of:=DAY([.B278]) -> 3 | D278: of:=WEEKNUM([.B278];1) -> 40 | E278: of:=YEAR([.B278]) -> 2020 | F278: of:=ROUNDUP(MONTH([.B278])/3;0) -> 4
A279: of:=[.A278]+1 -> 278 | B279: of:=[.B278]+1 -> 2020-10-04 | C279: of:=DAY([.B279]) -> 4 | D279: of:=WEEKNUM([.B279];1) -> 41 | E279: of:=YEAR([.B279]) -> 2020 | F279: of:=ROUNDUP(MONTH([.B279])/3;0) -> 4
A280: of:=[.A279]+1 -> 279 | B280: of:=[.B279]+1 -> 2020-10-05 | C280: of:=DAY([.B280]) -> 5 | D280: of:=WEEKNUM([.B280];1) -> 41 | E280: of:=YEAR([.B280]) -> 2020 | F280: of:=ROUNDUP(MONTH([.B280])/3;0) -> 4
A281: of:=[.A280]+1 -> 280 | B281: of:=[.B280]+1 -> 2020-10-06 | C281: of:=DAY([.B281]) -> 6 | D281: of:=WEEKNUM([.B281];1) -> 41 | E281: of:=YEAR([.B281]) -> 2020 | F281: of:=ROUNDUP(MONTH([.B281])/3;0) -> 4
A282: of:=[.A281]+1 -> 281 | B282: of:=[.B281]+1 -> 2020-10-07 | C282: of:=DAY([.B282]) -> 7 | D282: of:=WEEKNUM([.B282];1) -> 41 | E282: of:=YEAR([.B282]) -> 2020 | F282: of:=ROUNDUP(MONTH([.B282])/3;0) -> 4
A283: of:=[.A282]+1 -> 282 | B283: of:=[.B282]+1 -> 2020-10-08 | C283: of:=DAY([.B283]) -> 8 | D283: of:=WEEKNUM([.B283];1) -> 41 | E283: of:=YEAR([.B283]) -> 2020 | F283: of:=ROUNDUP(MONTH([.B283])/3;0) -> 4
A284: of:=[.A283]+1 -> 283 | B284: of:=[.B283]+1 -> 2020-10-09 | C284: of:=DAY([.B284]) -> 9 | D284: of:=WEEKNUM([.B284];1) -> 41 | E284: of:=YEAR([.B284]) -> 2020 | F284: of:=ROUNDUP(MONTH([.B284])/3;0) -> 4
A285: of:=[.A284]+1 -> 284 | B285: of:=[.B284]+1 -> 2020-10-10 | C285: of:=DAY([.B285]) -> 10 | D285: of:=WEEKNUM([.B285];1) -> 41 | E285: of:=YEAR([.B285]) -> 2020 | F285: of:=ROUNDUP(MONTH([.B285])/3;0) -> 4
A286: of:=[.A285]+1 -> 285 | B286: of:=[.B285]+1 -> 2020-10-11 | C286: of:=DAY([.B286]) -> 11 | D286: of:=WEEKNUM([.B286];1) -> 42 | E286: of:=YEAR([.B286]) -> 2020 | F286: of:=ROUNDUP(MONTH([.B286])/3;0) -> 4
A287: of:=[.A286]+1 -> 286 | B287: of:=[.B286]+1 -> 2020-10-12 | C287: of:=DAY([.B287]) -> 12 | D287: of:=WEEKNUM([.B287];1) -> 42 | E287: of:=YEAR([.B287]) -> 2020 | F287: of:=ROUNDUP(MONTH([.B287])/3;0) -> 4
A288: of:=[.A287]+1 -> 287 | B288: of:=[.B287]+1 -> 2020-10-13 | C288: of:=DAY([.B288]) -> 13 | D288: of:=WEEKNUM([.B288];1) -> 42 | E288: of:=YEAR([.B288]) -> 2020 | F288: of:=ROUNDUP(MONTH([.B288])/3;0) -> 4
A289: of:=[.A288]+1 -> 288 | B289: of:=[.B288]+1 -> 2020-10-14 | C289: of:=DAY([.B289]) -> 14 | D289: of:=WEEKNUM([.B289];1) -> 42 | E289: of:=YEAR([.B289]) -> 2020 | F289: of:=ROUNDUP(MONTH([.B289])/3;0) -> 4
A290: of:=[.A289]+1 -> 289 | B290: of:=[.B289]+1 -> 2020-10-15 | C290: of:=DAY([.B290]) -> 15 | D290: of:=WEEKNUM([.B290];1) -> 42 | E290: of:=YEAR([.B290]) -> 2020 | F290: of:=ROUNDUP(MONTH([.B290])/3;0) -> 4
A291: of:=[.A290]+1 -> 290 | B291: of:=[.B290]+1 -> 2020-10-16 | C291: of:=DAY([.B291]) -> 16 | D291: of:=WEEKNUM([.B291];1) -> 42 | E291: of:=YEAR([.B291]) -> 2020 | F291: of:=ROUNDUP(MONTH([.B291])/3;0) -> 4
A292: of:=[.A291]+1 -> 291 | B292: of:=[.B291]+1 -> 2020-10-17 | C292: of:=DAY([.B292]) -> 17 | D292: of:=WEEKNUM([.B292];1) -> 42 | E292: of:=YEAR([.B292]) -> 2020 | F292: of:=ROUNDUP(MONTH([.B292])/3;0) -> 4
A293: of:=[.A292]+1 -> 292 | B293: of:=[.B292]+1 -> 2020-10-18 | C293: of:=DAY([.B293]) -> 18 | D293: of:=WEEKNUM([.B293];1) -> 43 | E293: of:=YEAR([.B293]) -> 2020 | F293: of:=ROUNDUP(MONTH([.B293])/3;0) -> 4
A294: of:=[.A293]+1 -> 293 | B294: of:=[.B293]+1 -> 2020-10-19 | C294: of:=DAY([.B294]) -> 19 | D294: of:=WEEKNUM([.B294];1) -> 43 | E294: of:=YEAR([.B294]) -> 2020 | F294: of:=ROUNDUP(MONTH([.B294])/3;0) -> 4
A295: of:=[.A294]+1 -> 294 | B295: of:=[.B294]+1 -> 2020-10-20 | C295: of:=DAY([.B295]) -> 20 | D295: of:=WEEKNUM([.B295];1) -> 43 | E295: of:=YEAR([.B295]) -> 2020 | F295: of:=ROUNDUP(MONTH([.B295])/3;0) -> 4
A296: of:=[.A295]+1 -> 295 | B296: of:=[.B295]+1 -> 2020-10-21 | C296: of:=DAY([.B296]) -> 21 | D296: of:=WEEKNUM([.B296];1) -> 43 | E296: of:=YEAR([.B296]) -> 2020 | F296: of:=ROUNDUP(MONTH([.B296])/3;0) -> 4
A297: of:=[.A296]+1 -> 296 | B297: of:=[.B296]+1 -> 2020-10-22 | C297: of:=DAY([.B297]) -> 22 | D297: of:=WEEKNUM([.B297];1) -> 43 | E297: of:=YEAR([.B297]) -> 2020 | F297: of:=ROUNDUP(MONTH([.B297])/3;0) -> 4
A298: of:=[.A297]+1 -> 297 | B298: of:=[.B297]+1 -> 2020-10-23 | C298: of:=DAY([.B298]) -> 23 | D298: of:=WEEKNUM([.B298];1) -> 43 | E298: of:=YEAR([.B298]) -> 2020 | F298: of:=ROUNDUP(MONTH([.B298])/3;0) -> 4
A299: of:=[.A298]+1 -> 298 | B299: of:=[.B298]+1 -> 2020-10-24 | C299: of:=DAY([.B299]) -> 24 | D299: of:=WEEKNUM([.B299];1) -> 43 | E299: of:=YEAR([.B299]) -> 2020 | F299: of:=ROUNDUP(MONTH([.B299])/3;0) -> 4
A300: of:=[.A299]+1 -> 299 | B300: of:=[.B299]+1 -> 2020-10-25 | C300: of:=DAY([.B300]) -> 25 | D300: of:=WEEKNUM([.B300];1) -> 44 | E300: of:=YEAR([.B300]) -> 2020 | F300: of:=ROUNDUP(MONTH([.B300])/3;0) -> 4
A301: of:=[.A300]+1 -> 300 | B301: of:=[.B300]+1 -> 2020-10-26 | C301: of:=DAY([.B301]) -> 26 | D301: of:=WEEKNUM([.B301];1) -> 44 | E301: of:=YEAR([.B301]) -> 2020 | F301: of:=ROUNDUP(MONTH([.B301])/3;0) -> 4
A302: of:=[.A301]+1 -> 301 | B302: of:=[.B301]+1 -> 2020-10-27 | C302: of:=DAY([.B302]) -> 27 | D302: of:=WEEKNUM([.B302];1) -> 44 | E302: of:=YEAR([.B302]) -> 2020 | F302: of:=ROUNDUP(MONTH([.B302])/3;0) -> 4
A303: of:=[.A302]+1 -> 302 | B303: of:=[.B302]+1 -> 2020-10-28 | C303: of:=DAY([.B303]) -> 28 | D303: of:=WEEKNUM([.B303];1) -> 44 | E303: of:=YEAR([.B303]) -> 2020 | F303: of:=ROUNDUP(MONTH([.B303])/3;0) -> 4
A304: of:=[.A303]+1 -> 303 | B304: of:=[.B303]+1 -> 2020-10-29 | C304: of:=DAY([.B304]) -> 29 | D304: of:=WEEKNUM([.B304];1) -> 44 | E304: of:=YEAR([.B304]) -> 2020 | F304: of:=ROUNDUP(MONTH([.B304])/3;0) -> 4
A305: of:=[.A304]+1 -> 304 | B305: of:=[.B304]+1 -> 2020-10-30 | C305: of:=DAY([.B305]) -> 30 | D305: of:=WEEKNUM([.B305];1) -> 44 | E305: of:=YEAR([.B305]) -> 2020 | F305: of:=ROUNDUP(MONTH([.B305])/3;0) -> 4
A306: of:=[.A305]+1 -> 305 | B306: of:=[.B305]+1 -> 2020-10-31 | C306: of:=DAY([.B306]) -> 31 | D306: of:=WEEKNUM([.B306];1) -> 44 | E306: of:=YEAR([.B306]) -> 2020 | F306: of:=ROUNDUP(MONTH([.B306])/3;0) -> 4
A307: of:=[.A306]+1 -> 306 | B307: of:=[.B306]+1 -> 2020-11-01 | C307: of:=DAY([.B307]) -> 1 | D307: of:=WEEKNUM([.B307];1) -> 45 | E307: of:=YEAR([.B307]) -> 2020 | F307: of:=ROUNDUP(MONTH([.B307])/3;0) -> 4
A308: of:=[.A307]+1 -> 307 | B308: of:=[.B307]+1 -> 2020-11-02 | C308: of:=DAY([.B308]) -> 2 | D308: of:=WEEKNUM([.B308];1) -> 45 | E308: of:=YEAR([.B308]) -> 2020 | F308: of:=ROUNDUP(MONTH([.B308])/3;0) -> 4
A309: of:=[.A308]+1 -> 308 | B309: of:=[.B308]+1 -> 2020-11-03 | C309: of:=DAY([.B309]) -> 3 | D309: of:=WEEKNUM([.B309];1) -> 45 | E309: of:=YEAR([.B309]) -> 2020 | F309: of:=ROUNDUP(MONTH([.B309])/3;0) -> 4
A310: of:=[.A309]+1 -> 309 | B310: of:=[.B309]+1 -> 2020-11-04 | C310: of:=DAY([.B310]) -> 4 | D310: of:=WEEKNUM([.B310];1) -> 45 | E310: of:=YEAR([.B310]) -> 2020 | F310: of:=ROUNDUP(MONTH([.B310])/3;0) -> 4
A311: of:=[.A310]+1 -> 310 | B311: of:=[.B310]+1 -> 2020-11-05 | C311: of:=DAY([.B311]) -> 5 | D311: of:=WEEKNUM([.B311];1) -> 45 | E311: of:=YEAR([.B311]) -> 2020 | F311: of:=ROUNDUP(MONTH([.B311])/3;0) -> 4
A312: of:=[.A311]+1 -> 311 | B312: of:=[.B311]+1 -> 2020-11-06 | C312: of:=DAY([.B312]) -> 6 | D312: of:=WEEKNUM([.B312];1) -> 45 | E312: of:=YEAR([.B312]) -> 2020 | F312: of:=ROUNDUP(MONTH([.B312])/3;0) -> 4
A313: of:=[.A312]+1 -> 312 | B313: of:=[.B312]+1 -> 2020-11-07 | C313: of:=DAY([.B313]) -> 7 | D313: of:=WEEKNUM([.B313];1) -> 45 | E313: of:=YEAR([.B313]) -> 2020 | F313: of:=ROUNDUP(MONTH([.B313])/3;0) -> 4
A314: of:=[.A313]+1 -> 313 | B314: of:=[.B313]+1 -> 2020-11-08 | C314: of:=DAY([.B314]) -> 8 | D314: of:=WEEKNUM([.B314];1) -> 46 | E314: of:=YEAR([.B314]) -> 2020 | F314: of:=ROUNDUP(MONTH([.B314])/3;0) -> 4
A315: of:=[.A314]+1 -> 314 | B315: of:=[.B314]+1 -> 2020-11-09 | C315: of:=DAY([.B315]) -> 9 | D315: of:=WEEKNUM([.B315];1) -> 46 | E315: of:=YEAR([.B315]) -> 2020 | F315: of:=ROUNDUP(MONTH([.B315])/3;0) -> 4
A316: of:=[.A315]+1 -> 315 | B316: of:=[.B315]+1 -> 2020-11-10 | C316: of:=DAY([.B316]) -> 10 | D316: of:=WEEKNUM([.B316];1) -> 46 | E316: of:=YEAR([.B316]) -> 2020 | F316: of:=ROUNDUP(MONTH([.B316])/3;0) -> 4
A317: of:=[.A316]+1 -> 316 | B317: of:=[.B316]+1 -> 2020-11-11 | C317: of:=DAY([.B317]) -> 11 | D317: of:=WEEKNUM([.B317];1) -> 46 | E317: of:=YEAR([.B317]) -> 2020 | F317: of:=ROUNDUP(MONTH([.B317])/3;0) -> 4
A318: of:=[.A317]+1 -> 317 | B318: of:=[.B317]+1 -> 2020-11-12 | C318: of:=DAY([.B318]) -> 12 | D318: of:=WEEKNUM([.B318];1) -> 46 | E318: of:=YEAR([.B318]) -> 2020 | F318: of:=ROUNDUP(MONTH([.B318])/3;0) -> 4
A319: of:=[.A318]+1 -> 318 | B319: of:=[.B318]+1 -> 2020-11-13 | C319: of:=DAY([.B319]) -> 13 | D319: of:=WEEKNUM([.B319];1) -> 46 | E319: of:=YEAR([.B319]) -> 2020 | F319: of:=ROUNDUP(MONTH([.B319])/3;0) -> 4
A320: of:=[.A319]+1 -> 319 | B320: of:=[.B319]+1 -> 2020-11-14 | C320: of:=DAY([.B320]) -> 14 | D320: of:=WEEKNUM([.B320];1) -> 46 | E320: of:=YEAR([.B320]) -> 2020 | F320: of:=ROUNDUP(MONTH([.B320])/3;0) -> 4
A321: of:=[.A320]+1 -> 320 | B321: of:=[.B320]+1 -> 2020-11-15 | C321: of:=DAY([.B321]) -> 15 | D321: of:=WEEKNUM([.B321];1) -> 47 | E321: of:=YEAR([.B321]) -> 2020 | F321: of:=ROUNDUP(MONTH([.B321])/3;0) -> 4
A322: of:=[.A321]+1 -> 321 | B322: of:=[.B321]+1 -> 2020-11-16 | C322: of:=DAY([.B322]) -> 16 | D322: of:=WEEKNUM([.B322];1) -> 47 | E322: of:=YEAR([.B322]) -> 2020 | F322: of:=ROUNDUP(MONTH([.B322])/3;0) -> 4
A323: of:=[.A322]+1 -> 322 | B323: of:=[.B322]+1 -> 2020-11-17 | C323: of:=DAY([.B323]) -> 17 | D323: of:=WEEKNUM([.B323];1) -> 47 | E323: of:=YEAR([.B323]) -> 2020 | F323: of:=ROUNDUP(MONTH([.B323])/3;0) -> 4
A324: of:=[.A323]+1 -> 323 | B324: of:=[.B323]+1 -> 2020-11-18 | C324: of:=DAY([.B324]) -> 18 | D324: of:=WEEKNUM([.B324];1) -> 47 | E324: of:=YEAR([.B324]) -> 2020 | F324: of:=ROUNDUP(MONTH([.B324])/3;0) -> 4
A325: of:=[.A324]+1 -> 324 | B325: of:=[.B324]+1 -> 2020-11-19 | C325: of:=DAY([.B325]) -> 19 | D325: of:=WEEKNUM([.B325];1) -> 47 | E325: of:=YEAR([.B325]) -> 2020 | F325: of:=ROUNDUP(MONTH([.B325])/3;0) -> 4
A326: of:=[.A325]+1 -> 325 | B326: of:=[.B325]+1 -> 2020-11-20 | C326: of:=DAY([.B326]) -> 20 | D326: of:=WEEKNUM([.B326];1) -> 47 | E326: of:=YEAR([.B326]) -> 2020 | F326: of:=ROUNDUP(MONTH([.B326])/3;0) -> 4
A327: of:=[.A326]+1 -> 326 | B327: of:=[.B326]+1 -> 2020-11-21 | C327: of:=DAY([.B327]) -> 21 | D327: of:=WEEKNUM([.B327];1) -> 47 | E327: of:=YEAR([.B327]) -> 2020 | F327: of:=ROUNDUP(MONTH([.B327])/3;0) -> 4
A328: of:=[.A327]+1 -> 327 | B328: of:=[.B327]+1 -> 2020-11-22 | C328: of:=DAY([.B328]) -> 22 | D328: of:=WEEKNUM([.B328];1) -> 48 | E328: of:=YEAR([.B328]) -> 2020 | F328: of:=ROUNDUP(MONTH([.B328])/3;0) -> 4
A329: of:=[.A328]+1 -> 328 | B329: of:=[.B328]+1 -> 2020-11-23 | C329: of:=DAY([.B329]) -> 23 | D329: of:=WEEKNUM([.B329];1) -> 48 | E329: of:=YEAR([.B329]) -> 2020 | F329: of:=ROUNDUP(MONTH([.B329])/3;0) -> 4
A330: of:=[.A329]+1 -> 329 | B330: of:=[.B329]+1 -> 2020-11-24 | C330: of:=DAY([.B330]) -> 24 | D330: of:=WEEKNUM([.B330];1) -> 48 | E330: of:=YEAR([.B330]) -> 2020 | F330: of:=ROUNDUP(MONTH([.B330])/3;0) -> 4
A331: of:=[.A330]+1 -> 330 | B331: of:=[.B330]+1 -> 2020-11-25 | C331: of:=DAY([.B331]) -> 25 | D331: of:=WEEKNUM([.B331];1) -> 48 | E331: of:=YEAR([.B331]) -> 2020 | F331: of:=ROUNDUP(MONTH([.B331])/3;0) -> 4
A332: of:=[.A331]+1 -> 331 | B332: of:=[.B331]+1 -> 2020-11-26 | C332: of:=DAY([.B332]) -> 26 | D332: of:=WEEKNUM([.B332];1) -> 48 | E332: of:=YEAR([.B332]) -> 2020 | F332: of:=ROUNDUP(MONTH([.B332])/3;0) -> 4
A333: of:=[.A332]+1 -> 332 | B333: of:=[.B332]+1 -> 2020-11-27 | C333: of:=DAY([.B333]) -> 27 | D333: of:=WEEKNUM([.B333];1) -> 48 | E333: of:=YEAR([.B333]) -> 2020 | F333: of:=ROUNDUP(MONTH([.B333])/3;0) -> 4
A334: of:=[.A333]+1 -> 333 | B334: of:=[.B333]+1 -> 2020-11-28 | C334: of:=DAY([.B334]) -> 28 | D334: of:=WEEKNUM([.B334];1) -> 48 | E334: of:=YEAR([.B334]) -> 2020 | F334: of:=ROUNDUP(MONTH([.B334])/3;0) -> 4
A335: of:=[.A334]+1 -> 334 | B335: of:=[.B334]+1 -> 2020-11-29 | C335: of:=DAY([.B335]) -> 29 | D335: of:=WEEKNUM([.B335];1) -> 49 | E335: of:=YEAR([.B335]) -> 2020 | F335: of:=ROUNDUP(MONTH([.B335])/3;0) -> 4
A336: of:=[.A335]+1 -> 335 | B336: of:=[.B335]+1 -> 2020-11-30 | C336: of:=DAY([.B336]) -> 30 | D336: of:=WEEKNUM([.B336];1) -> 49 | E336: of:=YEAR([.B336]) -> 2020 | F336: of:=ROUNDUP(MONTH([.B336])/3;0) -> 4
A337: of:=[.A336]+1 -> 336 | B337: of:=[.B336]+1 -> 2020-12-01 | C337: of:=DAY([.B337]) -> 1 | D337: of:=WEEKNUM([.B337];1) -> 49 | E337: of:=YEAR([.B337]) -> 2020 | F337: of:=ROUNDUP(MONTH([.B337])/3;0) -> 4
A338: of:=[.A337]+1 -> 337 | B338: of:=[.B337]+1 -> 2020-12-02 | C338: of:=DAY([.B338]) -> 2 | D338: of:=WEEKNUM([.B338];1) -> 49 | E338: of:=YEAR([.B338]) -> 2020 | F338: of:=ROUNDUP(MONTH([.B338])/3;0) -> 4
A339: of:=[.A338]+1 -> 338 | B339: of:=[.B338]+1 -> 2020-12-03 | C339: of:=DAY([.B339]) -> 3 | D339: of:=WEEKNUM([.B339];1) -> 49 | E339: of:=YEAR([.B339]) -> 2020 | F339: of:=ROUNDUP(MONTH([.B339])/3;0) -> 4
A340: of:=[.A339]+1 -> 339 | B340: of:=[.B339]+1 -> 2020-12-04 | C340: of:=DAY([.B340]) -> 4 | D340: of:=WEEKNUM([.B340];1) -> 49 | E340: of:=YEAR([.B340]) -> 2020 | F340: of:=ROUNDUP(MONTH([.B340])/3;0) -> 4
A341: of:=[.A340]+1 -> 340 | B341: of:=[.B340]+1 -> 2020-12-05 | C341: of:=DAY([.B341]) -> 5 | D341: of:=WEEKNUM([.B341];1) -> 49 | E341: of:=YEAR([.B341]) -> 2020 | F341: of:=ROUNDUP(MONTH([.B341])/3;0) -> 4
A342: of:=[.A341]+1 -> 341 | B342: of:=[.B341]+1 -> 2020-12-06 | C342: of:=DAY([.B342]) -> 6 | D342: of:=WEEKNUM([.B342];1) -> 50 | E342: of:=YEAR([.B342]) -> 2020 | F342: of:=ROUNDUP(MONTH([.B342])/3;0) -> 4
A343: of:=[.A342]+1 -> 342 | B343: of:=[.B342]+1 -> 2020-12-07 | C343: of:=DAY([.B343]) -> 7 | D343: of:=WEEKNUM([.B343];1) -> 50 | E343: of:=YEAR([.B343]) -> 2020 | F343: of:=ROUNDUP(MONTH([.B343])/3;0) -> 4
A344: of:=[.A343]+1 -> 343 | B344: of:=[.B343]+1 -> 2020-12-08 | C344: of:=DAY([.B344]) -> 8 | D344: of:=WEEKNUM([.B344];1) -> 50 | E344: of:=YEAR([.B344]) -> 2020 | F344: of:=ROUNDUP(MONTH([.B344])/3;0) -> 4
A345: of:=[.A344]+1 -> 344 | B345: of:=[.B344]+1 -> 2020-12-09 | C345: of:=DAY([.B345]) -> 9 | D345: of:=WEEKNUM([.B345];1) -> 50 | E345: of:=YEAR([.B345]) -> 2020 | F345: of:=ROUNDUP(MONTH([.B345])/3;0) -> 4
A346: of:=[.A345]+1 -> 345 | B346: of:=[.B345]+1 -> 2020-12-10 | C346: of:=DAY([.B346]) -> 10 | D346: of:=WEEKNUM([.B346];1) -> 50 | E346: of:=YEAR([.B346]) -> 2020 | F346: of:=ROUNDUP(MONTH([.B346])/3;0) -> 4
A347: of:=[.A346]+1 -> 346 | B347: of:=[.B346]+1 -> 2020-12-11 | C347: of:=DAY([.B347]) -> 11 | D347: of:=WEEKNUM([.B347];1) -> 50 | E347: of:=YEAR([.B347]) -> 2020 | F347: of:=ROUNDUP(MONTH([.B347])/3;0) -> 4
A348: of:=[.A347]+1 -> 347 | B348: of:=[.B347]+1 -> 2020-12-12 | C348: of:=DAY([.B348]) -> 12 | D348: of:=WEEKNUM([.B348];1) -> 50 | E348: of:=YEAR([.B348]) -> 2020 | F348: of:=ROUNDUP(MONTH([.B348])/3;0) -> 4
A349: of:=[.A348]+1 -> 348 | B349: of:=[.B348]+1 -> 2020-12-13 | C349: of:=DAY([.B349]) -> 13 | D349: of:=WEEKNUM([.B349];1) -> 51 | E349: of:=YEAR([.B349]) -> 2020 | F349: of:=ROUNDUP(MONTH([.B349])/3;0) -> 4
A350: of:=[.A349]+1 -> 349 | B350: of:=[.B349]+1 -> 2020-12-14 | C350: of:=DAY([.B350]) -> 14 | D350: of:=WEEKNUM([.B350];1) -> 51 | E350: of:=YEAR([.B350]) -> 2020 | F350: of:=ROUNDUP(MONTH([.B350])/3;0) -> 4
A351: of:=[.A350]+1 -> 350 | B351: of:=[.B350]+1 -> 2020-12-15 | C351: of:=DAY([.B351]) -> 15 | D351: of:=WEEKNUM([.B351];1) -> 51 | E351: of:=YEAR([.B351]) -> 2020 | F351: of:=ROUNDUP(MONTH([.B351])/3;0) -> 4
A352: of:=[.A351]+1 -> 351 | B352: of:=[.B351]+1 -> 2020-12-16 | C352: of:=DAY([.B352]) -> 16 | D352: of:=WEEKNUM([.B352];1) -> 51 | E352: of:=YEAR([.B352]) -> 2020 | F352: of:=ROUNDUP(MONTH([.B352])/3;0) -> 4
A353: of:=[.A352]+1 -> 352 | B353: of:=[.B352]+1 -> 2020-12-17 | C353: of:=DAY([.B353]) -> 17 | D353: of:=WEEKNUM([.B353];1) -> 51 | E353: of:=YEAR([.B353]) -> 2020 | F353: of:=ROUNDUP(MONTH([.B353])/3;0) -> 4
A354: of:=[.A353]+1 -> 353 | B354: of:=[.B353]+1 -> 2020-12-18 | C354: of:=DAY([.B354]) -> 18 | D354: of:=WEEKNUM([.B354];1) -> 51 | E354: of:=YEAR([.B354]) -> 2020 | F354: of:=ROUNDUP(MONTH([.B354])/3;0) -> 4
A355: of:=[.A354]+1 -> 354 | B355: of:=[.B354]+1 -> 2020-12-19 | C355: of:=DAY([.B355]) -> 19 | D355: of:=WEEKNUM([.B355];1) -> 51 | E355: of:=YEAR([.B355]) -> 2020 | F355: of:=ROUNDUP(MONTH([.B355])/3;0) -> 4
A356: of:=[.A355]+1 -> 355 | B356: of:=[.B355]+1 -> 2020-12-20 | C356: of:=DAY([.B356]) -> 20 | D356: of:=WEEKNUM([.B356];1) -> 52 | E356: of:=YEAR([.B356]) -> 2020 | F356: of:=ROUNDUP(MONTH([.B356])/3;0) -> 4
A357: of:=[.A356]+1 -> 356 | B357: of:=[.B356]+1 -> 2020-12-21 | C357: of:=DAY([.B357]) -> 21 | D357: of:=WEEKNUM([.B357];1) -> 52 | E357: of:=YEAR([.B357]) -> 2020 | F357: of:=ROUNDUP(MONTH([.B357])/3;0) -> 4
A358: of:=[.A357]+1 -> 357 | B358: of:=[.B357]+1 -> 2020-12-22 | C358: of:=DAY([.B358]) -> 22 | D358: of:=WEEKNUM([.B358];1) -> 52 | E358: of:=YEAR([.B358]) -> 2020 | F358: of:=ROUNDUP(MONTH([.B358])/3;0) -> 4
A359: of:=[.A358]+1 -> 358 | B359: of:=[.B358]+1 -> 2020-12-23 | C359: of:=DAY([.B359]) -> 23 | D359: of:=WEEKNUM([.B359];1) -> 52 | E359: of:=YEAR([.B359]) -> 2020 | F359: of:=ROUNDUP(MONTH([.B359])/3;0) -> 4
A360: of:=[.A359]+1 -> 359 | B360: of:=[.B359]+1 -> 2020-12-24 | C360: of:=DAY([.B360]) -> 24 | D360: of:=WEEKNUM([.B360];1) -> 52 | E360: of:=YEAR([.B360]) -> 2020 | F360: of:=ROUNDUP(MONTH([.B360])/3;0) -> 4
A361: of:=[.A360]+1 -> 360 | B361: of:=[.B360]+1 -> 2020-12-25 | C361: of:=DAY([.B361]) -> 25 | D361: of:=WEEKNUM([.B361];1) -> 52 | E361: of:=YEAR([.B361]) -> 2020 | F361: of:=ROUNDUP(MONTH([.B361])/3;0) -> 4
A362: of:=[.A361]+1 -> 361 | B362: of:=[.B361]+1 -> 2020-12-26 | C362: of:=DAY([.B362]) -> 26 | D362: of:=WEEKNUM([.B362];1) -> 52 | E362: of:=YEAR([.B362]) -> 2020 | F362: of:=ROUNDUP(MONTH([.B362])/3;0) -> 4
A363: of:=[.A362]+1 -> 362 | B363: of:=[.B362]+1 -> 2020-12-27 | C363: of:=DAY([.B363]) -> 27 | D363: of:=WEEKNUM([.B363];1) -> 1 | E363: of:=YEAR([.B363]) -> 2020 | F363: of:=ROUNDUP(MONTH([.B363])/3;0) -> 4
A364: of:=[.A363]+1 -> 363 | B364: of:=[.B363]+1 -> 2020-12-28 | C364: of:=DAY([.B364]) -> 28 | D364: of:=WEEKNUM([.B364];1) -> 1 | E364: of:=YEAR([.B364]) -> 2020 | F364: of:=ROUNDUP(MONTH([.B364])/3;0) -> 4
A365: of:=[.A364]+1 -> 364 | B365: of:=[.B364]+1 -> 2020-12-29 | C365: of:=DAY([.B365]) -> 29 | D365: of:=WEEKNUM([.B365];1) -> 1 | E365: of:=YEAR([.B365]) -> 2020 | F365: of:=ROUNDUP(MONTH([.B365])/3;0) -> 4
A366: of:=[.A365]+1 -> 365 | B366: of:=[.B365]+1 -> 2020-12-30 | C366: of:=DAY([.B366]) -> 30 | D366: of:=WEEKNUM([.B366];1) -> 1 | E366: of:=YEAR([.B366]) -> 2020 | F366: of:=ROUNDUP(MONTH([.B366])/3;0) -> 4
A367: of:=[.A366]+1 -> 366 | B367: of:=[.B366]+1 -> 2020-12-31 | C367: of:=DAY([.B367]) -> 31 | D367: of:=WEEKNUM([.B367];1) -> 1 | E367: of:=YEAR([.B367]) -> 2020 | F367: of:=ROUNDUP(MONTH([.B367])/3;0) -> 4
A368: of:=[.A367]+1 -> 367 | B368: of:=[.B367]+1 -> 2021-01-01 | C368: of:=DAY([.B368]) -> 1 | D368: of:=WEEKNUM([.B368];1) -> 1 | E368: of:=YEAR([.B368]) -> 2021 | F368: of:=ROUNDUP(MONTH([.B368])/3;0) -> 1
A369: of:=[.A368]+1 -> 368 | B369: of:=[.B368]+1 -> 2021-01-02 | C369: of:=DAY([.B369]) -> 2 | D369: of:=WEEKNUM([.B369];1) -> 1 | E369: of:=YEAR([.B369]) -> 2021 | F369: of:=ROUNDUP(MONTH([.B369])/3;0) -> 1
A370: of:=[.A369]+1 -> 369 | B370: of:=[.B369]+1 -> 2021-01-03 | C370: of:=DAY([.B370]) -> 3 | D370: of:=WEEKNUM([.B370];1) -> 2 | E370: of:=YEAR([.B370]) -> 2021 | F370: of:=ROUNDUP(MONTH([.B370])/3;0) -> 1
A371: of:=[.A370]+1 -> 370 | B371: of:=[.B370]+1 -> 2021-01-04 | C371: of:=DAY([.B371]) -> 4 | D371: of:=WEEKNUM([.B371];1) -> 2 | E371: of:=YEAR([.B371]) -> 2021 | F371: of:=ROUNDUP(MONTH([.B371])/3;0) -> 1
A372: of:=[.A371]+1 -> 371 | B372: of:=[.B371]+1 -> 2021-01-05 | C372: of:=DAY([.B372]) -> 5 | D372: of:=WEEKNUM([.B372];1) -> 2 | E372: of:=YEAR([.B372]) -> 2021 | F372: of:=ROUNDUP(MONTH([.B372])/3;0) -> 1
A373: of:=[.A372]+1 -> 372 | B373: of:=[.B372]+1 -> 2021-01-06 | C373: of:=DAY([.B373]) -> 6 | D373: of:=WEEKNUM([.B373];1) -> 2 | E373: of:=YEAR([.B373]) -> 2021 | F373: of:=ROUNDUP(MONTH([.B373])/3;0) -> 1
A374: of:=[.A373]+1 -> 373 | B374: of:=[.B373]+1 -> 2021-01-07 | C374: of:=DAY([.B374]) -> 7 | D374: of:=WEEKNUM([.B374];1) -> 2 | E374: of:=YEAR([.B374]) -> 2021 | F374: of:=ROUNDUP(MONTH([.B374])/3;0) -> 1
A375: of:=[.A374]+1 -> 374 | B375: of:=[.B374]+1 -> 2021-01-08 | C375: of:=DAY([.B375]) -> 8 | D375: of:=WEEKNUM([.B375];1) -> 2 | E375: of:=YEAR([.B375]) -> 2021 | F375: of:=ROUNDUP(MONTH([.B375])/3;0) -> 1
A376: of:=[.A375]+1 -> 375 | B376: of:=[.B375]+1 -> 2021-01-09 | C376: of:=DAY([.B376]) -> 9 | D376: of:=WEEKNUM([.B376];1) -> 2 | E376: of:=YEAR([.B376]) -> 2021 | F376: of:=ROUNDUP(MONTH([.B376])/3;0) -> 1
A377: of:=[.A376]+1 -> 376 | B377: of:=[.B376]+1 -> 2021-01-10 | C377: of:=DAY([.B377]) -> 10 | D377: of:=WEEKNUM([.B377];1) -> 3 | E377: of:=YEAR([.B377]) -> 2021 | F377: of:=ROUNDUP(MONTH([.B377])/3;0) -> 1
A378: of:=[.A377]+1 -> 377 | B378: of:=[.B377]+1 -> 2021-01-11 | C378: of:=DAY([.B378]) -> 11 | D378: of:=WEEKNUM([.B378];1) -> 3 | E378: of:=YEAR([.B378]) -> 2021 | F378: of:=ROUNDUP(MONTH([.B378])/3;0) -> 1
A379: of:=[.A378]+1 -> 378 | B379: of:=[.B378]+1 -> 2021-01-12 | C379: of:=DAY([.B379]) -> 12 | D379: of:=WEEKNUM([.B379];1) -> 3 | E379: of:=YEAR([.B379]) -> 2021 | F379: of:=ROUNDUP(MONTH([.B379])/3;0) -> 1
A380: of:=[.A379]+1 -> 379 | B380: of:=[.B379]+1 -> 2021-01-13 | C380: of:=DAY([.B380]) -> 13 | D380: of:=WEEKNUM([.B380];1) -> 3 | E380: of:=YEAR([.B380]) -> 2021 | F380: of:=ROUNDUP(MONTH([.B380])/3;0) -> 1
A381: of:=[.A380]+1 -> 380 | B381: of:=[.B380]+1 -> 2021-01-14 | C381: of:=DAY([.B381]) -> 14 | D381: of:=WEEKNUM([.B381];1) -> 3 | E381: of:=YEAR([.B381]) -> 2021 | F381: of:=ROUNDUP(MONTH([.B381])/3;0) -> 1
A382: of:=[.A381]+1 -> 381 | B382: of:=[.B381]+1 -> 2021-01-15 | C382: of:=DAY([.B382]) -> 15 | D382: of:=WEEKNUM([.B382];1) -> 3 | E382: of:=YEAR([.B382]) -> 2021 | F382: of:=ROUNDUP(MONTH([.B382])/3;0) -> 1
A383: of:=[.A382]+1 -> 382 | B383: of:=[.B382]+1 -> 2021-01-16 | C383: of:=DAY([.B383]) -> 16 | D383: of:=WEEKNUM([.B383];1) -> 3 | E383: of:=YEAR([.B383]) -> 2021 | F383: of:=ROUNDUP(MONTH([.B383])/3;0) -> 1
A384: of:=[.A383]+1 -> 383 | B384: of:=[.B383]+1 -> 2021-01-17 | C384: of:=DAY([.B384]) -> 17 | D384: of:=WEEKNUM([.B384];1) -> 4 | E384: of:=YEAR([.B384]) -> 2021 | F384: of:=ROUNDUP(MONTH([.B384])/3;0) -> 1
A385: of:=[.A384]+1 -> 384 | B385: of:=[.B384]+1 -> 2021-01-18 | C385: of:=DAY([.B385]) -> 18 | D385: of:=WEEKNUM([.B385];1) -> 4 | E385: of:=YEAR([.B385]) -> 2021 | F385: of:=ROUNDUP(MONTH([.B385])/3;0) -> 1
A386: of:=[.A385]+1 -> 385 | B386: of:=[.B385]+1 -> 2021-01-19 | C386: of:=DAY([.B386]) -> 19 | D386: of:=WEEKNUM([.B386];1) -> 4 | E386: of:=YEAR([.B386]) -> 2021 | F386: of:=ROUNDUP(MONTH([.B386])/3;0) -> 1
A387: of:=[.A386]+1 -> 386 | B387: of:=[.B386]+1 -> 2021-01-20 | C387: of:=DAY([.B387]) -> 20 | D387: of:=WEEKNUM([.B387];1) -> 4 | E387: of:=YEAR([.B387]) -> 2021 | F387: of:=ROUNDUP(MONTH([.B387])/3;0) -> 1
A388: of:=[.A387]+1 -> 387 | B388: of:=[.B387]+1 -> 2021-01-21 | C388: of:=DAY([.B388]) -> 21 | D388: of:=WEEKNUM([.B388];1) -> 4 | E388: of:=YEAR([.B388]) -> 2021 | F388: of:=ROUNDUP(MONTH([.B388])/3;0) -> 1
A389: of:=[.A388]+1 -> 388 | B389: of:=[.B388]+1 -> 2021-01-22 | C389: of:=DAY([.B389]) -> 22 | D389: of:=WEEKNUM([.B389];1) -> 4 | E389: of:=YEAR([.B389]) -> 2021 | F389: of:=ROUNDUP(MONTH([.B389])/3;0) -> 1
A390: of:=[.A389]+1 -> 389 | B390: of:=[.B389]+1 -> 2021-01-23 | C390: of:=DAY([.B390]) -> 23 | D390: of:=WEEKNUM([.B390];1) -> 4 | E390: of:=YEAR([.B390]) -> 2021 | F390: of:=ROUNDUP(MONTH([.B390])/3;0) -> 1
A391: of:=[.A390]+1 -> 390 | B391: of:=[.B390]+1 -> 2021-01-24 | C391: of:=DAY([.B391]) -> 24 | D391: of:=WEEKNUM([.B391];1) -> 5 | E391: of:=YEAR([.B391]) -> 2021 | F391: of:=ROUNDUP(MONTH([.B391])/3;0) -> 1
A392: of:=[.A391]+1 -> 391 | B392: of:=[.B391]+1 -> 2021-01-25 | C392: of:=DAY([.B392]) -> 25 | D392: of:=WEEKNUM([.B392];1) -> 5 | E392: of:=YEAR([.B392]) -> 2021 | F392: of:=ROUNDUP(MONTH([.B392])/3;0) -> 1
A393: of:=[.A392]+1 -> 392 | B393: of:=[.B392]+1 -> 2021-01-26 | C393: of:=DAY([.B393]) -> 26 | D393: of:=WEEKNUM([.B393];1) -> 5 | E393: of:=YEAR([.B393]) -> 2021 | F393: of:=ROUNDUP(MONTH([.B393])/3;0) -> 1
A394: of:=[.A393]+1 -> 393 | B394: of:=[.B393]+1 -> 2021-01-27 | C394: of:=DAY([.B394]) -> 27 | D394: of:=WEEKNUM([.B394];1) -> 5 | E394: of:=YEAR([.B394]) -> 2021 | F394: of:=ROUNDUP(MONTH([.B394])/3;0) -> 1
A395: of:=[.A394]+1 -> 394 | B395: of:=[.B394]+1 -> 2021-01-28 | C395: of:=DAY([.B395]) -> 28 | D395: of:=WEEKNUM([.B395];1) -> 5 | E395: of:=YEAR([.B395]) -> 2021 | F395: of:=ROUNDUP(MONTH([.B395])/3;0) -> 1
A396: of:=[.A395]+1 -> 395 | B396: of:=[.B395]+1 -> 2021-01-29 | C396: of:=DAY([.B396]) -> 29 | D396: of:=WEEKNUM([.B396];1) -> 5 | E396: of:=YEAR([.B396]) -> 2021 | F396: of:=ROUNDUP(MONTH([.B396])/3;0) -> 1
A397: of:=[.A396]+1 -> 396 | B397: of:=[.B396]+1 -> 2021-01-30 | C397: of:=DAY([.B397]) -> 30 | D397: of:=WEEKNUM([.B397];1) -> 5 | E397: of:=YEAR([.B397]) -> 2021 | F397: of:=ROUNDUP(MONTH([.B397])/3;0) -> 1
A398: of:=[.A397]+1 -> 397 | B398: of:=[.B397]+1 -> 2021-01-31 | C398: of:=DAY([.B398]) -> 31 | D398: of:=WEEKNUM([.B398];1) -> 6 | E398: of:=YEAR([.B398]) -> 2021 | F398: of:=ROUNDUP(MONTH([.B398])/3;0) -> 1
A399: of:=[.A398]+1 -> 398 | B399: of:=[.B398]+1 -> 2021-02-01 | C399: of:=DAY([.B399]) -> 1 | D399: of:=WEEKNUM([.B399];1) -> 6 | E399: of:=YEAR([.B399]) -> 2021 | F399: of:=ROUNDUP(MONTH([.B399])/3;0) -> 1
A400: of:=[.A399]+1 -> 399 | B400: of:=[.B399]+1 -> 2021-02-02 | C400: of:=DAY([.B400]) -> 2 | D400: of:=WEEKNUM([.B400];1) -> 6 | E400: of:=YEAR([.B400]) -> 2021 | F400: of:=ROUNDUP(MONTH([.B400])/3;0) -> 1
A401: of:=[.A400]+1 -> 400 | B401: of:=[.B400]+1 -> 2021-02-03 | C401: of:=DAY([.B401]) -> 3 | D401: of:=WEEKNUM([.B401];1) -> 6 | E401: of:=YEAR([.B401]) -> 2021 | F401: of:=ROUNDUP(MONTH([.B401])/3;0) -> 1
A402: of:=[.A401]+1 -> 401 | B402: of:=[.B401]+1 -> 2021-02-04 | C402: of:=DAY([.B402]) -> 4 | D402: of:=WEEKNUM([.B402];1) -> 6 | E402: of:=YEAR([.B402]) -> 2021 | F402: of:=ROUNDUP(MONTH([.B402])/3;0) -> 1
A403: of:=[.A402]+1 -> 402 | B403: of:=[.B402]+1 -> 2021-02-05 | C403: of:=DAY([.B403]) -> 5 | D403: of:=WEEKNUM([.B403];1) -> 6 | E403: of:=YEAR([.B403]) -> 2021 | F403: of:=ROUNDUP(MONTH([.B403])/3;0) -> 1
A404: of:=[.A403]+1 -> 403 | B404: of:=[.B403]+1 -> 2021-02-06 | C404: of:=DAY([.B404]) -> 6 | D404: of:=WEEKNUM([.B404];1) -> 6 | E404: of:=YEAR([.B404]) -> 2021 | F404: of:=ROUNDUP(MONTH([.B404])/3;0) -> 1
A405: of:=[.A404]+1 -> 404 | B405: of:=[.B404]+1 -> 2021-02-07 | C405: of:=DAY([.B405]) -> 7 | D405: of:=WEEKNUM([.B405];1) -> 7 | E405: of:=YEAR([.B405]) -> 2021 | F405: of:=ROUNDUP(MONTH([.B405])/3;0) -> 1
A406: of:=[.A405]+1 -> 405 | B406: of:=[.B405]+1 -> 2021-02-08 | C406: of:=DAY([.B406]) -> 8 | D406: of:=WEEKNUM([.B406];1) -> 7 | E406: of:=YEAR([.B406]) -> 2021 | F406: of:=ROUNDUP(MONTH([.B406])/3;0) -> 1
A407: of:=[.A406]+1 -> 406 | B407: of:=[.B406]+1 -> 2021-02-09 | C407: of:=DAY([.B407]) -> 9 | D407: of:=WEEKNUM([.B407];1) -> 7 | E407: of:=YEAR([.B407]) -> 2021 | F407: of:=ROUNDUP(MONTH([.B407])/3;0) -> 1
A408: of:=[.A407]+1 -> 407 | B408: of:=[.B407]+1 -> 2021-02-10 | C408: of:=DAY([.B408]) -> 10 | D408: of:=WEEKNUM([.B408];1) -> 7 | E408: of:=YEAR([.B408]) -> 2021 | F408: of:=ROUNDUP(MONTH([.B408])/3;0) -> 1
A409: of:=[.A408]+1 -> 408 | B409: of:=[.B408]+1 -> 2021-02-11 | C409: of:=DAY([.B409]) -> 11 | D409: of:=WEEKNUM([.B409];1) -> 7 | E409: of:=YEAR([.B409]) -> 2021 | F409: of:=ROUNDUP(MONTH([.B409])/3;0) -> 1
A410: of:=[.A409]+1 -> 409 | B410: of:=[.B409]+1 -> 2021-02-12 | C410: of:=DAY([.B410]) -> 12 | D410: of:=WEEKNUM([.B410];1) -> 7 | E410: of:=YEAR([.B410]) -> 2021 | F410: of:=ROUNDUP(MONTH([.B410])/3;0) -> 1
A411: of:=[.A410]+1 -> 410 | B411: of:=[.B410]+1 -> 2021-02-13 | C411: of:=DAY([.B411]) -> 13 | D411: of:=WEEKNUM([.B411];1) -> 7 | E411: of:=YEAR([.B411]) -> 2021 | F411: of:=ROUNDUP(MONTH([.B411])/3;0) -> 1
A412: of:=[.A411]+1 -> 411 | B412: of:=[.B411]+1 -> 2021-02-14 | C412: of:=DAY([.B412]) -> 14 | D412: of:=WEEKNUM([.B412];1) -> 8 | E412: of:=YEAR([.B412]) -> 2021 | F412: of:=ROUNDUP(MONTH([.B412])/3;0) -> 1
A413: of:=[.A412]+1 -> 412 | B413: of:=[.B412]+1 -> 2021-02-15 | C413: of:=DAY([.B413]) -> 15 | D413: of:=WEEKNUM([.B413];1) -> 8 | E413: of:=YEAR([.B413]) -> 2021 | F413: of:=ROUNDUP(MONTH([.B413])/3;0) -> 1
A414: of:=[.A413]+1 -> 413 | B414: of:=[.B413]+1 -> 2021-02-16 | C414: of:=DAY([.B414]) -> 16 | D414: of:=WEEKNUM([.B414];1) -> 8 | E414: of:=YEAR([.B414]) -> 2021 | F414: of:=ROUNDUP(MONTH([.B414])/3;0) -> 1
A415: of:=[.A414]+1 -> 414 | B415: of:=[.B414]+1 -> 2021-02-17 | C415: of:=DAY([.B415]) -> 17 | D415: of:=WEEKNUM([.B415];1) -> 8 | E415: of:=YEAR([.B415]) -> 2021 | F415: of:=ROUNDUP(MONTH([.B415])/3;0) -> 1
A416: of:=[.A415]+1 -> 415 | B416: of:=[.B415]+1 -> 2021-02-18 | C416: of:=DAY([.B416]) -> 18 | D416: of:=WEEKNUM([.B416];1) -> 8 | E416: of:=YEAR([.B416]) -> 2021 | F416: of:=ROUNDUP(MONTH([.B416])/3;0) -> 1
A417: of:=[.A416]+1 -> 416 | B417: of:=[.B416]+1 -> 2021-02-19 | C417: of:=DAY([.B417]) -> 19 | D417: of:=WEEKNUM([.B417];1) -> 8 | E417: of:=YEAR([.B417]) -> 2021 | F417: of:=ROUNDUP(MONTH([.B417])/3;0) -> 1
A418: of:=[.A417]+1 -> 417 | B418: of:=[.B417]+1 -> 2021-02-20 | C418: of:=DAY([.B418]) -> 20 | D418: of:=WEEKNUM([.B418];1) -> 8 | E418: of:=YEAR([.B418]) -> 2021 | F418: of:=ROUNDUP(MONTH([.B418])/3;0) -> 1
A419: of:=[.A418]+1 -> 418 | B419: of:=[.B418]+1 -> 2021-02-21 | C419: of:=DAY([.B419]) -> 21 | D419: of:=WEEKNUM([.B419];1) -> 9 | E419: of:=YEAR([.B419]) -> 2021 | F419: of:=ROUNDUP(MONTH([.B419])/3;0) -> 1
A420: of:=[.A419]+1 -> 419 | B420: of:=[.B419]+1 -> 2021-02-22 | C420: of:=DAY([.B420]) -> 22 | D420: of:=WEEKNUM([.B420];1) -> 9 | E420: of:=YEAR([.B420]) -> 2021 | F420: of:=ROUNDUP(MONTH([.B420])/3;0) -> 1
A421: of:=[.A420]+1 -> 420 | B421: of:=[.B420]+1 -> 2021-02-23 | C421: of:=DAY([.B421]) -> 23 | D421: of:=WEEKNUM([.B421];1) -> 9 | E421: of:=YEAR([.B421]) -> 2021 | F421: of:=ROUNDUP(MONTH([.B421])/3;0) -> 1
A422: of:=[.A421]+1 -> 421 | B422: of:=[.B421]+1 -> 2021-02-24 | C422: of:=DAY([.B422]) -> 24 | D422: of:=WEEKNUM([.B422];1) -> 9 | E422: of:=YEAR([.B422]) -> 2021 | F422: of:=ROUNDUP(MONTH([.B422])/3;0) -> 1
A423: of:=[.A422]+1 -> 422 | B423: of:=[.B422]+1 -> 2021-02-25 | C423: of:=DAY([.B423]) -> 25 | D423: of:=WEEKNUM([.B423];1) -> 9 | E423: of:=YEAR([.B423]) -> 2021 | F423: of:=ROUNDUP(MONTH([.B423])/3;0) -> 1
A424: of:=[.A423]+1 -> 423 | B424: of:=[.B423]+1 -> 2021-02-26 | C424: of:=DAY([.B424]) -> 26 | D424: of:=WEEKNUM([.B424];1) -> 9 | E424: of:=YEAR([.B424]) -> 2021 | F424: of:=ROUNDUP(MONTH([.B424])/3;0) -> 1
A425: of:=[.A424]+1 -> 424 | B425: of:=[.B424]+1 -> 2021-02-27 | C425: of:=DAY([.B425]) -> 27 | D425: of:=WEEKNUM([.B425];1) -> 9 | E425: of:=YEAR([.B425]) -> 2021 | F425: of:=ROUNDUP(MONTH([.B425])/3;0) -> 1
A426: of:=[.A425]+1 -> 425 | B426: of:=[.B425]+1 -> 2021-02-28 | C426: of:=DAY([.B426]) -> 28 | D426: of:=WEEKNUM([.B426];1) -> 10 | E426: of:=YEAR([.B426]) -> 2021 | F426: of:=ROUNDUP(MONTH([.B426])/3;0) -> 1
A427: of:=[.A426]+1 -> 426 | B427: of:=[.B426]+1 -> 2021-03-01 | C427: of:=DAY([.B427]) -> 1 | D427: of:=WEEKNUM([.B427];1) -> 10 | E427: of:=YEAR([.B427]) -> 2021 | F427: of:=ROUNDUP(MONTH([.B427])/3;0) -> 1
A428: of:=[.A427]+1 -> 427 | B428: of:=[.B427]+1 -> 2021-03-02 | C428: of:=DAY([.B428]) -> 2 | D428: of:=WEEKNUM([.B428];1) -> 10 | E428: of:=YEAR([.B428]) -> 2021 | F428: of:=ROUNDUP(MONTH([.B428])/3;0) -> 1
A429: of:=[.A428]+1 -> 428 | B429: of:=[.B428]+1 -> 2021-03-03 | C429: of:=DAY([.B429]) -> 3 | D429: of:=WEEKNUM([.B429];1) -> 10 | E429: of:=YEAR([.B429]) -> 2021 | F429: of:=ROUNDUP(MONTH([.B429])/3;0) -> 1
A430: of:=[.A429]+1 -> 429 | B430: of:=[.B429]+1 -> 2021-03-04 | C430: of:=DAY([.B430]) -> 4 | D430: of:=WEEKNUM([.B430];1) -> 10 | E430: of:=YEAR([.B430]) -> 2021 | F430: of:=ROUNDUP(MONTH([.B430])/3;0) -> 1
A431: of:=[.A430]+1 -> 430 | B431: of:=[.B430]+1 -> 2021-03-05 | C431: of:=DAY([.B431]) -> 5 | D431: of:=WEEKNUM([.B431];1) -> 10 | E431: of:=YEAR([.B431]) -> 2021 | F431: of:=ROUNDUP(MONTH([.B431])/3;0) -> 1
A432: of:=[.A431]+1 -> 431 | B432: of:=[.B431]+1 -> 2021-03-06 | C432: of:=DAY([.B432]) -> 6 | D432: of:=WEEKNUM([.B432];1) -> 10 | E432: of:=YEAR([.B432]) -> 2021 | F432: of:=ROUNDUP(MONTH([.B432])/3;0) -> 1
A433: of:=[.A432]+1 -> 432 | B433: of:=[.B432]+1 -> 2021-03-07 | C433: of:=DAY([.B433]) -> 7 | D433: of:=WEEKNUM([.B433];1) -> 11 | E433: of:=YEAR([.B433]) -> 2021 | F433: of:=ROUNDUP(MONTH([.B433])/3;0) -> 1
A434: of:=[.A433]+1 -> 433 | B434: of:=[.B433]+1 -> 2021-03-08 | C434: of:=DAY([.B434]) -> 8 | D434: of:=WEEKNUM([.B434];1) -> 11 | E434: of:=YEAR([.B434]) -> 2021 | F434: of:=ROUNDUP(MONTH([.B434])/3;0) -> 1
A435: of:=[.A434]+1 -> 434 | B435: of:=[.B434]+1 -> 2021-03-09 | C435: of:=DAY([.B435]) -> 9 | D435: of:=WEEKNUM([.B435];1) -> 11 | E435: of:=YEAR([.B435]) -> 2021 | F435: of:=ROUNDUP(MONTH([.B435])/3;0) -> 1
A436: of:=[.A435]+1 -> 435 | B436: of:=[.B435]+1 -> 2021-03-10 | C436: of:=DAY([.B436]) -> 10 | D436: of:=WEEKNUM([.B436];1) -> 11 | E436: of:=YEAR([.B436]) -> 2021 | F436: of:=ROUNDUP(MONTH([.B436])/3;0) -> 1
A437: of:=[.A436]+1 -> 436 | B437: of:=[.B436]+1 -> 2021-03-11 | C437: of:=DAY([.B437]) -> 11 | D437: of:=WEEKNUM([.B437];1) -> 11 | E437: of:=YEAR([.B437]) -> 2021 | F437: of:=ROUNDUP(MONTH([.B437])/3;0) -> 1
A438: of:=[.A437]+1 -> 437 | B438: of:=[.B437]+1 -> 2021-03-12 | C438: of:=DAY([.B438]) -> 12 | D438: of:=WEEKNUM([.B438];1) -> 11 | E438: of:=YEAR([.B438]) -> 2021 | F438: of:=ROUNDUP(MONTH([.B438])/3;0) -> 1
A439: of:=[.A438]+1 -> 438 | B439: of:=[.B438]+1 -> 2021-03-13 | C439: of:=DAY([.B439]) -> 13 | D439: of:=WEEKNUM([.B439];1) -> 11 | E439: of:=YEAR([.B439]) -> 2021 | F439: of:=ROUNDUP(MONTH([.B439])/3;0) -> 1
A440: of:=[.A439]+1 -> 439 | B440: of:=[.B439]+1 -> 2021-03-14 | C440: of:=DAY([.B440]) -> 14 | D440: of:=WEEKNUM([.B440];1) -> 12 | E440: of:=YEAR([.B440]) -> 2021 | F440: of:=ROUNDUP(MONTH([.B440])/3;0) -> 1
A441: of:=[.A440]+1 -> 440 | B441: of:=[.B440]+1 -> 2021-03-15 | C441: of:=DAY([.B441]) -> 15 | D441: of:=WEEKNUM([.B441];1) -> 12 | E441: of:=YEAR([.B441]) -> 2021 | F441: of:=ROUNDUP(MONTH([.B441])/3;0) -> 1
A442: of:=[.A441]+1 -> 441 | B442: of:=[.B441]+1 -> 2021-03-16 | C442: of:=DAY([.B442]) -> 16 | D442: of:=WEEKNUM([.B442];1) -> 12 | E442: of:=YEAR([.B442]) -> 2021 | F442: of:=ROUNDUP(MONTH([.B442])/3;0) -> 1
A443: of:=[.A442]+1 -> 442 | B443: of:=[.B442]+1 -> 2021-03-17 | C443: of:=DAY([.B443]) -> 17 | D443: of:=WEEKNUM([.B443];1) -> 12 | E443: of:=YEAR([.B443]) -> 2021 | F443: of:=ROUNDUP(MONTH([.B443])/3;0) -> 1
A444: of:=[.A443]+1 -> 443 | B444: of:=[.B443]+1 -> 2021-03-18 | C444: of:=DAY([.B444]) -> 18 | D444: of:=WEEKNUM([.B444];1) -> 12 | E444: of:=YEAR([.B444]) -> 2021 | F444: of:=ROUNDUP(MONTH([.B444])/3;0) -> 1
A445: of:=[.A444]+1 -> 444 | B445: of:=[.B444]+1 -> 2021-03-19 | C445: of:=DAY([.B445]) -> 19 | D445: of:=WEEKNUM([.B445];1) -> 12 | E445: of:=YEAR([.B445]) -> 2021 | F445: of:=ROUNDUP(MONTH([.B445])/3;0) -> 1
A446: of:=[.A445]+1 -> 445 | B446: of:=[.B445]+1 -> 2021-03-20 | C446: of:=DAY([.B446]) -> 20 | D446: of:=WEEKNUM([.B446];1) -> 12 | E446: of:=YEAR([.B446]) -> 2021 | F446: of:=ROUNDUP(MONTH([.B446])/3;0) -> 1
A447: of:=[.A446]+1 -> 446 | B447: of:=[.B446]+1 -> 2021-03-21 | C447: of:=DAY([.B447]) -> 21 | D447: of:=WEEKNUM([.B447];1) -> 13 | E447: of:=YEAR([.B447]) -> 2021 | F447: of:=ROUNDUP(MONTH([.B447])/3;0) -> 1
A448: of:=[.A447]+1 -> 447 | B448: of:=[.B447]+1 -> 2021-03-22 | C448: of:=DAY([.B448]) -> 22 | D448: of:=WEEKNUM([.B448];1) -> 13 | E448: of:=YEAR([.B448]) -> 2021 | F448: of:=ROUNDUP(MONTH([.B448])/3;0) -> 1
A449: of:=[.A448]+1 -> 448 | B449: of:=[.B448]+1 -> 2021-03-23 | C449: of:=DAY([.B449]) -> 23 | D449: of:=WEEKNUM([.B449];1) -> 13 | E449: of:=YEAR([.B449]) -> 2021 | F449: of:=ROUNDUP(MONTH([.B449])/3;0) -> 1
A450: of:=[.A449]+1 -> 449 | B450: of:=[.B449]+1 -> 2021-03-24 | C450: of:=DAY([.B450]) -> 24 | D450: of:=WEEKNUM([.B450];1) -> 13 | E450: of:=YEAR([.B450]) -> 2021 | F450: of:=ROUNDUP(MONTH([.B450])/3;0) -> 1
A451: of:=[.A450]+1 -> 450 | B451: of:=[.B450]+1 -> 2021-03-25 | C451: of:=DAY([.B451]) -> 25 | D451: of:=WEEKNUM([.B451];1) -> 13 | E451: of:=YEAR([.B451]) -> 2021 | F451: of:=ROUNDUP(MONTH([.B451])/3;0) -> 1
A452: of:=[.A451]+1 -> 451 | B452: of:=[.B451]+1 -> 2021-03-26 | C452: of:=DAY([.B452]) -> 26 | D452: of:=WEEKNUM([.B452];1) -> 13 | E452: of:=YEAR([.B452]) -> 2021 | F452: of:=ROUNDUP(MONTH([.B452])/3;0) -> 1
A453: of:=[.A452]+1 -> 452 | B453: of:=[.B452]+1 -> 2021-03-27 | C453: of:=DAY([.B453]) -> 27 | D453: of:=WEEKNUM([.B453];1) -> 13 | E453: of:=YEAR([.B453]) -> 2021 | F453: of:=ROUNDUP(MONTH([.B453])/3;0) -> 1
A454: of:=[.A453]+1 -> 453 | B454: of:=[.B453]+1 -> 2021-03-28 | C454: of:=DAY([.B454]) -> 28 | D454: of:=WEEKNUM([.B454];1) -> 14 | E454: of:=YEAR([.B454]) -> 2021 | F454: of:=ROUNDUP(MONTH([.B454])/3;0) -> 1
A455: of:=[.A454]+1 -> 454 | B455: of:=[.B454]+1 -> 2021-03-29 | C455: of:=DAY([.B455]) -> 29 | D455: of:=WEEKNUM([.B455];1) -> 14 | E455: of:=YEAR([.B455]) -> 2021 | F455: of:=ROUNDUP(MONTH([.B455])/3;0) -> 1
A456: of:=[.A455]+1 -> 455 | B456: of:=[.B455]+1 -> 2021-03-30 | C456: of:=DAY([.B456]) -> 30 | D456: of:=WEEKNUM([.B456];1) -> 14 | E456: of:=YEAR([.B456]) -> 2021 | F456: of:=ROUNDUP(MONTH([.B456])/3;0) -> 1
A457: of:=[.A456]+1 -> 456 | B457: of:=[.B456]+1 -> 2021-03-31 | C457: of:=DAY([.B457]) -> 31 | D457: of:=WEEKNUM([.B457];1) -> 14 | E457: of:=YEAR([.B457]) -> 2021 | F457: of:=ROUNDUP(MONTH([.B457])/3;0) -> 1
A458: of:=[.A457]+1 -> 457 | B458: of:=[.B457]+1 -> 2021-04-01 | C458: of:=DAY([.B458]) -> 1 | D458: of:=WEEKNUM([.B458];1) -> 14 | E458: of:=YEAR([.B458]) -> 2021 | F458: of:=ROUNDUP(MONTH([.B458])/3;0) -> 2
A459: of:=[.A458]+1 -> 458 | B459: of:=[.B458]+1 -> 2021-04-02 | C459: of:=DAY([.B459]) -> 2 | D459: of:=WEEKNUM([.B459];1) -> 14 | E459: of:=YEAR([.B459]) -> 2021 | F459: of:=ROUNDUP(MONTH([.B459])/3;0) -> 2
A460: of:=[.A459]+1 -> 459 | B460: of:=[.B459]+1 -> 2021-04-03 | C460: of:=DAY([.B460]) -> 3 | D460: of:=WEEKNUM([.B460];1) -> 14 | E460: of:=YEAR([.B460]) -> 2021 | F460: of:=ROUNDUP(MONTH([.B460])/3;0) -> 2
A461: of:=[.A460]+1 -> 460 | B461: of:=[.B460]+1 -> 2021-04-04 | C461: of:=DAY([.B461]) -> 4 | D461: of:=WEEKNUM([.B461];1) -> 15 | E461: of:=YEAR([.B461]) -> 2021 | F461: of:=ROUNDUP(MONTH([.B461])/3;0) -> 2
A462: of:=[.A461]+1 -> 461 | B462: of:=[.B461]+1 -> 2021-04-05 | C462: of:=DAY([.B462]) -> 5 | D462: of:=WEEKNUM([.B462];1) -> 15 | E462: of:=YEAR([.B462]) -> 2021 | F462: of:=ROUNDUP(MONTH([.B462])/3;0) -> 2
A463: of:=[.A462]+1 -> 462 | B463: of:=[.B462]+1 -> 2021-04-06 | C463: of:=DAY([.B463]) -> 6 | D463: of:=WEEKNUM([.B463];1) -> 15 | E463: of:=YEAR([.B463]) -> 2021 | F463: of:=ROUNDUP(MONTH([.B463])/3;0) -> 2
A464: of:=[.A463]+1 -> 463 | B464: of:=[.B463]+1 -> 2021-04-07 | C464: of:=DAY([.B464]) -> 7 | D464: of:=WEEKNUM([.B464];1) -> 15 | E464: of:=YEAR([.B464]) -> 2021 | F464: of:=ROUNDUP(MONTH([.B464])/3;0) -> 2
A465: of:=[.A464]+1 -> 464 | B465: of:=[.B464]+1 -> 2021-04-08 | C465: of:=DAY([.B465]) -> 8 | D465: of:=WEEKNUM([.B465];1) -> 15 | E465: of:=YEAR([.B465]) -> 2021 | F465: of:=ROUNDUP(MONTH([.B465])/3;0) -> 2
A466: of:=[.A465]+1 -> 465 | B466: of:=[.B465]+1 -> 2021-04-09 | C466: of:=DAY([.B466]) -> 9 | D466: of:=WEEKNUM([.B466];1) -> 15 | E466: of:=YEAR([.B466]) -> 2021 | F466: of:=ROUNDUP(MONTH([.B466])/3;0) -> 2
A467: of:=[.A466]+1 -> 466 | B467: of:=[.B466]+1 -> 2021-04-10 | C467: of:=DAY([.B467]) -> 10 | D467: of:=WEEKNUM([.B467];1) -> 15 | E467: of:=YEAR([.B467]) -> 2021 | F467: of:=ROUNDUP(MONTH([.B467])/3;0) -> 2
A468: of:=[.A467]+1 -> 467 | B468: of:=[.B467]+1 -> 2021-04-11 | C468: of:=DAY([.B468]) -> 11 | D468: of:=WEEKNUM([.B468];1) -> 16 | E468: of:=YEAR([.B468]) -> 2021 | F468: of:=ROUNDUP(MONTH([.B468])/3;0) -> 2
A469: of:=[.A468]+1 -> 468 | B469: of:=[.B468]+1 -> 2021-04-12 | C469: of:=DAY([.B469]) -> 12 | D469: of:=WEEKNUM([.B469];1) -> 16 | E469: of:=YEAR([.B469]) -> 2021 | F469: of:=ROUNDUP(MONTH([.B469])/3;0) -> 2
A470: of:=[.A469]+1 -> 469 | B470: of:=[.B469]+1 -> 2021-04-13 | C470: of:=DAY([.B470]) -> 13 | D470: of:=WEEKNUM([.B470];1) -> 16 | E470: of:=YEAR([.B470]) -> 2021 | F470: of:=ROUNDUP(MONTH([.B470])/3;0) -> 2
A471: of:=[.A470]+1 -> 470 | B471: of:=[.B470]+1 -> 2021-04-14 | C471: of:=DAY([.B471]) -> 14 | D471: of:=WEEKNUM([.B471];1) -> 16 | E471: of:=YEAR([.B471]) -> 2021 | F471: of:=ROUNDUP(MONTH([.B471])/3;0) -> 2
A472: of:=[.A471]+1 -> 471 | B472: of:=[.B471]+1 -> 2021-04-15 | C472: of:=DAY([.B472]) -> 15 | D472: of:=WEEKNUM([.B472];1) -> 16 | E472: of:=YEAR([.B472]) -> 2021 | F472: of:=ROUNDUP(MONTH([.B472])/3;0) -> 2
A473: of:=[.A472]+1 -> 472 | B473: of:=[.B472]+1 -> 2021-04-16 | C473: of:=DAY([.B473]) -> 16 | D473: of:=WEEKNUM([.B473];1) -> 16 | E473: of:=YEAR([.B473]) -> 2021 | F473: of:=ROUNDUP(MONTH([.B473])/3;0) -> 2
A474: of:=[.A473]+1 -> 473 | B474: of:=[.B473]+1 -> 2021-04-17 | C474: of:=DAY([.B474]) -> 17 | D474: of:=WEEKNUM([.B474];1) -> 16 | E474: of:=YEAR([.B474]) -> 2021 | F474: of:=ROUNDUP(MONTH([.B474])/3;0) -> 2
A475: of:=[.A474]+1 -> 474 | B475: of:=[.B474]+1 -> 2021-04-18 | C475: of:=DAY([.B475]) -> 18 | D475: of:=WEEKNUM([.B475];1) -> 17 | E475: of:=YEAR([.B475]) -> 2021 | F475: of:=ROUNDUP(MONTH([.B475])/3;0) -> 2
A476: of:=[.A475]+1 -> 475 | B476: of:=[.B475]+1 -> 2021-04-19 | C476: of:=DAY([.B476]) -> 19 | D476: of:=WEEKNUM([.B476];1) -> 17 | E476: of:=YEAR([.B476]) -> 2021 | F476: of:=ROUNDUP(MONTH([.B476])/3;0) -> 2
A477: of:=[.A476]+1 -> 476 | B477: of:=[.B476]+1 -> 2021-04-20 | C477: of:=DAY([.B477]) -> 20 | D477: of:=WEEKNUM([.B477];1) -> 17 | E477: of:=YEAR([.B477]) -> 2021 | F477: of:=ROUNDUP(MONTH([.B477])/3;0) -> 2
A478: of:=[.A477]+1 -> 477 | B478: of:=[.B477]+1 -> 2021-04-21 | C478: of:=DAY([.B478]) -> 21 | D478: of:=WEEKNUM([.B478];1) -> 17 | E478: of:=YEAR([.B478]) -> 2021 | F478: of:=ROUNDUP(MONTH([.B478])/3;0) -> 2
A479: of:=[.A478]+1 -> 478 | B479: of:=[.B478]+1 -> 2021-04-22 | C479: of:=DAY([.B479]) -> 22 | D479: of:=WEEKNUM([.B479];1) -> 17 | E479: of:=YEAR([.B479]) -> 2021 | F479: of:=ROUNDUP(MONTH([.B479])/3;0) -> 2
A480: of:=[.A479]+1 -> 479 | B480: of:=[.B479]+1 -> 2021-04-23 | C480: of:=DAY([.B480]) -> 23 | D480: of:=WEEKNUM([.B480];1) -> 17 | E480: of:=YEAR([.B480]) -> 2021 | F480: of:=ROUNDUP(MONTH([.B480])/3;0) -> 2
A481: of:=[.A480]+1 -> 480 | B481: of:=[.B480]+1 -> 2021-04-24 | C481: of:=DAY([.B481]) -> 24 | D481: of:=WEEKNUM([.B481];1) -> 17 | E481: of:=YEAR([.B481]) -> 2021 | F481: of:=ROUNDUP(MONTH([.B481])/3;0) -> 2
A482: of:=[.A481]+1 -> 481 | B482: of:=[.B481]+1 -> 2021-04-25 | C482: of:=DAY([.B482]) -> 25 | D482: of:=WEEKNUM([.B482];1) -> 18 | E482: of:=YEAR([.B482]) -> 2021 | F482: of:=ROUNDUP(MONTH([.B482])/3;0) -> 2
A483: of:=[.A482]+1 -> 482 | B483: of:=[.B482]+1 -> 2021-04-26 | C483: of:=DAY([.B483]) -> 26 | D483: of:=WEEKNUM([.B483];1) -> 18 | E483: of:=YEAR([.B483]) -> 2021 | F483: of:=ROUNDUP(MONTH([.B483])/3;0) -> 2
A484: of:=[.A483]+1 -> 483 | B484: of:=[.B483]+1 -> 2021-04-27 | C484: of:=DAY([.B484]) -> 27 | D484: of:=WEEKNUM([.B484];1) -> 18 | E484: of:=YEAR([.B484]) -> 2021 | F484: of:=ROUNDUP(MONTH([.B484])/3;0) -> 2
A485: of:=[.A484]+1 -> 484 | B485: of:=[.B484]+1 -> 2021-04-28 | C485: of:=DAY([.B485]) -> 28 | D485: of:=WEEKNUM([.B485];1) -> 18 | E485: of:=YEAR([.B485]) -> 2021 | F485: of:=ROUNDUP(MONTH([.B485])/3;0) -> 2
A486: of:=[.A485]+1 -> 485 | B486: of:=[.B485]+1 -> 2021-04-29 | C486: of:=DAY([.B486]) -> 29 | D486: of:=WEEKNUM([.B486];1) -> 18 | E486: of:=YEAR([.B486]) -> 2021 | F486: of:=ROUNDUP(MONTH([.B486])/3;0) -> 2
A487: of:=[.A486]+1 -> 486 | B487: of:=[.B486]+1 -> 2021-04-30 | C487: of:=DAY([.B487]) -> 30 | D487: of:=WEEKNUM([.B487];1) -> 18 | E487: of:=YEAR([.B487]) -> 2021 | F487: of:=ROUNDUP(MONTH([.B487])/3;0) -> 2
A488: of:=[.A487]+1 -> 487 | B488: of:=[.B487]+1 -> 2021-05-01 | C488: of:=DAY([.B488]) -> 1 | D488: of:=WEEKNUM([.B488];1) -> 18 | E488: of:=YEAR([.B488]) -> 2021 | F488: of:=ROUNDUP(MONTH([.B488])/3;0) -> 2
A489: of:=[.A488]+1 -> 488 | B489: of:=[.B488]+1 -> 2021-05-02 | C489: of:=DAY([.B489]) -> 2 | D489: of:=WEEKNUM([.B489];1) -> 19 | E489: of:=YEAR([.B489]) -> 2021 | F489: of:=ROUNDUP(MONTH([.B489])/3;0) -> 2
A490: of:=[.A489]+1 -> 489 | B490: of:=[.B489]+1 -> 2021-05-03 | C490: of:=DAY([.B490]) -> 3 | D490: of:=WEEKNUM([.B490];1) -> 19 | E490: of:=YEAR([.B490]) -> 2021 | F490: of:=ROUNDUP(MONTH([.B490])/3;0) -> 2
A491: of:=[.A490]+1 -> 490 | B491: of:=[.B490]+1 -> 2021-05-04 | C491: of:=DAY([.B491]) -> 4 | D491: of:=WEEKNUM([.B491];1) -> 19 | E491: of:=YEAR([.B491]) -> 2021 | F491: of:=ROUNDUP(MONTH([.B491])/3;0) -> 2
A492: of:=[.A491]+1 -> 491 | B492: of:=[.B491]+1 -> 2021-05-05 | C492: of:=DAY([.B492]) -> 5 | D492: of:=WEEKNUM([.B492];1) -> 19 | E492: of:=YEAR([.B492]) -> 2021 | F492: of:=ROUNDUP(MONTH([.B492])/3;0) -> 2
A493: of:=[.A492]+1 -> 492 | B493: of:=[.B492]+1 -> 2021-05-06 | C493: of:=DAY([.B493]) -> 6 | D493: of:=WEEKNUM([.B493];1) -> 19 | E493: of:=YEAR([.B493]) -> 2021 | F493: of:=ROUNDUP(MONTH([.B493])/3;0) -> 2
A494: of:=[.A493]+1 -> 493 | B494: of:=[.B493]+1 -> 2021-05-07 | C494: of:=DAY([.B494]) -> 7 | D494: of:=WEEKNUM([.B494];1) -> 19 | E494: of:=YEAR([.B494]) -> 2021 | F494: of:=ROUNDUP(MONTH([.B494])/3;0) -> 2
A495: of:=[.A494]+1 -> 494 | B495: of:=[.B494]+1 -> 2021-05-08 | C495: of:=DAY([.B495]) -> 8 | D495: of:=WEEKNUM([.B495];1) -> 19 | E495: of:=YEAR([.B495]) -> 2021 | F495: of:=ROUNDUP(MONTH([.B495])/3;0) -> 2
A496: of:=[.A495]+1 -> 495 | B496: of:=[.B495]+1 -> 2021-05-09 | C496: of:=DAY([.B496]) -> 9 | D496: of:=WEEKNUM([.B496];1) -> 20 | E496: of:=YEAR([.B496]) -> 2021 | F496: of:=ROUNDUP(MONTH([.B496])/3;0) -> 2
A497: of:=[.A496]+1 -> 496 | B497: of:=[.B496]+1 -> 2021-05-10 | C497: of:=DAY([.B497]) -> 10 | D497: of:=WEEKNUM([.B497];1) -> 20 | E497: of:=YEAR([.B497]) -> 2021 | F497: of:=ROUNDUP(MONTH([.B497])/3;0) -> 2
A498: of:=[.A497]+1 -> 497 | B498: of:=[.B497]+1 -> 2021-05-11 | C498: of:=DAY([.B498]) -> 11 | D498: of:=WEEKNUM([.B498];1) -> 20 | E498: of:=YEAR([.B498]) -> 2021 | F498: of:=ROUNDUP(MONTH([.B498])/3;0) -> 2
A499: of:=[.A498]+1 -> 498 | B499: of:=[.B498]+1 -> 2021-05-12 | C499: of:=DAY([.B499]) -> 12 | D499: of:=WEEKNUM([.B499];1) -> 20 | E499: of:=YEAR([.B499]) -> 2021 | F499: of:=ROUNDUP(MONTH([.B499])/3;0) -> 2
A500: of:=[.A499]+1 -> 499 | B500: of:=[.B499]+1 -> 2021-05-13 | C500: of:=DAY([.B500]) -> 13 | D500: of:=WEEKNUM([.B500];1) -> 20 | E500: of:=YEAR([.B500]) -> 2021 | F500: of:=ROUNDUP(MONTH([.B500])/3;0) -> 2
A501: of:=[.A500]+1 -> 500 | B501: of:=[.B500]+1 -> 2021-05-14 | C501: of:=DAY([.B501]) -> 14 | D501: of:=WEEKNUM([.B501];1) -> 20 | E501: of:=YEAR([.B501]) -> 2021 | F501: of:=ROUNDUP(MONTH([.B501])/3;0) -> 2
A502: of:=[.A501]+1 -> 501 | B502: of:=[.B501]+1 -> 2021-05-15 | C502: of:=DAY([.B502]) -> 15 | D502: of:=WEEKNUM([.B502];1) -> 20 | E502: of:=YEAR([.B502]) -> 2021 | F502: of:=ROUNDUP(MONTH([.B502])/3;0) -> 2
A503: of:=[.A502]+1 -> 502 | B503: of:=[.B502]+1 -> 2021-05-16 | C503: of:=DAY([.B503]) -> 16 | D503: of:=WEEKNUM([.B503];1) -> 21 | E503: of:=YEAR([.B503]) -> 2021 | F503: of:=ROUNDUP(MONTH([.B503])/3;0) -> 2
A504: of:=[.A503]+1 -> 503 | B504: of:=[.B503]+1 -> 2021-05-17 | C504: of:=DAY([.B504]) -> 17 | D504: of:=WEEKNUM([.B504];1) -> 21 | E504: of:=YEAR([.B504]) -> 2021 | F504: of:=ROUNDUP(MONTH([.B504])/3;0) -> 2
A505: of:=[.A504]+1 -> 504 | B505: of:=[.B504]+1 -> 2021-05-18 | C505: of:=DAY([.B505]) -> 18 | D505: of:=WEEKNUM([.B505];1) -> 21 | E505: of:=YEAR([.B505]) -> 2021 | F505: of:=ROUNDUP(MONTH([.B505])/3;0) -> 2
A506: of:=[.A505]+1 -> 505 | B506: of:=[.B505]+1 -> 2021-05-19 | C506: of:=DAY([.B506]) -> 19 | D506: of:=WEEKNUM([.B506];1) -> 21 | E506: of:=YEAR([.B506]) -> 2021 | F506: of:=ROUNDUP(MONTH([.B506])/3;0) -> 2
A507: of:=[.A506]+1 -> 506 | B507: of:=[.B506]+1 -> 2021-05-20 | C507: of:=DAY([.B507]) -> 20 | D507: of:=WEEKNUM([.B507];1) -> 21 | E507: of:=YEAR([.B507]) -> 2021 | F507: of:=ROUNDUP(MONTH([.B507])/3;0) -> 2
A508: of:=[.A507]+1 -> 507 | B508: of:=[.B507]+1 -> 2021-05-21 | C508: of:=DAY([.B508]) -> 21 | D508: of:=WEEKNUM([.B508];1) -> 21 | E508: of:=YEAR([.B508]) -> 2021 | F508: of:=ROUNDUP(MONTH([.B508])/3;0) -> 2
A509: of:=[.A508]+1 -> 508 | B509: of:=[.B508]+1 -> 2021-05-22 | C509: of:=DAY([.B509]) -> 22 | D509: of:=WEEKNUM([.B509];1) -> 21 | E509: of:=YEAR([.B509]) -> 2021 | F509: of:=ROUNDUP(MONTH([.B509])/3;0) -> 2
A510: of:=[.A509]+1 -> 509 | B510: of:=[.B509]+1 -> 2021-05-23 | C510: of:=DAY([.B510]) -> 23 | D510: of:=WEEKNUM([.B510];1) -> 22 | E510: of:=YEAR([.B510]) -> 2021 | F510: of:=ROUNDUP(MONTH([.B510])/3;0) -> 2
A511: of:=[.A510]+1 -> 510 | B511: of:=[.B510]+1 -> 2021-05-24 | C511: of:=DAY([.B511]) -> 24 | D511: of:=WEEKNUM([.B511];1) -> 22 | E511: of:=YEAR([.B511]) -> 2021 | F511: of:=ROUNDUP(MONTH([.B511])/3;0) -> 2
A512: of:=[.A511]+1 -> 511 | B512: of:=[.B511]+1 -> 2021-05-25 | C512: of:=DAY([.B512]) -> 25 | D512: of:=WEEKNUM([.B512];1) -> 22 | E512: of:=YEAR([.B512]) -> 2021 | F512: of:=ROUNDUP(MONTH([.B512])/3;0) -> 2
A513: of:=[.A512]+1 -> 512 | B513: of:=[.B512]+1 -> 2021-05-26 | C513: of:=DAY([.B513]) -> 26 | D513: of:=WEEKNUM([.B513];1) -> 22 | E513: of:=YEAR([.B513]) -> 2021 | F513: of:=ROUNDUP(MONTH([.B513])/3;0) -> 2
A514: of:=[.A513]+1 -> 513 | B514: of:=[.B513]+1 -> 2021-05-27 | C514: of:=DAY([.B514]) -> 27 | D514: of:=WEEKNUM([.B514];1) -> 22 | E514: of:=YEAR([.B514]) -> 2021 | F514: of:=ROUNDUP(MONTH([.B514])/3;0) -> 2
A515: of:=[.A514]+1 -> 514 | B515: of:=[.B514]+1 -> 2021-05-28 | C515: of:=DAY([.B515]) -> 28 | D515: of:=WEEKNUM([.B515];1) -> 22 | E515: of:=YEAR([.B515]) -> 2021 | F515: of:=ROUNDUP(MONTH([.B515])/3;0) -> 2
A516: of:=[.A515]+1 -> 515 | B516: of:=[.B515]+1 -> 2021-05-29 | C516: of:=DAY([.B516]) -> 29 | D516: of:=WEEKNUM([.B516];1) -> 22 | E516: of:=YEAR([.B516]) -> 2021 | F516: of:=ROUNDUP(MONTH([.B516])/3;0) -> 2
A517: of:=[.A516]+1 -> 516 | B517: of:=[.B516]+1 -> 2021-05-30 | C517: of:=DAY([.B517]) -> 30 | D517: of:=WEEKNUM([.B517];1) -> 23 | E517: of:=YEAR([.B517]) -> 2021 | F517: of:=ROUNDUP(MONTH([.B517])/3;0) -> 2
A518: of:=[.A517]+1 -> 517 | B518: of:=[.B517]+1 -> 2021-05-31 | C518: of:=DAY([.B518]) -> 31 | D518: of:=WEEKNUM([.B518];1) -> 23 | E518: of:=YEAR([.B518]) -> 2021 | F518: of:=ROUNDUP(MONTH([.B518])/3;0) -> 2
A519: of:=[.A518]+1 -> 518 | B519: of:=[.B518]+1 -> 2021-06-01 | C519: of:=DAY([.B519]) -> 1 | D519: of:=WEEKNUM([.B519];1) -> 23 | E519: of:=YEAR([.B519]) -> 2021 | F519: of:=ROUNDUP(MONTH([.B519])/3;0) -> 2
A520: of:=[.A519]+1 -> 519 | B520: of:=[.B519]+1 -> 2021-06-02 | C520: of:=DAY([.B520]) -> 2 | D520: of:=WEEKNUM([.B520];1) -> 23 | E520: of:=YEAR([.B520]) -> 2021 | F520: of:=ROUNDUP(MONTH([.B520])/3;0) -> 2
A521: of:=[.A520]+1 -> 520 | B521: of:=[.B520]+1 -> 2021-06-03 | C521: of:=DAY([.B521]) -> 3 | D521: of:=WEEKNUM([.B521];1) -> 23 | E521: of:=YEAR([.B521]) -> 2021 | F521: of:=ROUNDUP(MONTH([.B521])/3;0) -> 2
A522: of:=[.A521]+1 -> 521 | B522: of:=[.B521]+1 -> 2021-06-04 | C522: of:=DAY([.B522]) -> 4 | D522: of:=WEEKNUM([.B522];1) -> 23 | E522: of:=YEAR([.B522]) -> 2021 | F522: of:=ROUNDUP(MONTH([.B522])/3;0) -> 2
A523: of:=[.A522]+1 -> 522 | B523: of:=[.B522]+1 -> 2021-06-05 | C523: of:=DAY([.B523]) -> 5 | D523: of:=WEEKNUM([.B523];1) -> 23 | E523: of:=YEAR([.B523]) -> 2021 | F523: of:=ROUNDUP(MONTH([.B523])/3;0) -> 2
A524: of:=[.A523]+1 -> 523 | B524: of:=[.B523]+1 -> 2021-06-06 | C524: of:=DAY([.B524]) -> 6 | D524: of:=WEEKNUM([.B524];1) -> 24 | E524: of:=YEAR([.B524]) -> 2021 | F524: of:=ROUNDUP(MONTH([.B524])/3;0) -> 2
A525: of:=[.A524]+1 -> 524 | B525: of:=[.B524]+1 -> 2021-06-07 | C525: of:=DAY([.B525]) -> 7 | D525: of:=WEEKNUM([.B525];1) -> 24 | E525: of:=YEAR([.B525]) -> 2021 | F525: of:=ROUNDUP(MONTH([.B525])/3;0) -> 2
A526: of:=[.A525]+1 -> 525 | B526: of:=[.B525]+1 -> 2021-06-08 | C526: of:=DAY([.B526]) -> 8 | D526: of:=WEEKNUM([.B526];1) -> 24 | E526: of:=YEAR([.B526]) -> 2021 | F526: of:=ROUNDUP(MONTH([.B526])/3;0) -> 2
A527: of:=[.A526]+1 -> 526 | B527: of:=[.B526]+1 -> 2021-06-09 | C527: of:=DAY([.B527]) -> 9 | D527: of:=WEEKNUM([.B527];1) -> 24 | E527: of:=YEAR([.B527]) -> 2021 | F527: of:=ROUNDUP(MONTH([.B527])/3;0) -> 2
A528: of:=[.A527]+1 -> 527 | B528: of:=[.B527]+1 -> 2021-06-10 | C528: of:=DAY([.B528]) -> 10 | D528: of:=WEEKNUM([.B528];1) -> 24 | E528: of:=YEAR([.B528]) -> 2021 | F528: of:=ROUNDUP(MONTH([.B528])/3;0) -> 2
A529: of:=[.A528]+1 -> 528 | B529: of:=[.B528]+1 -> 2021-06-11 | C529: of:=DAY([.B529]) -> 11 | D529: of:=WEEKNUM([.B529];1) -> 24 | E529: of:=YEAR([.B529]) -> 2021 | F529: of:=ROUNDUP(MONTH([.B529])/3;0) -> 2
A530: of:=[.A529]+1 -> 529 | B530: of:=[.B529]+1 -> 2021-06-12 | C530: of:=DAY([.B530]) -> 12 | D530: of:=WEEKNUM([.B530];1) -> 24 | E530: of:=YEAR([.B530]) -> 2021 | F530: of:=ROUNDUP(MONTH([.B530])/3;0) -> 2
A531: of:=[.A530]+1 -> 530 | B531: of:=[.B530]+1 -> 2021-06-13 | C531: of:=DAY([.B531]) -> 13 | D531: of:=WEEKNUM([.B531];1) -> 25 | E531: of:=YEAR([.B531]) -> 2021 | F531: of:=ROUNDUP(MONTH([.B531])/3;0) -> 2
A532: of:=[.A531]+1 -> 531 | B532: of:=[.B531]+1 -> 2021-06-14 | C532: of:=DAY([.B532]) -> 14 | D532: of:=WEEKNUM([.B532];1) -> 25 | E532: of:=YEAR([.B532]) -> 2021 | F532: of:=ROUNDUP(MONTH([.B532])/3;0) -> 2
A533: of:=[.A532]+1 -> 532 | B533: of:=[.B532]+1 -> 2021-06-15 | C533: of:=DAY([.B533]) -> 15 | D533: of:=WEEKNUM([.B533];1) -> 25 | E533: of:=YEAR([.B533]) -> 2021 | F533: of:=ROUNDUP(MONTH([.B533])/3;0) -> 2
A534: of:=[.A533]+1 -> 533 | B534: of:=[.B533]+1 -> 2021-06-16 | C534: of:=DAY([.B534]) -> 16 | D534: of:=WEEKNUM([.B534];1) -> 25 | E534: of:=YEAR([.B534]) -> 2021 | F534: of:=ROUNDUP(MONTH([.B534])/3;0) -> 2
A535: of:=[.A534]+1 -> 534 | B535: of:=[.B534]+1 -> 2021-06-17 | C535: of:=DAY([.B535]) -> 17 | D535: of:=WEEKNUM([.B535];1) -> 25 | E535: of:=YEAR([.B535]) -> 2021 | F535: of:=ROUNDUP(MONTH([.B535])/3;0) -> 2
A536: of:=[.A535]+1 -> 535 | B536: of:=[.B535]+1 -> 2021-06-18 | C536: of:=DAY([.B536]) -> 18 | D536: of:=WEEKNUM([.B536];1) -> 25 | E536: of:=YEAR([.B536]) -> 2021 | F536: of:=ROUNDUP(MONTH([.B536])/3;0) -> 2
A537: of:=[.A536]+1 -> 536 | B537: of:=[.B536]+1 -> 2021-06-19 | C537: of:=DAY([.B537]) -> 19 | D537: of:=WEEKNUM([.B537];1) -> 25 | E537: of:=YEAR([.B537]) -> 2021 | F537: of:=ROUNDUP(MONTH([.B537])/3;0) -> 2
A538: of:=[.A537]+1 -> 537 | B538: of:=[.B537]+1 -> 2021-06-20 | C538: of:=DAY([.B538]) -> 20 | D538: of:=WEEKNUM([.B538];1) -> 26 | E538: of:=YEAR([.B538]) -> 2021 | F538: of:=ROUNDUP(MONTH([.B538])/3;0) -> 2
A539: of:=[.A538]+1 -> 538 | B539: of:=[.B538]+1 -> 2021-06-21 | C539: of:=DAY([.B539]) -> 21 | D539: of:=WEEKNUM([.B539];1) -> 26 | E539: of:=YEAR([.B539]) -> 2021 | F539: of:=ROUNDUP(MONTH([.B539])/3;0) -> 2
A540: of:=[.A539]+1 -> 539 | B540: of:=[.B539]+1 -> 2021-06-22 | C540: of:=DAY([.B540]) -> 22 | D540: of:=WEEKNUM([.B540];1) -> 26 | E540: of:=YEAR([.B540]) -> 2021 | F540: of:=ROUNDUP(MONTH([.B540])/3;0) -> 2
A541: of:=[.A540]+1 -> 540 | B541: of:=[.B540]+1 -> 2021-06-23 | C541: of:=DAY([.B541]) -> 23 | D541: of:=WEEKNUM([.B541];1) -> 26 | E541: of:=YEAR([.B541]) -> 2021 | F541: of:=ROUNDUP(MONTH([.B541])/3;0) -> 2
A542: of:=[.A541]+1 -> 541 | B542: of:=[.B541]+1 -> 2021-06-24 | C542: of:=DAY([.B542]) -> 24 | D542: of:=WEEKNUM([.B542];1) -> 26 | E542: of:=YEAR([.B542]) -> 2021 | F542: of:=ROUNDUP(MONTH([.B542])/3;0) -> 2
A543: of:=[.A542]+1 -> 542 | B543: of:=[.B542]+1 -> 2021-06-25 | C543: of:=DAY([.B543]) -> 25 | D543: of:=WEEKNUM([.B543];1) -> 26 | E543: of:=YEAR([.B543]) -> 2021 | F543: of:=ROUNDUP(MONTH([.B543])/3;0) -> 2
A544: of:=[.A543]+1 -> 543 | B544: of:=[.B543]+1 -> 2021-06-26 | C544: of:=DAY([.B544]) -> 26 | D544: of:=WEEKNUM([.B544];1) -> 26 | E544: of:=YEAR([.B544]) -> 2021 | F544: of:=ROUNDUP(MONTH([.B544])/3;0) -> 2
A545: of:=[.A544]+1 -> 544 | B545: of:=[.B544]+1 -> 2021-06-27 | C545: of:=DAY([.B545]) -> 27 | D545: of:=WEEKNUM([.B545];1) -> 27 | E545: of:=YEAR([.B545]) -> 2021 | F545: of:=ROUNDUP(MONTH([.B545])/3;0) -> 2
A546: of:=[.A545]+1 -> 545 | B546: of:=[.B545]+1 -> 2021-06-28 | C546: of:=DAY([.B546]) -> 28 | D546: of:=WEEKNUM([.B546];1) -> 27 | E546: of:=YEAR([.B546]) -> 2021 | F546: of:=ROUNDUP(MONTH([.B546])/3;0) -> 2
A547: of:=[.A546]+1 -> 546 | B547: of:=[.B546]+1 -> 2021-06-29 | C547: of:=DAY([.B547]) -> 29 | D547: of:=WEEKNUM([.B547];1) -> 27 | E547: of:=YEAR([.B547]) -> 2021 | F547: of:=ROUNDUP(MONTH([.B547])/3;0) -> 2
A548: of:=[.A547]+1 -> 547 | B548: of:=[.B547]+1 -> 2021-06-30 | C548: of:=DAY([.B548]) -> 30 | D548: of:=WEEKNUM([.B548];1) -> 27 | E548: of:=YEAR([.B548]) -> 2021 | F548: of:=ROUNDUP(MONTH([.B548])/3;0) -> 2
A549: of:=[.A548]+1 -> 548 | B549: of:=[.B548]+1 -> 2021-07-01 | C549: of:=DAY([.B549]) -> 1 | D549: of:=WEEKNUM([.B549];1) -> 27 | E549: of:=YEAR([.B549]) -> 2021 | F549: of:=ROUNDUP(MONTH([.B549])/3;0) -> 3
A550: of:=[.A549]+1 -> 549 | B550: of:=[.B549]+1 -> 2021-07-02 | C550: of:=DAY([.B550]) -> 2 | D550: of:=WEEKNUM([.B550];1) -> 27 | E550: of:=YEAR([.B550]) -> 2021 | F550: of:=ROUNDUP(MONTH([.B550])/3;0) -> 3
A551: of:=[.A550]+1 -> 550 | B551: of:=[.B550]+1 -> 2021-07-03 | C551: of:=DAY([.B551]) -> 3 | D551: of:=WEEKNUM([.B551];1) -> 27 | E551: of:=YEAR([.B551]) -> 2021 | F551: of:=ROUNDUP(MONTH([.B551])/3;0) -> 3
A552: of:=[.A551]+1 -> 551 | B552: of:=[.B551]+1 -> 2021-07-04 | C552: of:=DAY([.B552]) -> 4 | D552: of:=WEEKNUM([.B552];1) -> 28 | E552: of:=YEAR([.B552]) -> 2021 | F552: of:=ROUNDUP(MONTH([.B552])/3;0) -> 3
A553: of:=[.A552]+1 -> 552 | B553: of:=[.B552]+1 -> 2021-07-05 | C553: of:=DAY([.B553]) -> 5 | D553: of:=WEEKNUM([.B553];1) -> 28 | E553: of:=YEAR([.B553]) -> 2021 | F553: of:=ROUNDUP(MONTH([.B553])/3;0) -> 3
A554: of:=[.A553]+1 -> 553 | B554: of:=[.B553]+1 -> 2021-07-06 | C554: of:=DAY([.B554]) -> 6 | D554: of:=WEEKNUM([.B554];1) -> 28 | E554: of:=YEAR([.B554]) -> 2021 | F554: of:=ROUNDUP(MONTH([.B554])/3;0) -> 3
A555: of:=[.A554]+1 -> 554 | B555: of:=[.B554]+1 -> 2021-07-07 | C555: of:=DAY([.B555]) -> 7 | D555: of:=WEEKNUM([.B555];1) -> 28 | E555: of:=YEAR([.B555]) -> 2021 | F555: of:=ROUNDUP(MONTH([.B555])/3;0) -> 3
A556: of:=[.A555]+1 -> 555 | B556: of:=[.B555]+1 -> 2021-07-08 | C556: of:=DAY([.B556]) -> 8 | D556: of:=WEEKNUM([.B556];1) -> 28 | E556: of:=YEAR([.B556]) -> 2021 | F556: of:=ROUNDUP(MONTH([.B556])/3;0) -> 3
A557: of:=[.A556]+1 -> 556 | B557: of:=[.B556]+1 -> 2021-07-09 | C557: of:=DAY([.B557]) -> 9 | D557: of:=WEEKNUM([.B557];1) -> 28 | E557: of:=YEAR([.B557]) -> 2021 | F557: of:=ROUNDUP(MONTH([.B557])/3;0) -> 3
A558: of:=[.A557]+1 -> 557 | B558: of:=[.B557]+1 -> 2021-07-10 | C558: of:=DAY([.B558]) -> 10 | D558: of:=WEEKNUM([.B558];1) -> 28 | E558: of:=YEAR([.B558]) -> 2021 | F558: of:=ROUNDUP(MONTH([.B558])/3;0) -> 3
A559: of:=[.A558]+1 -> 558 | B559: of:=[.B558]+1 -> 2021-07-11 | C559: of:=DAY([.B559]) -> 11 | D559: of:=WEEKNUM([.B559];1) -> 29 | E559: of:=YEAR([.B559]) -> 2021 | F559: of:=ROUNDUP(MONTH([.B559])/3;0) -> 3
A560: of:=[.A559]+1 -> 559 | B560: of:=[.B559]+1 -> 2021-07-12 | C560: of:=DAY([.B560]) -> 12 | D560: of:=WEEKNUM([.B560];1) -> 29 | E560: of:=YEAR([.B560]) -> 2021 | F560: of:=ROUNDUP(MONTH([.B560])/3;0) -> 3
A561: of:=[.A560]+1 -> 560 | B561: of:=[.B560]+1 -> 2021-07-13 | C561: of:=DAY([.B561]) -> 13 | D561: of:=WEEKNUM([.B561];1) -> 29 | E561: of:=YEAR([.B561]) -> 2021 | F561: of:=ROUNDUP(MONTH([.B561])/3;0) -> 3
A562: of:=[.A561]+1 -> 561 | B562: of:=[.B561]+1 -> 2021-07-14 | C562: of:=DAY([.B562]) -> 14 | D562: of:=WEEKNUM([.B562];1) -> 29 | E562: of:=YEAR([.B562]) -> 2021 | F562: of:=ROUNDUP(MONTH([.B562])/3;0) -> 3
A563: of:=[.A562]+1 -> 562 | B563: of:=[.B562]+1 -> 2021-07-15 | C563: of:=DAY([.B563]) -> 15 | D563: of:=WEEKNUM([.B563];1) -> 29 | E563: of:=YEAR([.B563]) -> 2021 | F563: of:=ROUNDUP(MONTH([.B563])/3;0) -> 3
A564: of:=[.A563]+1 -> 563 | B564: of:=[.B563]+1 -> 2021-07-16 | C564: of:=DAY([.B564]) -> 16 | D564: of:=WEEKNUM([.B564];1) -> 29 | E564: of:=YEAR([.B564]) -> 2021 | F564: of:=ROUNDUP(MONTH([.B564])/3;0) -> 3
A565: of:=[.A564]+1 -> 564 | B565: of:=[.B564]+1 -> 2021-07-17 | C565: of:=DAY([.B565]) -> 17 | D565: of:=WEEKNUM([.B565];1) -> 29 | E565: of:=YEAR([.B565]) -> 2021 | F565: of:=ROUNDUP(MONTH([.B565])/3;0) -> 3
A566: of:=[.A565]+1 -> 565 | B566: of:=[.B565]+1 -> 2021-07-18 | C566: of:=DAY([.B566]) -> 18 | D566: of:=WEEKNUM([.B566];1) -> 30 | E566: of:=YEAR([.B566]) -> 2021 | F566: of:=ROUNDUP(MONTH([.B566])/3;0) -> 3
A567: of:=[.A566]+1 -> 566 | B567: of:=[.B566]+1 -> 2021-07-19 | C567: of:=DAY([.B567]) -> 19 | D567: of:=WEEKNUM([.B567];1) -> 30 | E567: of:=YEAR([.B567]) -> 2021 | F567: of:=ROUNDUP(MONTH([.B567])/3;0) -> 3
A568: of:=[.A567]+1 -> 567 | B568: of:=[.B567]+1 -> 2021-07-20 | C568: of:=DAY([.B568]) -> 20 | D568: of:=WEEKNUM([.B568];1) -> 30 | E568: of:=YEAR([.B568]) -> 2021 | F568: of:=ROUNDUP(MONTH([.B568])/3;0) -> 3
A569: of:=[.A568]+1 -> 568 | B569: of:=[.B568]+1 -> 2021-07-21 | C569: of:=DAY([.B569]) -> 21 | D569: of:=WEEKNUM([.B569];1) -> 30 | E569: of:=YEAR([.B569]) -> 2021 | F569: of:=ROUNDUP(MONTH([.B569])/3;0) -> 3
A570: of:=[.A569]+1 -> 569 | B570: of:=[.B569]+1 -> 2021-07-22 | C570: of:=DAY([.B570]) -> 22 | D570: of:=WEEKNUM([.B570];1) -> 30 | E570: of:=YEAR([.B570]) -> 2021 | F570: of:=ROUNDUP(MONTH([.B570])/3;0) -> 3
A571: of:=[.A570]+1 -> 570 | B571: of:=[.B570]+1 -> 2021-07-23 | C571: of:=DAY([.B571]) -> 23 | D571: of:=WEEKNUM([.B571];1) -> 30 | E571: of:=YEAR([.B571]) -> 2021 | F571: of:=ROUNDUP(MONTH([.B571])/3;0) -> 3
A572: of:=[.A571]+1 -> 571 | B572: of:=[.B571]+1 -> 2021-07-24 | C572: of:=DAY([.B572]) -> 24 | D572: of:=WEEKNUM([.B572];1) -> 30 | E572: of:=YEAR([.B572]) -> 2021 | F572: of:=ROUNDUP(MONTH([.B572])/3;0) -> 3
A573: of:=[.A572]+1 -> 572 | B573: of:=[.B572]+1 -> 2021-07-25 | C573: of:=DAY([.B573]) -> 25 | D573: of:=WEEKNUM([.B573];1) -> 31 | E573: of:=YEAR([.B573]) -> 2021 | F573: of:=ROUNDUP(MONTH([.B573])/3;0) -> 3
A574: of:=[.A573]+1 -> 573 | B574: of:=[.B573]+1 -> 2021-07-26 | C574: of:=DAY([.B574]) -> 26 | D574: of:=WEEKNUM([.B574];1) -> 31 | E574: of:=YEAR([.B574]) -> 2021 | F574: of:=ROUNDUP(MONTH([.B574])/3;0) -> 3
A575: of:=[.A574]+1 -> 574 | B575: of:=[.B574]+1 -> 2021-07-27 | C575: of:=DAY([.B575]) -> 27 | D575: of:=WEEKNUM([.B575];1) -> 31 | E575: of:=YEAR([.B575]) -> 2021 | F575: of:=ROUNDUP(MONTH([.B575])/3;0) -> 3
A576: of:=[.A575]+1 -> 575 | B576: of:=[.B575]+1 -> 2021-07-28 | C576: of:=DAY([.B576]) -> 28 | D576: of:=WEEKNUM([.B576];1) -> 31 | E576: of:=YEAR([.B576]) -> 2021 | F576: of:=ROUNDUP(MONTH([.B576])/3;0) -> 3
A577: of:=[.A576]+1 -> 576 | B577: of:=[.B576]+1 -> 2021-07-29 | C577: of:=DAY([.B577]) -> 29 | D577: of:=WEEKNUM([.B577];1) -> 31 | E577: of:=YEAR([.B577]) -> 2021 | F577: of:=ROUNDUP(MONTH([.B577])/3;0) -> 3
A578: of:=[.A577]+1 -> 577 | B578: of:=[.B577]+1 -> 2021-07-30 | C578: of:=DAY([.B578]) -> 30 | D578: of:=WEEKNUM([.B578];1) -> 31 | E578: of:=YEAR([.B578]) -> 2021 | F578: of:=ROUNDUP(MONTH([.B578])/3;0) -> 3
A579: of:=[.A578]+1 -> 578 | B579: of:=[.B578]+1 -> 2021-07-31 | C579: of:=DAY([.B579]) -> 31 | D579: of:=WEEKNUM([.B579];1) -> 31 | E579: of:=YEAR([.B579]) -> 2021 | F579: of:=ROUNDUP(MONTH([.B579])/3;0) -> 3
A580: of:=[.A579]+1 -> 579 | B580: of:=[.B579]+1 -> 2021-08-01 | C580: of:=DAY([.B580]) -> 1 | D580: of:=WEEKNUM([.B580];1) -> 32 | E580: of:=YEAR([.B580]) -> 2021 | F580: of:=ROUNDUP(MONTH([.B580])/3;0) -> 3
A581: of:=[.A580]+1 -> 580 | B581: of:=[.B580]+1 -> 2021-08-02 | C581: of:=DAY([.B581]) -> 2 | D581: of:=WEEKNUM([.B581];1) -> 32 | E581: of:=YEAR([.B581]) -> 2021 | F581: of:=ROUNDUP(MONTH([.B581])/3;0) -> 3
A582: of:=[.A581]+1 -> 581 | B582: of:=[.B581]+1 -> 2021-08-03 | C582: of:=DAY([.B582]) -> 3 | D582: of:=WEEKNUM([.B582];1) -> 32 | E582: of:=YEAR([.B582]) -> 2021 | F582: of:=ROUNDUP(MONTH([.B582])/3;0) -> 3
A583: of:=[.A582]+1 -> 582 | B583: of:=[.B582]+1 -> 2021-08-04 | C583: of:=DAY([.B583]) -> 4 | D583: of:=WEEKNUM([.B583];1) -> 32 | E583: of:=YEAR([.B583]) -> 2021 | F583: of:=ROUNDUP(MONTH([.B583])/3;0) -> 3
A584: of:=[.A583]+1 -> 583 | B584: of:=[.B583]+1 -> 2021-08-05 | C584: of:=DAY([.B584]) -> 5 | D584: of:=WEEKNUM([.B584];1) -> 32 | E584: of:=YEAR([.B584]) -> 2021 | F584: of:=ROUNDUP(MONTH([.B584])/3;0) -> 3
A585: of:=[.A584]+1 -> 584 | B585: of:=[.B584]+1 -> 2021-08-06 | C585: of:=DAY([.B585]) -> 6 | D585: of:=WEEKNUM([.B585];1) -> 32 | E585: of:=YEAR([.B585]) -> 2021 | F585: of:=ROUNDUP(MONTH([.B585])/3;0) -> 3
A586: of:=[.A585]+1 -> 585 | B586: of:=[.B585]+1 -> 2021-08-07 | C586: of:=DAY([.B586]) -> 7 | D586: of:=WEEKNUM([.B586];1) -> 32 | E586: of:=YEAR([.B586]) -> 2021 | F586: of:=ROUNDUP(MONTH([.B586])/3;0) -> 3
A587: of:=[.A586]+1 -> 586 | B587: of:=[.B586]+1 -> 2021-08-08 | C587: of:=DAY([.B587]) -> 8 | D587: of:=WEEKNUM([.B587];1) -> 33 | E587: of:=YEAR([.B587]) -> 2021 | F587: of:=ROUNDUP(MONTH([.B587])/3;0) -> 3
A588: of:=[.A587]+1 -> 587 | B588: of:=[.B587]+1 -> 2021-08-09 | C588: of:=DAY([.B588]) -> 9 | D588: of:=WEEKNUM([.B588];1) -> 33 | E588: of:=YEAR([.B588]) -> 2021 | F588: of:=ROUNDUP(MONTH([.B588])/3;0) -> 3
A589: of:=[.A588]+1 -> 588 | B589: of:=[.B588]+1 -> 2021-08-10 | C589: of:=DAY([.B589]) -> 10 | D589: of:=WEEKNUM([.B589];1) -> 33 | E589: of:=YEAR([.B589]) -> 2021 | F589: of:=ROUNDUP(MONTH([.B589])/3;0) -> 3
A590: of:=[.A589]+1 -> 589 | B590: of:=[.B589]+1 -> 2021-08-11 | C590: of:=DAY([.B590]) -> 11 | D590: of:=WEEKNUM([.B590];1) -> 33 | E590: of:=YEAR([.B590]) -> 2021 | F590: of:=ROUNDUP(MONTH([.B590])/3;0) -> 3
A591: of:=[.A590]+1 -> 590 | B591: of:=[.B590]+1 -> 2021-08-12 | C591: of:=DAY([.B591]) -> 12 | D591: of:=WEEKNUM([.B591];1) -> 33 | E591: of:=YEAR([.B591]) -> 2021 | F591: of:=ROUNDUP(MONTH([.B591])/3;0) -> 3
A592: of:=[.A591]+1 -> 591 | B592: of:=[.B591]+1 -> 2021-08-13 | C592: of:=DAY([.B592]) -> 13 | D592: of:=WEEKNUM([.B592];1) -> 33 | E592: of:=YEAR([.B592]) -> 2021 | F592: of:=ROUNDUP(MONTH([.B592])/3;0) -> 3
A593: of:=[.A592]+1 -> 592 | B593: of:=[.B592]+1 -> 2021-08-14 | C593: of:=DAY([.B593]) -> 14 | D593: of:=WEEKNUM([.B593];1) -> 33 | E593: of:=YEAR([.B593]) -> 2021 | F593: of:=ROUNDUP(MONTH([.B593])/3;0) -> 3
A594: of:=[.A593]+1 -> 593 | B594: of:=[.B593]+1 -> 2021-08-15 | C594: of:=DAY([.B594]) -> 15 | D594: of:=WEEKNUM([.B594];1) -> 34 | E594: of:=YEAR([.B594]) -> 2021 | F594: of:=ROUNDUP(MONTH([.B594])/3;0) -> 3
A595: of:=[.A594]+1 -> 594 | B595: of:=[.B594]+1 -> 2021-08-16 | C595: of:=DAY([.B595]) -> 16 | D595: of:=WEEKNUM([.B595];1) -> 34 | E595: of:=YEAR([.B595]) -> 2021 | F595: of:=ROUNDUP(MONTH([.B595])/3;0) -> 3
A596: of:=[.A595]+1 -> 595 | B596: of:=[.B595]+1 -> 2021-08-17 | C596: of:=DAY([.B596]) -> 17 | D596: of:=WEEKNUM([.B596];1) -> 34 | E596: of:=YEAR([.B596]) -> 2021 | F596: of:=ROUNDUP(MONTH([.B596])/3;0) -> 3
A597: of:=[.A596]+1 -> 596 | B597: of:=[.B596]+1 -> 2021-08-18 | C597: of:=DAY([.B597]) -> 18 | D597: of:=WEEKNUM([.B597];1) -> 34 | E597: of:=YEAR([.B597]) -> 2021 | F597: of:=ROUNDUP(MONTH([.B597])/3;0) -> 3
A598: of:=[.A597]+1 -> 597 | B598: of:=[.B597]+1 -> 2021-08-19 | C598: of:=DAY([.B598]) -> 19 | D598: of:=WEEKNUM([.B598];1) -> 34 | E598: of:=YEAR([.B598]) -> 2021 | F598: of:=ROUNDUP(MONTH([.B598])/3;0) -> 3
A599: of:=[.A598]+1 -> 598 | B599: of:=[.B598]+1 -> 2021-08-20 | C599: of:=DAY([.B599]) -> 20 | D599: of:=WEEKNUM([.B599];1) -> 34 | E599: of:=YEAR([.B599]) -> 2021 | F599: of:=ROUNDUP(MONTH([.B599])/3;0) -> 3
A600: of:=[.A599]+1 -> 599 | B600: of:=[.B599]+1 -> 2021-08-21 | C600: of:=DAY([.B600]) -> 21 | D600: of:=WEEKNUM([.B600];1) -> 34 | E600: of:=YEAR([.B600]) -> 2021 | F600: of:=ROUNDUP(MONTH([.B600])/3;0) -> 3
A601: of:=[.A600]+1 -> 600 | B601: of:=[.B600]+1 -> 2021-08-22 | C601: of:=DAY([.B601]) -> 22 | D601: of:=WEEKNUM([.B601];1) -> 35 | E601: of:=YEAR([.B601]) -> 2021 | F601: of:=ROUNDUP(MONTH([.B601])/3;0) -> 3
A602: of:=[.A601]+1 -> 601 | B602: of:=[.B601]+1 -> 2021-08-23 | C602: of:=DAY([.B602]) -> 23 | D602: of:=WEEKNUM([.B602];1) -> 35 | E602: of:=YEAR([.B602]) -> 2021 | F602: of:=ROUNDUP(MONTH([.B602])/3;0) -> 3
A603: of:=[.A602]+1 -> 602 | B603: of:=[.B602]+1 -> 2021-08-24 | C603: of:=DAY([.B603]) -> 24 | D603: of:=WEEKNUM([.B603];1) -> 35 | E603: of:=YEAR([.B603]) -> 2021 | F603: of:=ROUNDUP(MONTH([.B603])/3;0) -> 3
A604: of:=[.A603]+1 -> 603 | B604: of:=[.B603]+1 -> 2021-08-25 | C604: of:=DAY([.B604]) -> 25 | D604: of:=WEEKNUM([.B604];1) -> 35 | E604: of:=YEAR([.B604]) -> 2021 | F604: of:=ROUNDUP(MONTH([.B604])/3;0) -> 3
A605: of:=[.A604]+1 -> 604 | B605: of:=[.B604]+1 -> 2021-08-26 | C605: of:=DAY([.B605]) -> 26 | D605: of:=WEEKNUM([.B605];1) -> 35 | E605: of:=YEAR([.B605]) -> 2021 | F605: of:=ROUNDUP(MONTH([.B605])/3;0) -> 3
A606: of:=[.A605]+1 -> 605 | B606: of:=[.B605]+1 -> 2021-08-27 | C606: of:=DAY([.B606]) -> 27 | D606: of:=WEEKNUM([.B606];1) -> 35 | E606: of:=YEAR([.B606]) -> 2021 | F606: of:=ROUNDUP(MONTH([.B606])/3;0) -> 3
A607: of:=[.A606]+1 -> 606 | B607: of:=[.B606]+1 -> 2021-08-28 | C607: of:=DAY([.B607]) -> 28 | D607: of:=WEEKNUM([.B607];1) -> 35 | E607: of:=YEAR([.B607]) -> 2021 | F607: of:=ROUNDUP(MONTH([.B607])/3;0) -> 3
A608: of:=[.A607]+1 -> 607 | B608: of:=[.B607]+1 -> 2021-08-29 | C608: of:=DAY([.B608]) -> 29 | D608: of:=WEEKNUM([.B608];1) -> 36 | E608: of:=YEAR([.B608]) -> 2021 | F608: of:=ROUNDUP(MONTH([.B608])/3;0) -> 3
A609: of:=[.A608]+1 -> 608 | B609: of:=[.B608]+1 -> 2021-08-30 | C609: of:=DAY([.B609]) -> 30 | D609: of:=WEEKNUM([.B609];1) -> 36 | E609: of:=YEAR([.B609]) -> 2021 | F609: of:=ROUNDUP(MONTH([.B609])/3;0) -> 3
A610: of:=[.A609]+1 -> 609 | B610: of:=[.B609]+1 -> 2021-08-31 | C610: of:=DAY([.B610]) -> 31 | D610: of:=WEEKNUM([.B610];1) -> 36 | E610: of:=YEAR([.B610]) -> 2021 | F610: of:=ROUNDUP(MONTH([.B610])/3;0) -> 3
A611: of:=[.A610]+1 -> 610 | B611: of:=[.B610]+1 -> 2021-09-01 | C611: of:=DAY([.B611]) -> 1 | D611: of:=WEEKNUM([.B611];1) -> 36 | E611: of:=YEAR([.B611]) -> 2021 | F611: of:=ROUNDUP(MONTH([.B611])/3;0) -> 3
A612: of:=[.A611]+1 -> 611 | B612: of:=[.B611]+1 -> 2021-09-02 | C612: of:=DAY([.B612]) -> 2 | D612: of:=WEEKNUM([.B612];1) -> 36 | E612: of:=YEAR([.B612]) -> 2021 | F612: of:=ROUNDUP(MONTH([.B612])/3;0) -> 3
A613: of:=[.A612]+1 -> 612 | B613: of:=[.B612]+1 -> 2021-09-03 | C613: of:=DAY([.B613]) -> 3 | D613: of:=WEEKNUM([.B613];1) -> 36 | E613: of:=YEAR([.B613]) -> 2021 | F613: of:=ROUNDUP(MONTH([.B613])/3;0) -> 3
A614: of:=[.A613]+1 -> 613 | B614: of:=[.B613]+1 -> 2021-09-04 | C614: of:=DAY([.B614]) -> 4 | D614: of:=WEEKNUM([.B614];1) -> 36 | E614: of:=YEAR([.B614]) -> 2021 | F614: of:=ROUNDUP(MONTH([.B614])/3;0) -> 3
A615: of:=[.A614]+1 -> 614 | B615: of:=[.B614]+1 -> 2021-09-05 | C615: of:=DAY([.B615]) -> 5 | D615: of:=WEEKNUM([.B615];1) -> 37 | E615: of:=YEAR([.B615]) -> 2021 | F615: of:=ROUNDUP(MONTH([.B615])/3;0) -> 3
A616: of:=[.A615]+1 -> 615 | B616: of:=[.B615]+1 -> 2021-09-06 | C616: of:=DAY([.B616]) -> 6 | D616: of:=WEEKNUM([.B616];1) -> 37 | E616: of:=YEAR([.B616]) -> 2021 | F616: of:=ROUNDUP(MONTH([.B616])/3;0) -> 3
A617: of:=[.A616]+1 -> 616 | B617: of:=[.B616]+1 -> 2021-09-07 | C617: of:=DAY([.B617]) -> 7 | D617: of:=WEEKNUM([.B617];1) -> 37 | E617: of:=YEAR([.B617]) -> 2021 | F617: of:=ROUNDUP(MONTH([.B617])/3;0) -> 3
A618: of:=[.A617]+1 -> 617 | B618: of:=[.B617]+1 -> 2021-09-08 | C618: of:=DAY([.B618]) -> 8 | D618: of:=WEEKNUM([.B618];1) -> 37 | E618: of:=YEAR([.B618]) -> 2021 | F618: of:=ROUNDUP(MONTH([.B618])/3;0) -> 3
A619: of:=[.A618]+1 -> 618 | B619: of:=[.B618]+1 -> 2021-09-09 | C619: of:=DAY([.B619]) -> 9 | D619: of:=WEEKNUM([.B619];1) -> 37 | E619: of:=YEAR([.B619]) -> 2021 | F619: of:=ROUNDUP(MONTH([.B619])/3;0) -> 3
A620: of:=[.A619]+1 -> 619 | B620: of:=[.B619]+1 -> 2021-09-10 | C620: of:=DAY([.B620]) -> 10 | D620: of:=WEEKNUM([.B620];1) -> 37 | E620: of:=YEAR([.B620]) -> 2021 | F620: of:=ROUNDUP(MONTH([.B620])/3;0) -> 3
A621: of:=[.A620]+1 -> 620 | B621: of:=[.B620]+1 -> 2021-09-11 | C621: of:=DAY([.B621]) -> 11 | D621: of:=WEEKNUM([.B621];1) -> 37 | E621: of:=YEAR([.B621]) -> 2021 | F621: of:=ROUNDUP(MONTH([.B621])/3;0) -> 3
A622: of:=[.A621]+1 -> 621 | B622: of:=[.B621]+1 -> 2021-09-12 | C622: of:=DAY([.B622]) -> 12 | D622: of:=WEEKNUM([.B622];1) -> 38 | E622: of:=YEAR([.B622]) -> 2021 | F622: of:=ROUNDUP(MONTH([.B622])/3;0) -> 3
A623: of:=[.A622]+1 -> 622 | B623: of:=[.B622]+1 -> 2021-09-13 | C623: of:=DAY([.B623]) -> 13 | D623: of:=WEEKNUM([.B623];1) -> 38 | E623: of:=YEAR([.B623]) -> 2021 | F623: of:=ROUNDUP(MONTH([.B623])/3;0) -> 3
A624: of:=[.A623]+1 -> 623 | B624: of:=[.B623]+1 -> 2021-09-14 | C624: of:=DAY([.B624]) -> 14 | D624: of:=WEEKNUM([.B624];1) -> 38 | E624: of:=YEAR([.B624]) -> 2021 | F624: of:=ROUNDUP(MONTH([.B624])/3;0) -> 3
A625: of:=[.A624]+1 -> 624 | B625: of:=[.B624]+1 -> 2021-09-15 | C625: of:=DAY([.B625]) -> 15 | D625: of:=WEEKNUM([.B625];1) -> 38 | E625: of:=YEAR([.B625]) -> 2021 | F625: of:=ROUNDUP(MONTH([.B625])/3;0) -> 3
A626: of:=[.A625]+1 -> 625 | B626: of:=[.B625]+1 -> 2021-09-16 | C626: of:=DAY([.B626]) -> 16 | D626: of:=WEEKNUM([.B626];1) -> 38 | E626: of:=YEAR([.B626]) -> 2021 | F626: of:=ROUNDUP(MONTH([.B626])/3;0) -> 3
A627: of:=[.A626]+1 -> 626 | B627: of:=[.B626]+1 -> 2021-09-17 | C627: of:=DAY([.B627]) -> 17 | D627: of:=WEEKNUM([.B627];1) -> 38 | E627: of:=YEAR([.B627]) -> 2021 | F627: of:=ROUNDUP(MONTH([.B627])/3;0) -> 3
A628: of:=[.A627]+1 -> 627 | B628: of:=[.B627]+1 -> 2021-09-18 | C628: of:=DAY([.B628]) -> 18 | D628: of:=WEEKNUM([.B628];1) -> 38 | E628: of:=YEAR([.B628]) -> 2021 | F628: of:=ROUNDUP(MONTH([.B628])/3;0) -> 3
A629: of:=[.A628]+1 -> 628 | B629: of:=[.B628]+1 -> 2021-09-19 | C629: of:=DAY([.B629]) -> 19 | D629: of:=WEEKNUM([.B629];1) -> 39 | E629: of:=YEAR([.B629]) -> 2021 | F629: of:=ROUNDUP(MONTH([.B629])/3;0) -> 3
A630: of:=[.A629]+1 -> 629 | B630: of:=[.B629]+1 -> 2021-09-20 | C630: of:=DAY([.B630]) -> 20 | D630: of:=WEEKNUM([.B630];1) -> 39 | E630: of:=YEAR([.B630]) -> 2021 | F630: of:=ROUNDUP(MONTH([.B630])/3;0) -> 3
A631: of:=[.A630]+1 -> 630 | B631: of:=[.B630]+1 -> 2021-09-21 | C631: of:=DAY([.B631]) -> 21 | D631: of:=WEEKNUM([.B631];1) -> 39 | E631: of:=YEAR([.B631]) -> 2021 | F631: of:=ROUNDUP(MONTH([.B631])/3;0) -> 3
A632: of:=[.A631]+1 -> 631 | B632: of:=[.B631]+1 -> 2021-09-22 | C632: of:=DAY([.B632]) -> 22 | D632: of:=WEEKNUM([.B632];1) -> 39 | E632: of:=YEAR([.B632]) -> 2021 | F632: of:=ROUNDUP(MONTH([.B632])/3;0) -> 3
A633: of:=[.A632]+1 -> 632 | B633: of:=[.B632]+1 -> 2021-09-23 | C633: of:=DAY([.B633]) -> 23 | D633: of:=WEEKNUM([.B633];1) -> 39 | E633: of:=YEAR([.B633]) -> 2021 | F633: of:=ROUNDUP(MONTH([.B633])/3;0) -> 3
A634: of:=[.A633]+1 -> 633 | B634: of:=[.B633]+1 -> 2021-09-24 | C634: of:=DAY([.B634]) -> 24 | D634: of:=WEEKNUM([.B634];1) -> 39 | E634: of:=YEAR([.B634]) -> 2021 | F634: of:=ROUNDUP(MONTH([.B634])/3;0) -> 3
A635: of:=[.A634]+1 -> 634 | B635: of:=[.B634]+1 -> 2021-09-25 | C635: of:=DAY([.B635]) -> 25 | D635: of:=WEEKNUM([.B635];1) -> 39 | E635: of:=YEAR([.B635]) -> 2021 | F635: of:=ROUNDUP(MONTH([.B635])/3;0) -> 3
A636: of:=[.A635]+1 -> 635 | B636: of:=[.B635]+1 -> 2021-09-26 | C636: of:=DAY([.B636]) -> 26 | D636: of:=WEEKNUM([.B636];1) -> 40 | E636: of:=YEAR([.B636]) -> 2021 | F636: of:=ROUNDUP(MONTH([.B636])/3;0) -> 3
A637: of:=[.A636]+1 -> 636 | B637: of:=[.B636]+1 -> 2021-09-27 | C637: of:=DAY([.B637]) -> 27 | D637: of:=WEEKNUM([.B637];1) -> 40 | E637: of:=YEAR([.B637]) -> 2021 | F637: of:=ROUNDUP(MONTH([.B637])/3;0) -> 3
A638: of:=[.A637]+1 -> 637 | B638: of:=[.B637]+1 -> 2021-09-28 | C638: of:=DAY([.B638]) -> 28 | D638: of:=WEEKNUM([.B638];1) -> 40 | E638: of:=YEAR([.B638]) -> 2021 | F638: of:=ROUNDUP(MONTH([.B638])/3;0) -> 3
A639: of:=[.A638]+1 -> 638 | B639: of:=[.B638]+1 -> 2021-09-29 | C639: of:=DAY([.B639]) -> 29 | D639: of:=WEEKNUM([.B639];1) -> 40 | E639: of:=YEAR([.B639]) -> 2021 | F639: of:=ROUNDUP(MONTH([.B639])/3;0) -> 3
A640: of:=[.A639]+1 -> 639 | B640: of:=[.B639]+1 -> 2021-09-30 | C640: of:=DAY([.B640]) -> 30 | D640: of:=WEEKNUM([.B640];1) -> 40 | E640: of:=YEAR([.B640]) -> 2021 | F640: of:=ROUNDUP(MONTH([.B640])/3;0) -> 3
A641: of:=[.A640]+1 -> 640 | B641: of:=[.B640]+1 -> 2021-10-01 | C641: of:=DAY([.B641]) -> 1 | D641: of:=WEEKNUM([.B641];1) -> 40 | E641: of:=YEAR([.B641]) -> 2021 | F641: of:=ROUNDUP(MONTH([.B641])/3;0) -> 4
A642: of:=[.A641]+1 -> 641 | B642: of:=[.B641]+1 -> 2021-10-02 | C642: of:=DAY([.B642]) -> 2 | D642: of:=WEEKNUM([.B642];1) -> 40 | E642: of:=YEAR([.B642]) -> 2021 | F642: of:=ROUNDUP(MONTH([.B642])/3;0) -> 4
A643: of:=[.A642]+1 -> 642 | B643: of:=[.B642]+1 -> 2021-10-03 | C643: of:=DAY([.B643]) -> 3 | D643: of:=WEEKNUM([.B643];1) -> 41 | E643: of:=YEAR([.B643]) -> 2021 | F643: of:=ROUNDUP(MONTH([.B643])/3;0) -> 4
A644: of:=[.A643]+1 -> 643 | B644: of:=[.B643]+1 -> 2021-10-04 | C644: of:=DAY([.B644]) -> 4 | D644: of:=WEEKNUM([.B644];1) -> 41 | E644: of:=YEAR([.B644]) -> 2021 | F644: of:=ROUNDUP(MONTH([.B644])/3;0) -> 4
A645: of:=[.A644]+1 -> 644 | B645: of:=[.B644]+1 -> 2021-10-05 | C645: of:=DAY([.B645]) -> 5 | D645: of:=WEEKNUM([.B645];1) -> 41 | E645: of:=YEAR([.B645]) -> 2021 | F645: of:=ROUNDUP(MONTH([.B645])/3;0) -> 4
A646: of:=[.A645]+1 -> 645 | B646: of:=[.B645]+1 -> 2021-10-06 | C646: of:=DAY([.B646]) -> 6 | D646: of:=WEEKNUM([.B646];1) -> 41 | E646: of:=YEAR([.B646]) -> 2021 | F646: of:=ROUNDUP(MONTH([.B646])/3;0) -> 4
A647: of:=[.A646]+1 -> 646 | B647: of:=[.B646]+1 -> 2021-10-07 | C647: of:=DAY([.B647]) -> 7 | D647: of:=WEEKNUM([.B647];1) -> 41 | E647: of:=YEAR([.B647]) -> 2021 | F647: of:=ROUNDUP(MONTH([.B647])/3;0) -> 4
A648: of:=[.A647]+1 -> 647 | B648: of:=[.B647]+1 -> 2021-10-08 | C648: of:=DAY([.B648]) -> 8 | D648: of:=WEEKNUM([.B648];1) -> 41 | E648: of:=YEAR([.B648]) -> 2021 | F648: of:=ROUNDUP(MONTH([.B648])/3;0) -> 4
A649: of:=[.A648]+1 -> 648 | B649: of:=[.B648]+1 -> 2021-10-09 | C649: of:=DAY([.B649]) -> 9 | D649: of:=WEEKNUM([.B649];1) -> 41 | E649: of:=YEAR([.B649]) -> 2021 | F649: of:=ROUNDUP(MONTH([.B649])/3;0) -> 4
A650: of:=[.A649]+1 -> 649 | B650: of:=[.B649]+1 -> 2021-10-10 | C650: of:=DAY([.B650]) -> 10 | D650: of:=WEEKNUM([.B650];1) -> 42 | E650: of:=YEAR([.B650]) -> 2021 | F650: of:=ROUNDUP(MONTH([.B650])/3;0) -> 4
A651: of:=[.A650]+1 -> 650 | B651: of:=[.B650]+1 -> 2021-10-11 | C651: of:=DAY([.B651]) -> 11 | D651: of:=WEEKNUM([.B651];1) -> 42 | E651: of:=YEAR([.B651]) -> 2021 | F651: of:=ROUNDUP(MONTH([.B651])/3;0) -> 4
A652: of:=[.A651]+1 -> 651 | B652: of:=[.B651]+1 -> 2021-10-12 | C652: of:=DAY([.B652]) -> 12 | D652: of:=WEEKNUM([.B652];1) -> 42 | E652: of:=YEAR([.B652]) -> 2021 | F652: of:=ROUNDUP(MONTH([.B652])/3;0) -> 4
A653: of:=[.A652]+1 -> 652 | B653: of:=[.B652]+1 -> 2021-10-13 | C653: of:=DAY([.B653]) -> 13 | D653: of:=WEEKNUM([.B653];1) -> 42 | E653: of:=YEAR([.B653]) -> 2021 | F653: of:=ROUNDUP(MONTH([.B653])/3;0) -> 4
A654: of:=[.A653]+1 -> 653 | B654: of:=[.B653]+1 -> 2021-10-14 | C654: of:=DAY([.B654]) -> 14 | D654: of:=WEEKNUM([.B654];1) -> 42 | E654: of:=YEAR([.B654]) -> 2021 | F654: of:=ROUNDUP(MONTH([.B654])/3;0) -> 4
A655: of:=[.A654]+1 -> 654 | B655: of:=[.B654]+1 -> 2021-10-15 | C655: of:=DAY([.B655]) -> 15 | D655: of:=WEEKNUM([.B655];1) -> 42 | E655: of:=YEAR([.B655]) -> 2021 | F655: of:=ROUNDUP(MONTH([.B655])/3;0) -> 4
A656: of:=[.A655]+1 -> 655 | B656: of:=[.B655]+1 -> 2021-10-16 | C656: of:=DAY([.B656]) -> 16 | D656: of:=WEEKNUM([.B656];1) -> 42 | E656: of:=YEAR([.B656]) -> 2021 | F656: of:=ROUNDUP(MONTH([.B656])/3;0) -> 4
A657: of:=[.A656]+1 -> 656 | B657: of:=[.B656]+1 -> 2021-10-17 | C657: of:=DAY([.B657]) -> 17 | D657: of:=WEEKNUM([.B657];1) -> 43 | E657: of:=YEAR([.B657]) -> 2021 | F657: of:=ROUNDUP(MONTH([.B657])/3;0) -> 4
A658: of:=[.A657]+1 -> 657 | B658: of:=[.B657]+1 -> 2021-10-18 | C658: of:=DAY([.B658]) -> 18 | D658: of:=WEEKNUM([.B658];1) -> 43 | E658: of:=YEAR([.B658]) -> 2021 | F658: of:=ROUNDUP(MONTH([.B658])/3;0) -> 4
A659: of:=[.A658]+1 -> 658 | B659: of:=[.B658]+1 -> 2021-10-19 | C659: of:=DAY([.B659]) -> 19 | D659: of:=WEEKNUM([.B659];1) -> 43 | E659: of:=YEAR([.B659]) -> 2021 | F659: of:=ROUNDUP(MONTH([.B659])/3;0) -> 4
A660: of:=[.A659]+1 -> 659 | B660: of:=[.B659]+1 -> 2021-10-20 | C660: of:=DAY([.B660]) -> 20 | D660: of:=WEEKNUM([.B660];1) -> 43 | E660: of:=YEAR([.B660]) -> 2021 | F660: of:=ROUNDUP(MONTH([.B660])/3;0) -> 4
A661: of:=[.A660]+1 -> 660 | B661: of:=[.B660]+1 -> 2021-10-21 | C661: of:=DAY([.B661]) -> 21 | D661: of:=WEEKNUM([.B661];1) -> 43 | E661: of:=YEAR([.B661]) -> 2021 | F661: of:=ROUNDUP(MONTH([.B661])/3;0) -> 4
A662: of:=[.A661]+1 -> 661 | B662: of:=[.B661]+1 -> 2021-10-22 | C662: of:=DAY([.B662]) -> 22 | D662: of:=WEEKNUM([.B662];1) -> 43 | E662: of:=YEAR([.B662]) -> 2021 | F662: of:=ROUNDUP(MONTH([.B662])/3;0) -> 4
A663: of:=[.A662]+1 -> 662 | B663: of:=[.B662]+1 -> 2021-10-23 | C663: of:=DAY([.B663]) -> 23 | D663: of:=WEEKNUM([.B663];1) -> 43 | E663: of:=YEAR([.B663]) -> 2021 | F663: of:=ROUNDUP(MONTH([.B663])/3;0) -> 4
A664: of:=[.A663]+1 -> 663 | B664: of:=[.B663]+1 -> 2021-10-24 | C664: of:=DAY([.B664]) -> 24 | D664: of:=WEEKNUM([.B664];1) -> 44 | E664: of:=YEAR([.B664]) -> 2021 | F664: of:=ROUNDUP(MONTH([.B664])/3;0) -> 4
A665: of:=[.A664]+1 -> 664 | B665: of:=[.B664]+1 -> 2021-10-25 | C665: of:=DAY([.B665]) -> 25 | D665: of:=WEEKNUM([.B665];1) -> 44 | E665: of:=YEAR([.B665]) -> 2021 | F665: of:=ROUNDUP(MONTH([.B665])/3;0) -> 4
A666: of:=[.A665]+1 -> 665 | B666: of:=[.B665]+1 -> 2021-10-26 | C666: of:=DAY([.B666]) -> 26 | D666: of:=WEEKNUM([.B666];1) -> 44 | E666: of:=YEAR([.B666]) -> 2021 | F666: of:=ROUNDUP(MONTH([.B666])/3;0) -> 4
A667: of:=[.A666]+1 -> 666 | B667: of:=[.B666]+1 -> 2021-10-27 | C667: of:=DAY([.B667]) -> 27 | D667: of:=WEEKNUM([.B667];1) -> 44 | E667: of:=YEAR([.B667]) -> 2021 | F667: of:=ROUNDUP(MONTH([.B667])/3;0) -> 4
A668: of:=[.A667]+1 -> 667 | B668: of:=[.B667]+1 -> 2021-10-28 | C668: of:=DAY([.B668]) -> 28 | D668: of:=WEEKNUM([.B668];1) -> 44 | E668: of:=YEAR([.B668]) -> 2021 | F668: of:=ROUNDUP(MONTH([.B668])/3;0) -> 4
A669: of:=[.A668]+1 -> 668 | B669: of:=[.B668]+1 -> 2021-10-29 | C669: of:=DAY([.B669]) -> 29 | D669: of:=WEEKNUM([.B669];1) -> 44 | E669: of:=YEAR([.B669]) -> 2021 | F669: of:=ROUNDUP(MONTH([.B669])/3;0) -> 4
A670: of:=[.A669]+1 -> 669 | B670: of:=[.B669]+1 -> 2021-10-30 | C670: of:=DAY([.B670]) -> 30 | D670: of:=WEEKNUM([.B670];1) -> 44 | E670: of:=YEAR([.B670]) -> 2021 | F670: of:=ROUNDUP(MONTH([.B670])/3;0) -> 4
A671: of:=[.A670]+1 -> 670 | B671: of:=[.B670]+1 -> 2021-10-31 | C671: of:=DAY([.B671]) -> 31 | D671: of:=WEEKNUM([.B671];1) -> 45 | E671: of:=YEAR([.B671]) -> 2021 | F671: of:=ROUNDUP(MONTH([.B671])/3;0) -> 4
A672: of:=[.A671]+1 -> 671 | B672: of:=[.B671]+1 -> 2021-11-01 | C672: of:=DAY([.B672]) -> 1 | D672: of:=WEEKNUM([.B672];1) -> 45 | E672: of:=YEAR([.B672]) -> 2021 | F672: of:=ROUNDUP(MONTH([.B672])/3;0) -> 4
A673: of:=[.A672]+1 -> 672 | B673: of:=[.B672]+1 -> 2021-11-02 | C673: of:=DAY([.B673]) -> 2 | D673: of:=WEEKNUM([.B673];1) -> 45 | E673: of:=YEAR([.B673]) -> 2021 | F673: of:=ROUNDUP(MONTH([.B673])/3;0) -> 4
A674: of:=[.A673]+1 -> 673 | B674: of:=[.B673]+1 -> 2021-11-03 | C674: of:=DAY([.B674]) -> 3 | D674: of:=WEEKNUM([.B674];1) -> 45 | E674: of:=YEAR([.B674]) -> 2021 | F674: of:=ROUNDUP(MONTH([.B674])/3;0) -> 4
A675: of:=[.A674]+1 -> 674 | B675: of:=[.B674]+1 -> 2021-11-04 | C675: of:=DAY([.B675]) -> 4 | D675: of:=WEEKNUM([.B675];1) -> 45 | E675: of:=YEAR([.B675]) -> 2021 | F675: of:=ROUNDUP(MONTH([.B675])/3;0) -> 4
A676: of:=[.A675]+1 -> 675 | B676: of:=[.B675]+1 -> 2021-11-05 | C676: of:=DAY([.B676]) -> 5 | D676: of:=WEEKNUM([.B676];1) -> 45 | E676: of:=YEAR([.B676]) -> 2021 | F676: of:=ROUNDUP(MONTH([.B676])/3;0) -> 4
A677: of:=[.A676]+1 -> 676 | B677: of:=[.B676]+1 -> 2021-11-06 | C677: of:=DAY([.B677]) -> 6 | D677: of:=WEEKNUM([.B677];1) -> 45 | E677: of:=YEAR([.B677]) -> 2021 | F677: of:=ROUNDUP(MONTH([.B677])/3;0) -> 4
A678: of:=[.A677]+1 -> 677 | B678: of:=[.B677]+1 -> 2021-11-07 | C678: of:=DAY([.B678]) -> 7 | D678: of:=WEEKNUM([.B678];1) -> 46 | E678: of:=YEAR([.B678]) -> 2021 | F678: of:=ROUNDUP(MONTH([.B678])/3;0) -> 4
A679: of:=[.A678]+1 -> 678 | B679: of:=[.B678]+1 -> 2021-11-08 | C679: of:=DAY([.B679]) -> 8 | D679: of:=WEEKNUM([.B679];1) -> 46 | E679: of:=YEAR([.B679]) -> 2021 | F679: of:=ROUNDUP(MONTH([.B679])/3;0) -> 4
A680: of:=[.A679]+1 -> 679 | B680: of:=[.B679]+1 -> 2021-11-09 | C680: of:=DAY([.B680]) -> 9 | D680: of:=WEEKNUM([.B680];1) -> 46 | E680: of:=YEAR([.B680]) -> 2021 | F680: of:=ROUNDUP(MONTH([.B680])/3;0) -> 4
A681: of:=[.A680]+1 -> 680 | B681: of:=[.B680]+1 -> 2021-11-10 | C681: of:=DAY([.B681]) -> 10 | D681: of:=WEEKNUM([.B681];1) -> 46 | E681: of:=YEAR([.B681]) -> 2021 | F681: of:=ROUNDUP(MONTH([.B681])/3;0) -> 4
A682: of:=[.A681]+1 -> 681 | B682: of:=[.B681]+1 -> 2021-11-11 | C682: of:=DAY([.B682]) -> 11 | D682: of:=WEEKNUM([.B682];1) -> 46 | E682: of:=YEAR([.B682]) -> 2021 | F682: of:=ROUNDUP(MONTH([.B682])/3;0) -> 4
A683: of:=[.A682]+1 -> 682 | B683: of:=[.B682]+1 -> 2021-11-12 | C683: of:=DAY([.B683]) -> 12 | D683: of:=WEEKNUM([.B683];1) -> 46 | E683: of:=YEAR([.B683]) -> 2021 | F683: of:=ROUNDUP(MONTH([.B683])/3;0) -> 4
A684: of:=[.A683]+1 -> 683 | B684: of:=[.B683]+1 -> 2021-11-13 | C684: of:=DAY([.B684]) -> 13 | D684: of:=WEEKNUM([.B684];1) -> 46 | E684: of:=YEAR([.B684]) -> 2021 | F684: of:=ROUNDUP(MONTH([.B684])/3;0) -> 4
A685: of:=[.A684]+1 -> 684 | B685: of:=[.B684]+1 -> 2021-11-14 | C685: of:=DAY([.B685]) -> 14 | D685: of:=WEEKNUM([.B685];1) -> 47 | E685: of:=YEAR([.B685]) -> 2021 | F685: of:=ROUNDUP(MONTH([.B685])/3;0) -> 4
A686: of:=[.A685]+1 -> 685 | B686: of:=[.B685]+1 -> 2021-11-15 | C686: of:=DAY([.B686]) -> 15 | D686: of:=WEEKNUM([.B686];1) -> 47 | E686: of:=YEAR([.B686]) -> 2021 | F686: of:=ROUNDUP(MONTH([.B686])/3;0) -> 4
A687: of:=[.A686]+1 -> 686 | B687: of:=[.B686]+1 -> 2021-11-16 | C687: of:=DAY([.B687]) -> 16 | D687: of:=WEEKNUM([.B687];1) -> 47 | E687: of:=YEAR([.B687]) -> 2021 | F687: of:=ROUNDUP(MONTH([.B687])/3;0) -> 4
A688: of:=[.A687]+1 -> 687 | B688: of:=[.B687]+1 -> 2021-11-17 | C688: of:=DAY([.B688]) -> 17 | D688: of:=WEEKNUM([.B688];1) -> 47 | E688: of:=YEAR([.B688]) -> 2021 | F688: of:=ROUNDUP(MONTH([.B688])/3;0) -> 4
A689: of:=[.A688]+1 -> 688 | B689: of:=[.B688]+1 -> 2021-11-18 | C689: of:=DAY([.B689]) -> 18 | D689: of:=WEEKNUM([.B689];1) -> 47 | E689: of:=YEAR([.B689]) -> 2021 | F689: of:=ROUNDUP(MONTH([.B689])/3;0) -> 4
A690: of:=[.A689]+1 -> 689 | B690: of:=[.B689]+1 -> 2021-11-19 | C690: of:=DAY([.B690]) -> 19 | D690: of:=WEEKNUM([.B690];1) -> 47 | E690: of:=YEAR([.B690]) -> 2021 | F690: of:=ROUNDUP(MONTH([.B690])/3;0) -> 4
A691: of:=[.A690]+1 -> 690 | B691: of:=[.B690]+1 -> 2021-11-20 | C691: of:=DAY([.B691]) -> 20 | D691: of:=WEEKNUM([.B691];1) -> 47 | E691: of:=YEAR([.B691]) -> 2021 | F691: of:=ROUNDUP(MONTH([.B691])/3;0) -> 4
A692: of:=[.A691]+1 -> 691 | B692: of:=[.B691]+1 -> 2021-11-21 | C692: of:=DAY([.B692]) -> 21 | D692: of:=WEEKNUM([.B692];1) -> 48 | E692: of:=YEAR([.B692]) -> 2021 | F692: of:=ROUNDUP(MONTH([.B692])/3;0) -> 4
A693: of:=[.A692]+1 -> 692 | B693: of:=[.B692]+1 -> 2021-11-22 | C693: of:=DAY([.B693]) -> 22 | D693: of:=WEEKNUM([.B693];1) -> 48 | E693: of:=YEAR([.B693]) -> 2021 | F693: of:=ROUNDUP(MONTH([.B693])/3;0) -> 4
A694: of:=[.A693]+1 -> 693 | B694: of:=[.B693]+1 -> 2021-11-23 | C694: of:=DAY([.B694]) -> 23 | D694: of:=WEEKNUM([.B694];1) -> 48 | E694: of:=YEAR([.B694]) -> 2021 | F694: of:=ROUNDUP(MONTH([.B694])/3;0) -> 4
A695: of:=[.A694]+1 -> 694 | B695: of:=[.B694]+1 -> 2021-11-24 | C695: of:=DAY([.B695]) -> 24 | D695: of:=WEEKNUM([.B695];1) -> 48 | E695: of:=YEAR([.B695]) -> 2021 | F695: of:=ROUNDUP(MONTH([.B695])/3;0) -> 4
A696: of:=[.A695]+1 -> 695 | B696: of:=[.B695]+1 -> 2021-11-25 | C696: of:=DAY([.B696]) -> 25 | D696: of:=WEEKNUM([.B696];1) -> 48 | E696: of:=YEAR([.B696]) -> 2021 | F696: of:=ROUNDUP(MONTH([.B696])/3;0) -> 4
A697: of:=[.A696]+1 -> 696 | B697: of:=[.B696]+1 -> 2021-11-26 | C697: of:=DAY([.B697]) -> 26 | D697: of:=WEEKNUM([.B697];1) -> 48 | E697: of:=YEAR([.B697]) -> 2021 | F697: of:=ROUNDUP(MONTH([.B697])/3;0) -> 4
A698: of:=[.A697]+1 -> 697 | B698: of:=[.B697]+1 -> 2021-11-27 | C698: of:=DAY([.B698]) -> 27 | D698: of:=WEEKNUM([.B698];1) -> 48 | E698: of:=YEAR([.B698]) -> 2021 | F698: of:=ROUNDUP(MONTH([.B698])/3;0) -> 4
A699: of:=[.A698]+1 -> 698 | B699: of:=[.B698]+1 -> 2021-11-28 | C699: of:=DAY([.B699]) -> 28 | D699: of:=WEEKNUM([.B699];1) -> 49 | E699: of:=YEAR([.B699]) -> 2021 | F699: of:=ROUNDUP(MONTH([.B699])/3;0) -> 4
A700: of:=[.A699]+1 -> 699 | B700: of:=[.B699]+1 -> 2021-11-29 | C700: of:=DAY([.B700]) -> 29 | D700: of:=WEEKNUM([.B700];1) -> 49 | E700: of:=YEAR([.B700]) -> 2021 | F700: of:=ROUNDUP(MONTH([.B700])/3;0) -> 4
A701: of:=[.A700]+1 -> 700 | B701: of:=[.B700]+1 -> 2021-11-30 | C701: of:=DAY([.B701]) -> 30 | D701: of:=WEEKNUM([.B701];1) -> 49 | E701: of:=YEAR([.B701]) -> 2021 | F701: of:=ROUNDUP(MONTH([.B701])/3;0) -> 4
A702: of:=[.A701]+1 -> 701 | B702: of:=[.B701]+1 -> 2021-12-01 | C702: of:=DAY([.B702]) -> 1 | D702: of:=WEEKNUM([.B702];1) -> 49 | E702: of:=YEAR([.B702]) -> 2021 | F702: of:=ROUNDUP(MONTH([.B702])/3;0) -> 4
A703: of:=[.A702]+1 -> 702 | B703: of:=[.B702]+1 -> 2021-12-02 | C703: of:=DAY([.B703]) -> 2 | D703: of:=WEEKNUM([.B703];1) -> 49 | E703: of:=YEAR([.B703]) -> 2021 | F703: of:=ROUNDUP(MONTH([.B703])/3;0) -> 4
A704: of:=[.A703]+1 -> 703 | B704: of:=[.B703]+1 -> 2021-12-03 | C704: of:=DAY([.B704]) -> 3 | D704: of:=WEEKNUM([.B704];1) -> 49 | E704: of:=YEAR([.B704]) -> 2021 | F704: of:=ROUNDUP(MONTH([.B704])/3;0) -> 4
A705: of:=[.A704]+1 -> 704 | B705: of:=[.B704]+1 -> 2021-12-04 | C705: of:=DAY([.B705]) -> 4 | D705: of:=WEEKNUM([.B705];1) -> 49 | E705: of:=YEAR([.B705]) -> 2021 | F705: of:=ROUNDUP(MONTH([.B705])/3;0) -> 4
A706: of:=[.A705]+1 -> 705 | B706: of:=[.B705]+1 -> 2021-12-05 | C706: of:=DAY([.B706]) -> 5 | D706: of:=WEEKNUM([.B706];1) -> 50 | E706: of:=YEAR([.B706]) -> 2021 | F706: of:=ROUNDUP(MONTH([.B706])/3;0) -> 4
A707: of:=[.A706]+1 -> 706 | B707: of:=[.B706]+1 -> 2021-12-06 | C707: of:=DAY([.B707]) -> 6 | D707: of:=WEEKNUM([.B707];1) -> 50 | E707: of:=YEAR([.B707]) -> 2021 | F707: of:=ROUNDUP(MONTH([.B707])/3;0) -> 4
A708: of:=[.A707]+1 -> 707 | B708: of:=[.B707]+1 -> 2021-12-07 | C708: of:=DAY([.B708]) -> 7 | D708: of:=WEEKNUM([.B708];1) -> 50 | E708: of:=YEAR([.B708]) -> 2021 | F708: of:=ROUNDUP(MONTH([.B708])/3;0) -> 4
A709: of:=[.A708]+1 -> 708 | B709: of:=[.B708]+1 -> 2021-12-08 | C709: of:=DAY([.B709]) -> 8 | D709: of:=WEEKNUM([.B709];1) -> 50 | E709: of:=YEAR([.B709]) -> 2021 | F709: of:=ROUNDUP(MONTH([.B709])/3;0) -> 4
A710: of:=[.A709]+1 -> 709 | B710: of:=[.B709]+1 -> 2021-12-09 | C710: of:=DAY([.B710]) -> 9 | D710: of:=WEEKNUM([.B710];1) -> 50 | E710: of:=YEAR([.B710]) -> 2021 | F710: of:=ROUNDUP(MONTH([.B710])/3;0) -> 4
A711: of:=[.A710]+1 -> 710 | B711: of:=[.B710]+1 -> 2021-12-10 | C711: of:=DAY([.B711]) -> 10 | D711: of:=WEEKNUM([.B711];1) -> 50 | E711: of:=YEAR([.B711]) -> 2021 | F711: of:=ROUNDUP(MONTH([.B711])/3;0) -> 4
A712: of:=[.A711]+1 -> 711 | B712: of:=[.B711]+1 -> 2021-12-11 | C712: of:=DAY([.B712]) -> 11 | D712: of:=WEEKNUM([.B712];1) -> 50 | E712: of:=YEAR([.B712]) -> 2021 | F712: of:=ROUNDUP(MONTH([.B712])/3;0) -> 4
A713: of:=[.A712]+1 -> 712 | B713: of:=[.B712]+1 -> 2021-12-12 | C713: of:=DAY([.B713]) -> 12 | D713: of:=WEEKNUM([.B713];1) -> 51 | E713: of:=YEAR([.B713]) -> 2021 | F713: of:=ROUNDUP(MONTH([.B713])/3;0) -> 4
A714: of:=[.A713]+1 -> 713 | B714: of:=[.B713]+1 -> 2021-12-13 | C714: of:=DAY([.B714]) -> 13 | D714: of:=WEEKNUM([.B714];1) -> 51 | E714: of:=YEAR([.B714]) -> 2021 | F714: of:=ROUNDUP(MONTH([.B714])/3;0) -> 4
A715: of:=[.A714]+1 -> 714 | B715: of:=[.B714]+1 -> 2021-12-14 | C715: of:=DAY([.B715]) -> 14 | D715: of:=WEEKNUM([.B715];1) -> 51 | E715: of:=YEAR([.B715]) -> 2021 | F715: of:=ROUNDUP(MONTH([.B715])/3;0) -> 4
A716: of:=[.A715]+1 -> 715 | B716: of:=[.B715]+1 -> 2021-12-15 | C716: of:=DAY([.B716]) -> 15 | D716: of:=WEEKNUM([.B716];1) -> 51 | E716: of:=YEAR([.B716]) -> 2021 | F716: of:=ROUNDUP(MONTH([.B716])/3;0) -> 4
A717: of:=[.A716]+1 -> 716 | B717: of:=[.B716]+1 -> 2021-12-16 | C717: of:=DAY([.B717]) -> 16 | D717: of:=WEEKNUM([.B717];1) -> 51 | E717: of:=YEAR([.B717]) -> 2021 | F717: of:=ROUNDUP(MONTH([.B717])/3;0) -> 4
A718: of:=[.A717]+1 -> 717 | B718: of:=[.B717]+1 -> 2021-12-17 | C718: of:=DAY([.B718]) -> 17 | D718: of:=WEEKNUM([.B718];1) -> 51 | E718: of:=YEAR([.B718]) -> 2021 | F718: of:=ROUNDUP(MONTH([.B718])/3;0) -> 4
A719: of:=[.A718]+1 -> 718 | B719: of:=[.B718]+1 -> 2021-12-18 | C719: of:=DAY([.B719]) -> 18 | D719: of:=WEEKNUM([.B719];1) -> 51 | E719: of:=YEAR([.B719]) -> 2021 | F719: of:=ROUNDUP(MONTH([.B719])/3;0) -> 4
A720: of:=[.A719]+1 -> 719 | B720: of:=[.B719]+1 -> 2021-12-19 | C720: of:=DAY([.B720]) -> 19 | D720: of:=WEEKNUM([.B720];1) -> 52 | E720: of:=YEAR([.B720]) -> 2021 | F720: of:=ROUNDUP(MONTH([.B720])/3;0) -> 4
A721: of:=[.A720]+1 -> 720 | B721: of:=[.B720]+1 -> 2021-12-20 | C721: of:=DAY([.B721]) -> 20 | D721: of:=WEEKNUM([.B721];1) -> 52 | E721: of:=YEAR([.B721]) -> 2021 | F721: of:=ROUNDUP(MONTH([.B721])/3;0) -> 4
A722: of:=[.A721]+1 -> 721 | B722: of:=[.B721]+1 -> 2021-12-21 | C722: of:=DAY([.B722]) -> 21 | D722: of:=WEEKNUM([.B722];1) -> 52 | E722: of:=YEAR([.B722]) -> 2021 | F722: of:=ROUNDUP(MONTH([.B722])/3;0) -> 4
A723: of:=[.A722]+1 -> 722 | B723: of:=[.B722]+1 -> 2021-12-22 | C723: of:=DAY([.B723]) -> 22 | D723: of:=WEEKNUM([.B723];1) -> 52 | E723: of:=YEAR([.B723]) -> 2021 | F723: of:=ROUNDUP(MONTH([.B723])/3;0) -> 4
A724: of:=[.A723]+1 -> 723 | B724: of:=[.B723]+1 -> 2021-12-23 | C724: of:=DAY([.B724]) -> 23 | D724: of:=WEEKNUM([.B724];1) -> 52 | E724: of:=YEAR([.B724]) -> 2021 | F724: of:=ROUNDUP(MONTH([.B724])/3;0) -> 4
A725: of:=[.A724]+1 -> 724 | B725: of:=[.B724]+1 -> 2021-12-24 | C725: of:=DAY([.B725]) -> 24 | D725: of:=WEEKNUM([.B725];1) -> 52 | E725: of:=YEAR([.B725]) -> 2021 | F725: of:=ROUNDUP(MONTH([.B725])/3;0) -> 4
A726: of:=[.A725]+1 -> 725 | B726: of:=[.B725]+1 -> 2021-12-25 | C726: of:=DAY([.B726]) -> 25 | D726: of:=WEEKNUM([.B726];1) -> 52 | E726: of:=YEAR([.B726]) -> 2021 | F726: of:=ROUNDUP(MONTH([.B726])/3;0) -> 4
A727: of:=[.A726]+1 -> 726 | B727: of:=[.B726]+1 -> 2021-12-26 | C727: of:=DAY([.B727]) -> 26 | D727: of:=WEEKNUM([.B727];1) -> 1 | E727: of:=YEAR([.B727]) -> 2021 | F727: of:=ROUNDUP(MONTH([.B727])/3;0) -> 4
A728: of:=[.A727]+1 -> 727 | B728: of:=[.B727]+1 -> 2021-12-27 | C728: of:=DAY([.B728]) -> 27 | D728: of:=WEEKNUM([.B728];1) -> 1 | E728: of:=YEAR([.B728]) -> 2021 | F728: of:=ROUNDUP(MONTH([.B728])/3;0) -> 4
A729: of:=[.A728]+1 -> 728 | B729: of:=[.B728]+1 -> 2021-12-28 | C729: of:=DAY([.B729]) -> 28 | D729: of:=WEEKNUM([.B729];1) -> 1 | E729: of:=YEAR([.B729]) -> 2021 | F729: of:=ROUNDUP(MONTH([.B729])/3;0) -> 4
A730: of:=[.A729]+1 -> 729 | B730: of:=[.B729]+1 -> 2021-12-29 | C730: of:=DAY([.B730]) -> 29 | D730: of:=WEEKNUM([.B730];1) -> 1 | E730: of:=YEAR([.B730]) -> 2021 | F730: of:=ROUNDUP(MONTH([.B730])/3;0) -> 4
A731: of:=[.A730]+1 -> 730 | B731: of:=[.B730]+1 -> 2021-12-30 | C731: of:=DAY([.B731]) -> 30 | D731: of:=WEEKNUM([.B731];1) -> 1 | E731: of:=YEAR([.B731]) -> 2021 | F731: of:=ROUNDUP(MONTH([.B731])/3;0) -> 4